day_b,city_id,driver_uuid,vehicle_uuid,partner_uuid,uuid,request_timestamp_local,status,is_cash_trip,begintrip_timestamp_local,begintrip_lat,begintrip_lng,destination_lat,destination_lng,dropoff_timestamp_local,dropoff_lat,dropoff_lng,Trip UUID,Driver UUID,Driver first name,Driver surname,Vehicle UUID,Number plate,Service type,Trip request time,Trip drop-off time,Pick-up address,Drop-off address,Trip distance,Trip status,Hour,DayOfWeek
2022-11-18,215,01de2a4e-13da-47d1-aca7-40642a11a262,8c1959a6-dd17-49ee-86d7-c1740d69b5a8,cc02d9ec-aa51-46b5-aeb3-af0516e988ab,7e1353d0-7b9a-4542-830a-74b3f013bfe7,2022-11-18 14:47:15,rider_canceled,True,,19.062946,72.85501,18.948694,72.85501,,19.0743283,72.84703505,7e1353d0-7b9a-4542-830a-74b3f013bfe7,01de2a4e-13da-47d1-aca7-40642a11a262,TBREJ,KHAN,8c1959a6-dd17-49ee-86d7-c1740d69b5a8,MH01DR8135,personal_transport,2022-11-18 14:47:15,0,"Nafees Chambers, Lokmanya Tilak Rd, Mandvi Koliwada, Chhatrapati Shivaji Terminus Area, Fort, Mumbai, Maharashtra 400001, India","Nafees Chambers, Lokmanya Tilak Rd, Mandvi Koliwada, Chhatrapati Shivaji Terminus Area, Fort, Mumbai, Maharashtra 400001, India",0.0,rider_cancelled,14,Friday
2022-11-18,215,01de2a4e-13da-47d1-aca7-40642a11a262,8c1959a6-dd17-49ee-86d7-c1740d69b5a8,cc02d9ec-aa51-46b5-aeb3-af0516e988ab,fccab4aa-5855-4cef-b25e-93f01c4b60b1,2022-11-18 15:13:17,completed,False,2022-11-18 15:21:49,19.076702,72.850685,19.14808,72.850685,2022-11-18 15:53:30,19.149824,72.854744,fccab4aa-5855-4cef-b25e-93f01c4b60b1,01de2a4e-13da-47d1-aca7-40642a11a262,TBREJ,KHAN,8c1959a6-dd17-49ee-86d7-c1740d69b5a8,MH01DR8135,personal_transport,2022-11-18 15:13:17,2022-11-18 15:53:30,Grand Hyatt Mumbai,"NESCO, Goregaon, Mumbai, Maharashtra 400063, India",10.01,completed,15,Friday
2022-11-18,215,01de2a4e-13da-47d1-aca7-40642a11a262,8c1959a6-dd17-49ee-86d7-c1740d69b5a8,cc02d9ec-aa51-46b5-aeb3-af0516e988ab,a2fe7529-a566-4ffe-a357-ae91e3530a60,2022-11-18 15:53:35,completed,True,2022-11-18 16:13:51,19.165764,72.85647,19.02182,72.85647,2022-11-18 17:01:56,19.022142,72.84252,a2fe7529-a566-4ffe-a357-ae91e3530a60,01de2a4e-13da-47d1-aca7-40642a11a262,TBREJ,KHAN,8c1959a6-dd17-49ee-86d7-c1740d69b5a8,MH01DR8135,personal_transport,2022-11-18 15:53:35,2022-11-18 17:01:56,"Shantprabha Society, Pahadi Rd, Shreyas Colony, Jay Prakash Nagar, Goregaon, Mumbai, Maharashtra 400063, India","AARA COUTURE by M/s. AARTEE'S SELECTION , Akanksha Building, Opp. Plaza Cinema, N C. Kelkar Rd, Dadar West, Dadar, Mumbai, Maharashtra 400028, India",18.18,completed,15,Friday
2022-11-18,215,01de2a4e-13da-47d1-aca7-40642a11a262,8c1959a6-dd17-49ee-86d7-c1740d69b5a8,cc02d9ec-aa51-46b5-aeb3-af0516e988ab,323b2bf3-fe7f-4326-9fdc-3bbf8c6a5acc,2022-11-18 17:00:51,completed,True,2022-11-18 17:09:16,19.020638,72.84146,19.009243,72.84146,2022-11-18 17:36:22,19.009394,72.85308,323b2bf3-fe7f-4326-9fdc-3bbf8c6a5acc,01de2a4e-13da-47d1-aca7-40642a11a262,TBREJ,KHAN,8c1959a6-dd17-49ee-86d7-c1740d69b5a8,MH01DR8135,personal_transport,2022-11-18 17:00:51,2022-11-18 17:36:22,"30, N C. Kelkar Rd, near Indian Bank, Dadar West, Dadar, Mumbai, Maharashtra 400028, India","2V53+JG5, 2, Rafi Ahmed Kidwai Rd, Kidwai Nagar, Wadala, Mumbai, Maharashtra 400031, India",6.5,completed,17,Friday
2022-11-18,215,01de2a4e-13da-47d1-aca7-40642a11a262,8c1959a6-dd17-49ee-86d7-c1740d69b5a8,cc02d9ec-aa51-46b5-aeb3-af0516e988ab,86fb2023-07ba-4df9-b851-9109de72b2bb,2022-11-18 17:43:30,completed,False,2022-11-18 17:50:47,19.011808,72.84886,19.107582,72.84886,2022-11-18 19:18:25,19.105934,72.87465,86fb2023-07ba-4df9-b851-9109de72b2bb,01de2a4e-13da-47d1-aca7-40642a11a262,TBREJ,KHAN,8c1959a6-dd17-49ee-86d7-c1740d69b5a8,MH01DR8135,personal_transport,2022-11-18 17:43:30,2022-11-18 19:18:25,"Naigaon, Dadar, Mumbai, Maharashtra 400014, India","B-1 Times Square Building Near Marol Metro Station, Andheri - Kurla Rd, Gamdevi, Marol, Andheri East, Mumbai, Maharashtra 400059, India",18.39,completed,17,Friday
