day_b,city_id,driver_uuid,vehicle_uuid,partner_uuid,uuid,request_timestamp_local,status,is_cash_trip,begintrip_timestamp_local,begintrip_lat,begintrip_lng,destination_lat,destination_lng,dropoff_timestamp_local,dropoff_lat,dropoff_lng,Trip UUID,Driver UUID,Driver first name,Driver surname,Vehicle UUID,Number plate,Service type,Trip request time,Trip drop-off time,Pick-up address,Drop-off address,Trip distance,Trip status,Hour,DayOfWeek
2022-11-18,215,04cbbb92-f65f-4942-b8d3-5e6e9047b8ea,0818145f-1ddb-443f-bc59-a357b4ac25ef,3b4d8666-3ea1-45a1-b270-f879eed28df0,cf2fcf00-f78a-4907-ac1b-a440d327c638,2022-11-18 12:21:07,completed,False,2022-11-18 12:35:05,19.1627,72.93822,19.062637,72.93822,2022-11-18 13:33:39,19.066866,72.86871,cf2fcf00-f78a-4907-ac1b-a440d327c638,04cbbb92-f65f-4942-b8d3-5e6e9047b8ea,Ganesh,Kanade,0818145f-1ddb-443f-bc59-a357b4ac25ef,MH01DR3895,personal_transport,2022-11-18 12:21:07,2022-11-18 13:33:39,"Jalaram Park A, Lal Bahadur Shastri Rd, Bhandup, Industrial Area, Bhandup West, Mumbai, Maharashtra 400078, India","G Block, Bandra Kurla Complex, Bandra East, Mumbai, Maharashtra 400098, India",21.66,completed,12,Friday
2022-11-18,215,04cbbb92-f65f-4942-b8d3-5e6e9047b8ea,0818145f-1ddb-443f-bc59-a357b4ac25ef,3b4d8666-3ea1-45a1-b270-f879eed28df0,dadb1d96-0589-4389-b38a-5a04b742c051,2022-11-18 13:24:42,rider_canceled,False,,19.059122,72.86577,19.0993,72.86577,,19.06252003,72.86779666,dadb1d96-0589-4389-b38a-5a04b742c051,04cbbb92-f65f-4942-b8d3-5e6e9047b8ea,Ganesh,Kanade,0818145f-1ddb-443f-bc59-a357b4ac25ef,MH01DR3895,personal_transport,2022-11-18 13:24:42,0,"Mumbai, Maharashtra 400099, India","Mumbai, Maharashtra 400099, India",0.0,rider_cancelled,13,Friday
2022-11-18,215,04cbbb92-f65f-4942-b8d3-5e6e9047b8ea,0818145f-1ddb-443f-bc59-a357b4ac25ef,3b4d8666-3ea1-45a1-b270-f879eed28df0,c737d80e-d954-4c0b-a290-b17cb209f532,2022-11-18 13:41:54,completed,False,2022-11-18 13:45:36,19.060633,72.86829,19.081524,72.86829,2022-11-18 14:11:20,19.0815,72.85017,c737d80e-d954-4c0b-a290-b17cb209f532,04cbbb92-f65f-4942-b8d3-5e6e9047b8ea,Ganesh,Kanade,0818145f-1ddb-443f-bc59-a357b4ac25ef,MH01DR3895,personal_transport,2022-11-18 13:41:54,2022-11-18 14:11:20,"Standard Chartered Building, BKC","117, Datta Mandir Rd, Vakola, Santacruz East, Demello Compound, Vakola, Santacruz East, Mumbai, Maharashtra 400055, India",6.18,completed,13,Friday
2022-11-18,215,04cbbb92-f65f-4942-b8d3-5e6e9047b8ea,0818145f-1ddb-443f-bc59-a357b4ac25ef,3b4d8666-3ea1-45a1-b270-f879eed28df0,5007d23d-7e2f-401f-bdb2-6bb84ada8eb5,2022-11-18 14:08:25,completed,False,2022-11-18 14:19:41,19.076382,72.85133,19.298126,72.85133,2022-11-18 15:08:34,19.29809,72.87254,5007d23d-7e2f-401f-bdb2-6bb84ada8eb5,04cbbb92-f65f-4942-b8d3-5e6e9047b8ea,Ganesh,Kanade,0818145f-1ddb-443f-bc59-a357b4ac25ef,MH01DR3895,personal_transport,2022-11-18 14:08:25,2022-11-18 15:08:34,"Level 2, Kalpataru Synergy, Opp Grand Hyatt, Siddharath Nagar, Vakola, Santacruz East, Mumbai, Maharashtra 400055, India","Kanakia Rd, Mira Road East, Beverly Park, Mira Road, Thane, Maharashtra 401107, India",28.23,completed,14,Friday
2022-11-18,215,04cbbb92-f65f-4942-b8d3-5e6e9047b8ea,0818145f-1ddb-443f-bc59-a357b4ac25ef,3b4d8666-3ea1-45a1-b270-f879eed28df0,e9162d7c-dcc6-493c-8842-1285f52406d5,2022-11-18 15:06:01,completed,False,2022-11-18 15:22:38,19.278948,72.85661,19.253164,72.85661,2022-11-18 18:07:56,19.311714,72.85307,e9162d7c-dcc6-493c-8842-1285f52406d5,04cbbb92-f65f-4942-b8d3-5e6e9047b8ea,Ganesh,Kanade,0818145f-1ddb-443f-bc59-a357b4ac25ef,MH01DR3895,personal_transport,2022-11-18 15:06:01,2022-11-18 18:07:56,"7VH4+MJP, Joggers Park Rd, Shanti Vihar, Mira Road, Mira Bhayandar, Maharashtra 401107, India","7VH4+MJP, Joggers Park Rd, Shanti Vihar, Mira Road, Mira Bhayandar, Maharashtra 401107, India",60.69,completed,15,Friday
2022-11-18,215,04cbbb92-f65f-4942-b8d3-5e6e9047b8ea,0818145f-1ddb-443f-bc59-a357b4ac25ef,3b4d8666-3ea1-45a1-b270-f879eed28df0,010001ee-d562-4cb6-9e04-77aa2e96c5b9,2022-11-18 18:42:37,rider_canceled,False,,19.289553,72.86458,19.195713,72.86458,,19.28891361,72.86537254,010001ee-d562-4cb6-9e04-77aa2e96c5b9,04cbbb92-f65f-4942-b8d3-5e6e9047b8ea,Ganesh,Kanade,0818145f-1ddb-443f-bc59-a357b4ac25ef,MH01DR3895,personal_transport,2022-11-18 18:42:37,0,"Rajnigandha Socy, Besides ST Stand, Lal Bahadur Shastri Rd, opp. Vandana Talkies, Panch Pakhdi, Thane West, Thane, Maharashtra 400602, India","Rajnigandha Socy, Besides ST Stand, Lal Bahadur Shastri Rd, opp. Vandana Talkies, Panch Pakhdi, Thane West, Thane, Maharashtra 400602, India",0.0,rider_cancelled,18,Friday
2022-11-18,215,04cbbb92-f65f-4942-b8d3-5e6e9047b8ea,0818145f-1ddb-443f-bc59-a357b4ac25ef,3b4d8666-3ea1-45a1-b270-f879eed28df0,89844301-9d1a-4da6-931f-1b03ba56d542,2022-11-18 18:47:23,completed,False,2022-11-18 18:59:15,19.275114,72.86226,19.258526,72.86226,2022-11-18 19:38:49,19.258453,72.9787,89844301-9d1a-4da6-931f-1b03ba56d542,04cbbb92-f65f-4942-b8d3-5e6e9047b8ea,Ganesh,Kanade,0818145f-1ddb-443f-bc59-a357b4ac25ef,MH01DR3895,personal_transport,2022-11-18 18:47:23,2022-11-18 19:38:49,"Shop No. 10/ 11, Door, No. 12/ B, Sector 9, Shanti Nagar, Mira Road, Thane, Maharashtra 401107, India","Crown Building, Hiranandani Estate, Thane West, Thane, Maharashtra 400607, India",17.84,completed,18,Friday
2022-11-18,215,04cbbb92-f65f-4942-b8d3-5e6e9047b8ea,0818145f-1ddb-443f-bc59-a357b4ac25ef,3b4d8666-3ea1-45a1-b270-f879eed28df0,9066c652-d2eb-42ab-af2d-7cf217ea945d,2022-11-18 20:38:50,rider_canceled,True,,19.149858,72.94382,19.22752,72.94382,,19.14113355,72.93758547,9066c652-d2eb-42ab-af2d-7cf217ea945d,04cbbb92-f65f-4942-b8d3-5e6e9047b8ea,Ganesh,Kanade,0818145f-1ddb-443f-bc59-a357b4ac25ef,MH01DR3895,personal_transport,2022-11-18 20:38:50,0,"Opp Church, Balaram Krupa Building, Ganesh Nagar, Trimurti Society, Navapada, Dombivli, Maharashtra 421202, India","Opp Church, Balaram Krupa Building, Ganesh Nagar, Trimurti Society, Navapada, Dombivli, Maharashtra 421202, India",0.0,rider_cancelled,20,Friday
