day_b,city_id,driver_uuid,vehicle_uuid,partner_uuid,uuid,request_timestamp_local,status,is_cash_trip,begintrip_timestamp_local,begintrip_lat,begintrip_lng,destination_lat,destination_lng,dropoff_timestamp_local,dropoff_lat,dropoff_lng,Trip UUID,Driver UUID,Driver first name,Driver surname,Vehicle UUID,Number plate,Service type,Trip request time,Trip drop-off time,Pick-up address,Drop-off address,Trip distance,Trip status,Hour,DayOfWeek
2022-11-18,215,10463326-3ef2-45cf-afc0-6d4a8421657f,71848624-2c4b-48a3-a1e3-95ac87d04576,54909d39-4345-408c-bf07-f5abf584c183,8607f7f6-8782-43b5-9ac8-0acb66f43eb7,2022-11-18 16:13:36,completed,True,2022-11-18 16:24:42,19.025568,72.86595,19.103224,72.86595,2022-11-18 17:14:41,19.103115,72.88675,8607f7f6-8782-43b5-9ac8-0acb66f43eb7,10463326-3ef2-45cf-afc0-6d4a8421657f,abhishek,singh,71848624-2c4b-48a3-a1e3-95ac87d04576,MH01DR5875,personal_transport,2022-11-18 16:13:36,2022-11-18 17:14:41,"D/416, Dosti Acres, Antop Hill, Mumbai, Maharashtra 400037, India","Sagar Heights, Phase 2, Apt B-302, Behind Sagar Tech Plaza, Sakinaka Junction, Andheri East, Safed Pul, Saki Naka, Mumbai, Maharashtra 400072, India",13.02,completed,16,Friday
2022-11-18,215,10463326-3ef2-45cf-afc0-6d4a8421657f,71848624-2c4b-48a3-a1e3-95ac87d04576,54909d39-4345-408c-bf07-f5abf584c183,32048445-3b16-4749-8981-8c80275bdce5,2022-11-18 20:31:36,unfulfilled,False,,19.121305,72.89108,19.045916,72.89108,,19.12130845,72.89105272,32048445-3b16-4749-8981-8c80275bdce5,10463326-3ef2-45cf-afc0-6d4a8421657f,abhishek,singh,71848624-2c4b-48a3-a1e3-95ac87d04576,MH01DR5875,personal_transport,2022-11-18 20:31:36,0,"CG Rd Natraj Compound, Near, Chatrapati Shivaji Maharaj Chowk, Union Park, Chembur, Mumbai, Maharashtra 400074, India","CG Rd Natraj Compound, Near, Chatrapati Shivaji Maharaj Chowk, Union Park, Chembur, Mumbai, Maharashtra 400074, India",0.0,delivery_failed,20,Friday
2022-11-18,215,10463326-3ef2-45cf-afc0-6d4a8421657f,71848624-2c4b-48a3-a1e3-95ac87d04576,54909d39-4345-408c-bf07-f5abf584c183,48c2705d-155c-42e6-a6fa-1c916d559dc9,2022-11-18 20:40:40,rider_canceled,True,,19.121302,72.89105,19.189993,72.89105,,19.12651396,72.88996649,48c2705d-155c-42e6-a6fa-1c916d559dc9,10463326-3ef2-45cf-afc0-6d4a8421657f,abhishek,singh,71848624-2c4b-48a3-a1e3-95ac87d04576,MH01DR5875,personal_transport,2022-11-18 20:40:40,0,"22, Sainath Rd, Malad, Daruwala Compound, Malad West, Mumbai, Maharashtra 400064, India","22, Sainath Rd, Malad, Daruwala Compound, Malad West, Mumbai, Maharashtra 400064, India",0.0,rider_cancelled,20,Friday
2022-11-18,215,10463326-3ef2-45cf-afc0-6d4a8421657f,71848624-2c4b-48a3-a1e3-95ac87d04576,54909d39-4345-408c-bf07-f5abf584c183,7f975fdc-a7cb-4e28-957f-ae06f46ae6e6,2022-11-18 21:01:14,completed,False,2022-11-18 21:16:01,19.123728,72.883286,18.976625,72.883286,2022-11-18 22:06:47,18.976604,72.81526,7f975fdc-a7cb-4e28-957f-ae06f46ae6e6,10463326-3ef2-45cf-afc0-6d4a8421657f,abhishek,singh,71848624-2c4b-48a3-a1e3-95ac87d04576,MH01DR5875,personal_transport,2022-11-18 21:01:14,2022-11-18 22:06:47,"Kanakia Rainforest, Bhavani Nagar, Marol, Andheri East, Mumbai, Maharashtra 400059, India","The willingdon sports club, Arya Nagar, Tulsiwadi, Tardeo, Mumbai, Maharashtra 400034, India",24.94,completed,21,Friday
2022-11-18,215,10463326-3ef2-45cf-afc0-6d4a8421657f,71848624-2c4b-48a3-a1e3-95ac87d04576,54909d39-4345-408c-bf07-f5abf584c183,6eda9f98-bde9-42b8-86df-c293bf0de7c6,2022-11-18 23:32:18,rider_canceled,False,,18.973518,72.814,19.105713,72.814,,18.97342205,72.81390595,6eda9f98-bde9-42b8-86df-c293bf0de7c6,10463326-3ef2-45cf-afc0-6d4a8421657f,abhishek,singh,71848624-2c4b-48a3-a1e3-95ac87d04576,MH01DR5875,personal_transport,2022-11-18 23:32:18,0,"Godrej Hillside Colony, Vikhroli West, Mumbai, Maharashtra 400079, India","Godrej Hillside Colony, Vikhroli West, Mumbai, Maharashtra 400079, India",0.0,rider_cancelled,23,Friday
2022-11-19,215,10463326-3ef2-45cf-afc0-6d4a8421657f,71848624-2c4b-48a3-a1e3-95ac87d04576,54909d39-4345-408c-bf07-f5abf584c183,52f415d0-ffe6-4159-bf79-4434f9bfa260,2022-11-19 00:14:50,driver_canceled,True,,18.973555,72.814026,19.306797,72.814026,,18.99123085,72.81396806,52f415d0-ffe6-4159-bf79-4434f9bfa260,10463326-3ef2-45cf-afc0-6d4a8421657f,abhishek,singh,71848624-2c4b-48a3-a1e3-95ac87d04576,MH01DR5875,personal_transport,2022-11-19 00:14:50,0,"Bhayandar, Bhayandar East, Mira Bhayandar, Maharashtra, India","Bhayandar, Bhayandar East, Mira Bhayandar, Maharashtra, India",0.0,driver_cancelled,0,Saturday
2022-11-19,215,10463326-3ef2-45cf-afc0-6d4a8421657f,71848624-2c4b-48a3-a1e3-95ac87d04576,54909d39-4345-408c-bf07-f5abf584c183,746dc636-52b7-47d6-8afe-7f2b73be0a59,2022-11-19 01:22:38,completed,True,2022-11-19 01:34:30,18.96874,72.821495,19.225073,72.821495,2022-11-19 03:03:19,19.224926,73.07992,746dc636-52b7-47d6-8afe-7f2b73be0a59,10463326-3ef2-45cf-afc0-6d4a8421657f,abhishek,singh,71848624-2c4b-48a3-a1e3-95ac87d04576,MH01DR5875,personal_transport,2022-11-19 01:22:38,2022-11-19 03:03:19,"S.M Mansion 307,, Jehangir Boman Behram Rd, Navjeevan Society, Dalal Estate, Mumbai Central, Mumbai, Maharashtra 400008, India","Anand Nagar, WING-B, Pandit Din Dayal Upadhyay Road, Thakurwadi, Dombivli West, Dombivli, Maharashtra 421202, India",56.74,completed,1,Saturday
