day_b,city_id,driver_uuid,vehicle_uuid,partner_uuid,uuid,request_timestamp_local,status,is_cash_trip,begintrip_timestamp_local,begintrip_lat,begintrip_lng,destination_lat,destination_lng,dropoff_timestamp_local,dropoff_lat,dropoff_lng,Trip UUID,Driver UUID,Driver first name,Driver surname,Vehicle UUID,Number plate,Service type,Trip request time,Trip drop-off time,Pick-up address,Drop-off address,Trip distance,Trip status,Hour,DayOfWeek
2022-11-18,215,135fb00c-add8-44dd-8439-7f5ed699d6a6,94727b80-f280-414f-a55a-bad3dfee6427,ca90c852-163d-4543-8293-9e134e7b190d,79ac7418-d2a3-4f73-a587-0f5e8f3f499c,2022-11-18 13:59:19,rider_canceled,False,,19.16525,73.0464,19.280455,73.0464,,19.18111718,73.04583859,79ac7418-d2a3-4f73-a587-0f5e8f3f499c,135fb00c-add8-44dd-8439-7f5ed699d6a6,sahil,gupta,94727b80-f280-414f-a55a-bad3dfee6427,MH01DR4467,personal_transport,2022-11-18 13:59:19,0,"Rumah Bali by Puranik, Ghodbunder Rd, Bhayandarpada, Thane West, Thane, Maharashtra","Rumah Bali by Puranik, Ghodbunder Rd, Bhayandarpada, Thane West, Thane, Maharashtra",0.0,rider_cancelled,13,Friday
2022-11-18,215,135fb00c-add8-44dd-8439-7f5ed699d6a6,94727b80-f280-414f-a55a-bad3dfee6427,ca90c852-163d-4543-8293-9e134e7b190d,55b73154-acbf-4349-a276-27d892eb4d4f,2022-11-18 15:08:03,completed,True,2022-11-18 15:35:44,19.18599,73.03879,19.194565,73.03879,2022-11-18 16:38:42,19.1948,72.95952,55b73154-acbf-4349-a276-27d892eb4d4f,135fb00c-add8-44dd-8439-7f5ed699d6a6,sahil,gupta,94727b80-f280-414f-a55a-bad3dfee6427,MH01DR4467,personal_transport,2022-11-18 15:08:03,2022-11-18 16:38:42,"SIDDHANT REGENCY, BUILDING.NO.1, Sabe Rd, near diva Highschool, Om Sai Nagar, Sabe Gaon, Thane, Maharashtra 400612, India","Hajuri circle, Hazuri Dargah Rd, Louis Wadi, Thane West, Thane, Maharashtra 400604, India",20.51,completed,15,Friday
2022-11-18,215,135fb00c-add8-44dd-8439-7f5ed699d6a6,94727b80-f280-414f-a55a-bad3dfee6427,ca90c852-163d-4543-8293-9e134e7b190d,0207b5ad-8398-48db-beee-25eaccb49ec9,2022-11-18 16:10:12,rider_canceled,False,,19.20889,72.97343,19.177954,72.97343,,19.20478141,72.96928954,0207b5ad-8398-48db-beee-25eaccb49ec9,135fb00c-add8-44dd-8439-7f5ed699d6a6,sahil,gupta,94727b80-f280-414f-a55a-bad3dfee6427,MH01DR4467,personal_transport,2022-11-18 16:10:12,0,"Dheeraj Uphar Cooperative Housing Society, Malad, Suchi Dham, Dindoshi, Malad East, Mumbai, Maharashtra 400097, India","Dheeraj Uphar Cooperative Housing Society, Malad, Suchi Dham, Dindoshi, Malad East, Mumbai, Maharashtra 400097, India",0.0,rider_cancelled,16,Friday
2022-11-18,215,135fb00c-add8-44dd-8439-7f5ed699d6a6,94727b80-f280-414f-a55a-bad3dfee6427,ca90c852-163d-4543-8293-9e134e7b190d,5bab6d39-6f6a-449c-aa32-81b857c44d25,2022-11-18 16:17:14,rider_canceled,True,,19.20413,72.9687,19.069908,72.9687,,19.20413637,72.96868718,5bab6d39-6f6a-449c-aa32-81b857c44d25,135fb00c-add8-44dd-8439-7f5ed699d6a6,sahil,gupta,94727b80-f280-414f-a55a-bad3dfee6427,MH01DR4467,personal_transport,2022-11-18 16:17:14,0,"3R9V+X79, Khar Road East, Jawahar Nagar, Khar East, Mumbai, Maharashtra 400051, India","3R9V+X79, Khar Road East, Jawahar Nagar, Khar East, Mumbai, Maharashtra 400051, India",0.0,rider_cancelled,16,Friday
2022-11-18,215,135fb00c-add8-44dd-8439-7f5ed699d6a6,94727b80-f280-414f-a55a-bad3dfee6427,ca90c852-163d-4543-8293-9e134e7b190d,a7878d8e-6db8-44bd-826f-753e961dec8f,2022-11-18 16:18:14,rider_canceled,False,,19.20418,72.9687,19.066963,72.9687,,19.20788872,72.9643718,a7878d8e-6db8-44bd-826f-753e961dec8f,135fb00c-add8-44dd-8439-7f5ed699d6a6,sahil,gupta,94727b80-f280-414f-a55a-bad3dfee6427,MH01DR4467,personal_transport,2022-11-18 16:18:14,0,"telephone exchange, near, 8th Rd, Khar, Khar West, Mumbai, Maharashtra 400052, India","telephone exchange, near, 8th Rd, Khar, Khar West, Mumbai, Maharashtra 400052, India",0.0,rider_cancelled,16,Friday
2022-11-18,215,135fb00c-add8-44dd-8439-7f5ed699d6a6,94727b80-f280-414f-a55a-bad3dfee6427,ca90c852-163d-4543-8293-9e134e7b190d,e5b95785-be51-4d0e-8060-50f654fcbb6d,2022-11-18 16:31:28,driver_canceled,True,,19.20789,72.96439,19.233664,72.96439,,19.20959175,72.97354484,e5b95785-be51-4d0e-8060-50f654fcbb6d,135fb00c-add8-44dd-8439-7f5ed699d6a6,sahil,gupta,94727b80-f280-414f-a55a-bad3dfee6427,MH01DR4467,personal_transport,2022-11-18 16:31:28,0,"65M7+9P7, Press Bazar, Ulhasnagar, Maharashtra 421002, India","65M7+9P7, Press Bazar, Ulhasnagar, Maharashtra 421002, India",0.0,driver_cancelled,16,Friday
2022-11-18,215,135fb00c-add8-44dd-8439-7f5ed699d6a6,94727b80-f280-414f-a55a-bad3dfee6427,ca90c852-163d-4543-8293-9e134e7b190d,195efd65-6d57-4b3c-991a-4e4181d22e25,2022-11-18 17:00:08,rider_canceled,True,,19.20959,72.97354,18.933329,72.97354,,19.20960736,72.97356141,195efd65-6d57-4b3c-991a-4e4181d22e25,135fb00c-add8-44dd-8439-7f5ed699d6a6,sahil,gupta,94727b80-f280-414f-a55a-bad3dfee6427,MH01DR4467,personal_transport,2022-11-18 17:00:08,0,"Soona Mahal, 143, Marine Drive, Churchgate, Mumbai, Maharashtra 400020, India","Soona Mahal, 143, Marine Drive, Churchgate, Mumbai, Maharashtra 400020, India",0.0,rider_cancelled,17,Friday
2022-11-18,215,135fb00c-add8-44dd-8439-7f5ed699d6a6,94727b80-f280-414f-a55a-bad3dfee6427,ca90c852-163d-4543-8293-9e134e7b190d,ff574730-8b0f-4ddb-991c-1cc37a9348fe,2022-11-18 17:01:08,completed,True,2022-11-18 17:24:46,19.2038,72.9686,19.230097,72.9686,2022-11-18 18:44:38,19.23015,73.09096,ff574730-8b0f-4ddb-991c-1cc37a9348fe,135fb00c-add8-44dd-8439-7f5ed699d6a6,sahil,gupta,94727b80-f280-414f-a55a-bad3dfee6427,MH01DR4467,personal_transport,2022-11-18 17:01:08,2022-11-18 18:44:38,"Eastern Express Hwy, opp. Cadbury Junction, Khopat, Thane West, Thane, Maharashtra 400601, India","Gangeshwar Park, Navapada, Trimurti Society, Dombivli, Maharashtra 421202, India",30.84,completed,17,Friday
