day_b,city_id,driver_uuid,vehicle_uuid,partner_uuid,uuid,request_timestamp_local,status,is_cash_trip,begintrip_timestamp_local,begintrip_lat,begintrip_lng,destination_lat,destination_lng,dropoff_timestamp_local,dropoff_lat,dropoff_lng,Trip UUID,Driver UUID,Driver first name,Driver surname,Vehicle UUID,Number plate,Service type,Trip request time,Trip drop-off time,Pick-up address,Drop-off address,Trip distance,Trip status,Hour,DayOfWeek
2022-11-18,215,14454632-636e-4ca5-b185-fdb3a6868e54,5a6caf17-2b2c-42f1-9eeb-f6552ed5d924,8b20931b-0c97-4b92-88a5-ddb8bb08bd0e,3e4e0d22-9b49-4990-b90a-709b020cd44c,2022-11-18 06:27:16,completed,False,2022-11-18 06:34:49,19.068151,73.07217,19.070257,73.07217,2022-11-18 07:08:00,19.070177,72.90764,3e4e0d22-9b49-4990-b90a-709b020cd44c,14454632-636e-4ca5-b185-fdb3a6868e54,babbu,kumar,5a6caf17-2b2c-42f1-9eeb-f6552ed5d924,MH01DR7402,personal_transport,2022-11-18 06:27:16,2022-11-18 07:08:00,"Seven Hills CHS, Plot No 5, Sector 30, Owe Village, Owe Gaon, Kharghar, Navi Mumbai, Maharashtra 410210, India","108, Rd Number 1, Sector 3, Ghatkopar East, Mumbai, Maharashtra 400089, India",26.68,completed,6,Friday
2022-11-18,215,14454632-636e-4ca5-b185-fdb3a6868e54,5a6caf17-2b2c-42f1-9eeb-f6552ed5d924,8b20931b-0c97-4b92-88a5-ddb8bb08bd0e,2f70622d-55e0-46d2-bc5a-ea3e76009c5d,2022-11-18 08:34:15,unfulfilled,False,,19.098694,72.85221,19.06453,72.85221,,19.0986433,72.85217333,2f70622d-55e0-46d2-bc5a-ea3e76009c5d,14454632-636e-4ca5-b185-fdb3a6868e54,babbu,kumar,5a6caf17-2b2c-42f1-9eeb-f6552ed5d924,MH01DR7402,personal_transport,2022-11-18 08:34:15,0,"BKC Road, G Block BKC, Bandra Kurla Complex, Bandra East, G Block BKC, Bandra Kurla Complex, Bandra East, Mumbai, Maharashtra 400051, India","BKC Road, G Block BKC, Bandra Kurla Complex, Bandra East, G Block BKC, Bandra Kurla Complex, Bandra East, Mumbai, Maharashtra 400051, India",0.0,delivery_failed,8,Friday
2022-11-18,215,14454632-636e-4ca5-b185-fdb3a6868e54,5a6caf17-2b2c-42f1-9eeb-f6552ed5d924,8b20931b-0c97-4b92-88a5-ddb8bb08bd0e,77aae251-2171-4cb9-af7f-1bf0b777b5d5,2022-11-18 08:48:05,completed,False,2022-11-18 08:56:52,19.105318,72.85291,19.06453,72.85291,2022-11-18 09:23:43,19.064173,72.86082,77aae251-2171-4cb9-af7f-1bf0b777b5d5,14454632-636e-4ca5-b185-fdb3a6868e54,babbu,kumar,5a6caf17-2b2c-42f1-9eeb-f6552ed5d924,MH01DR7402,personal_transport,2022-11-18 08:48:05,2022-11-18 09:23:43,"4V43+754, Paranjape Rd, Navpada, Paranjape Nagar, Vile Parle, Mumbai, Maharashtra 400057, India","BKC Road, G Block BKC, Bandra Kurla Complex, Bandra East, G Block BKC, Bandra Kurla Complex, Bandra East, Mumbai, Maharashtra 400051, India",8.4,completed,8,Friday
2022-11-18,215,14454632-636e-4ca5-b185-fdb3a6868e54,5a6caf17-2b2c-42f1-9eeb-f6552ed5d924,8b20931b-0c97-4b92-88a5-ddb8bb08bd0e,3af86314-41a4-4b3f-acea-7215e620db3a,2022-11-18 11:12:49,completed,False,2022-11-18 11:24:12,19.050737,72.88799,19.060621,72.88799,2022-11-18 11:39:27,19.060892,72.86517,3af86314-41a4-4b3f-acea-7215e620db3a,14454632-636e-4ca5-b185-fdb3a6868e54,babbu,kumar,5a6caf17-2b2c-42f1-9eeb-f6552ed5d924,MH01DR7402,personal_transport,2022-11-18 11:12:49,2022-11-18 11:39:27,"3V2Q+769, Smt.Parvathitai Anand Shetty Marg, सिंधी सोसायटी, चेंबूर, मुंबई, महाराष्ट्र 400071, India","ONE BKC, Tower B, 18th Floor, 1802, G Block BKC, Bandra Kurla Complex, Bandra East, Mumbai, Maharashtra 400051, India",4.52,completed,11,Friday
2022-11-18,215,14454632-636e-4ca5-b185-fdb3a6868e54,5a6caf17-2b2c-42f1-9eeb-f6552ed5d924,8b20931b-0c97-4b92-88a5-ddb8bb08bd0e,4e23de38-1330-4aa4-b77b-ff00e134baf0,2022-11-18 12:33:36,rider_canceled,False,,19.052343,72.87908,19.09315,72.87908,,19.05401254,72.88486099,4e23de38-1330-4aa4-b77b-ff00e134baf0,14454632-636e-4ca5-b185-fdb3a6868e54,babbu,kumar,5a6caf17-2b2c-42f1-9eeb-f6552ed5d924,MH01DR7402,personal_transport,2022-11-18 12:33:36,0,"Juhu Tara Rd, Airport Area, Juhu, Mumbai, Maharashtra 400049, India","Juhu Tara Rd, Airport Area, Juhu, Mumbai, Maharashtra 400049, India",0.0,rider_cancelled,12,Friday
2022-11-18,215,14454632-636e-4ca5-b185-fdb3a6868e54,5a6caf17-2b2c-42f1-9eeb-f6552ed5d924,8b20931b-0c97-4b92-88a5-ddb8bb08bd0e,007db12d-6370-401e-b388-b49da8f6245d,2022-11-18 13:50:25,completed,False,2022-11-18 14:11:40,19.10873,72.824776,19.085018,72.824776,2022-11-18 14:55:43,19.08524,72.85986,007db12d-6370-401e-b388-b49da8f6245d,14454632-636e-4ca5-b185-fdb3a6868e54,babbu,kumar,5a6caf17-2b2c-42f1-9eeb-f6552ed5d924,MH01DR7402,personal_transport,2022-11-18 13:50:25,2022-11-18 14:55:43,"Novotel Hotel Balraj Sahani Marg, Juhu Beach, Juhu, Mumbai, Maharashtra 400049, India","NP-13, Air India Rd, Kolivery Village, Navpada, Sunder Nagar, Santacruz East, Mumbai, Maharashtra 400029, India",10.03,completed,13,Friday
2022-11-18,215,14454632-636e-4ca5-b185-fdb3a6868e54,5a6caf17-2b2c-42f1-9eeb-f6552ed5d924,8b20931b-0c97-4b92-88a5-ddb8bb08bd0e,4b97ac58-d100-474e-884e-f49c28d993f9,2022-11-18 15:40:48,completed,False,2022-11-18 15:48:57,19.073172,72.86188,19.064255,72.86188,2022-11-18 16:10:23,19.063719,72.84173,4b97ac58-d100-474e-884e-f49c28d993f9,14454632-636e-4ca5-b185-fdb3a6868e54,babbu,kumar,5a6caf17-2b2c-42f1-9eeb-f6552ed5d924,MH01DR7402,personal_transport,2022-11-18 15:40:48,2022-11-18 16:10:23,"Tejaswini Apartments, Manipada Rd, Mhada Colony, Vidya Nagari, Kalina, Santacruz East, Mumbai, Maharashtra 400098, India","Bandra Terminus, Naupada, Bandra East, Mumbai, Maharashtra, India",5.66,completed,15,Friday
2022-11-18,215,14454632-636e-4ca5-b185-fdb3a6868e54,5a6caf17-2b2c-42f1-9eeb-f6552ed5d924,8b20931b-0c97-4b92-88a5-ddb8bb08bd0e,3205a92d-b257-4153-af53-82875c1f9755,2022-11-18 18:39:48,rider_canceled,True,,19.124538,73.03478,19.010345,73.03478,,19.12922621,73.03530407,3205a92d-b257-4153-af53-82875c1f9755,14454632-636e-4ca5-b185-fdb3a6868e54,babbu,kumar,5a6caf17-2b2c-42f1-9eeb-f6552ed5d924,MH01DR7402,personal_transport,2022-11-18 18:39:48,0,"Shop no. 1.2.3. Mahavir icon, Plot no. 89, 90, Sector 15, CBD Belapur, Navi Mumbai, Maharashtra 400614, India","Shop no. 1.2.3. Mahavir icon, Plot no. 89, 90, Sector 15, CBD Belapur, Navi Mumbai, Maharashtra 400614, India",0.0,rider_cancelled,18,Friday
2022-11-18,215,14454632-636e-4ca5-b185-fdb3a6868e54,5a6caf17-2b2c-42f1-9eeb-f6552ed5d924,8b20931b-0c97-4b92-88a5-ddb8bb08bd0e,e96ab564-104b-4aa8-88b7-ede203ea510b,2022-11-18 19:38:00,rider_canceled,False,,19.149246,73.0386,19.33482,73.0386,,19.1492362,73.03857672,e96ab564-104b-4aa8-88b7-ede203ea510b,14454632-636e-4ca5-b185-fdb3a6868e54,babbu,kumar,5a6caf17-2b2c-42f1-9eeb-f6552ed5d924,MH01DR7402,personal_transport,2022-11-18 19:38:00,0,"Mumbai Nashik Bypass Dhaman Gaon, Vadape, Bhiwandi, Maharashtra 421302, India","Mumbai Nashik Bypass Dhaman Gaon, Vadape, Bhiwandi, Maharashtra 421302, India",0.0,rider_cancelled,19,Friday
