day_b,city_id,driver_uuid,vehicle_uuid,partner_uuid,uuid,request_timestamp_local,status,is_cash_trip,begintrip_timestamp_local,begintrip_lat,begintrip_lng,destination_lat,destination_lng,dropoff_timestamp_local,dropoff_lat,dropoff_lng,Trip UUID,Driver UUID,Driver first name,Driver surname,Vehicle UUID,Number plate,Service type,Trip request time,Trip drop-off time,Pick-up address,Drop-off address,Trip distance,Trip status,Hour,DayOfWeek
2022-11-18,215,1811412f-d6b2-4abf-aadf-8ced042485a0,409d28b0-88df-44cb-9570-1989ea9cab71,517e1bbb-df7d-4280-a71c-d26ebfe12173,824dea27-5af1-40c0-a552-69ed0733892c,2022-11-18 18:48:19,completed,False,2022-11-18 19:00:09,19.111025,72.85867,19.266819,72.85867,2022-11-18 20:48:04,19.266863,72.96296,824dea27-5af1-40c0-a552-69ed0733892c,1811412f-d6b2-4abf-aadf-8ced042485a0,RASID,GAGAN,409d28b0-88df-44cb-9570-1989ea9cab71,MH01DR7425,personal_transport,2022-11-18 18:48:19,2022-11-18 20:48:04,"Cardinal Gracias Rd, Parshiwada, Kajuwadi, Chakala, Andheri East, Mumbai, Maharashtra 400099, India","Shop No.3, ROSA GARDENIA, Ghodbunder Rd, behind hypercity mall, Kasarvadavali, Thane West, Thane, Maharashtra 400615, India",32.29,completed,18,Friday
2022-11-18,215,1811412f-d6b2-4abf-aadf-8ced042485a0,409d28b0-88df-44cb-9570-1989ea9cab71,517e1bbb-df7d-4280-a71c-d26ebfe12173,bb7fc438-dccf-42ba-8f80-2a726c37dcaa,2022-11-18 21:05:16,completed,False,2022-11-18 21:24:34,19.259647,72.96695,19.236511,72.96695,2022-11-18 22:19:14,19.236229,73.13098,bb7fc438-dccf-42ba-8f80-2a726c37dcaa,1811412f-d6b2-4abf-aadf-8ced042485a0,RASID,GAGAN,409d28b0-88df-44cb-9570-1989ea9cab71,MH01DR7425,personal_transport,2022-11-18 21:05:16,2022-11-18 22:19:14,"PARKWOODS APARTMENT, Parkwoods, Thane West, Thane, Maharashtra 400615, India","Bhanu Sagar Talkies, Bhanunagar Kalyan(West), Bhoiwada, Kalyan, Maharashtra 421301, India",27.42,completed,21,Friday
2022-11-18,215,1811412f-d6b2-4abf-aadf-8ced042485a0,409d28b0-88df-44cb-9570-1989ea9cab71,517e1bbb-df7d-4280-a71c-d26ebfe12173,e7fda06a-5111-4b13-b401-d04c7e0ca3f4,2022-11-18 22:55:37,completed,True,2022-11-18 23:04:33,19.236115,73.12665,19.003345,73.12665,2022-11-19 00:37:41,19.003323,72.81999,e7fda06a-5111-4b13-b401-d04c7e0ca3f4,1811412f-d6b2-4abf-aadf-8ced042485a0,RASID,GAGAN,409d28b0-88df-44cb-9570-1989ea9cab71,MH01DR7425,personal_transport,2022-11-18 22:55:37,2022-11-19 00:37:41,"near Zojwala Petrol Pump, Bhanu Sagar Talkies, Bhanunagar Kalyan(West), Bail Bazar, Kalyan West, Mumbai, Maharashtra 421301, India","51, G M Bhosle Marg, B Wing, Ambedkar Nagar Colony, BDD Chawls Worli, Worli, Mumbai, Maharashtra 400018, India",55.87,completed,22,Friday
2022-11-19,215,1811412f-d6b2-4abf-aadf-8ced042485a0,409d28b0-88df-44cb-9570-1989ea9cab71,517e1bbb-df7d-4280-a71c-d26ebfe12173,e1c9a993-646f-4d21-8928-8d325f7a1cc0,2022-11-19 00:33:41,unfulfilled,True,,19.003323,72.81999,18.897932,72.81999,,19.0033226,72.81999326,e1c9a993-646f-4d21-8928-8d325f7a1cc0,1811412f-d6b2-4abf-aadf-8ced042485a0,RASID,GAGAN,409d28b0-88df-44cb-9570-1989ea9cab71,MH01DR7425,personal_transport,2022-11-19 00:33:41,0,"IMSC, VRX5+2W7, Navy Nagar, Colaba, near Robert House, Navy Nagar, Colaba, Mumbai, Maharashtra 400005, India","IMSC, VRX5+2W7, Navy Nagar, Colaba, near Robert House, Navy Nagar, Colaba, Mumbai, Maharashtra 400005, India",0.0,delivery_failed,0,Saturday
2022-11-19,215,1811412f-d6b2-4abf-aadf-8ced042485a0,409d28b0-88df-44cb-9570-1989ea9cab71,517e1bbb-df7d-4280-a71c-d26ebfe12173,99d3fa78-ce12-44e6-ae42-b5a1e6679391,2022-11-19 00:39:41,completed,True,2022-11-19 00:50:31,18.99609,72.819626,19.145514,72.819626,2022-11-19 01:36:02,19.14549,72.98759,99d3fa78-ce12-44e6-ae42-b5a1e6679391,1811412f-d6b2-4abf-aadf-8ced042485a0,RASID,GAGAN,409d28b0-88df-44cb-9570-1989ea9cab71,MH01DR7425,personal_transport,2022-11-19 00:39:41,2022-11-19 01:36:02,"Parijat House, LR Papan Marg, Worli Naka, Upper Worli, Worli, Mumbai, Maharashtra 400018, India","Shiv Darshan CHS, Sainath Sport Club Road, Sector 10, Airoli, Navi Mumbai, Maharashtra 400708, India",31.37,completed,0,Saturday
