day_b,city_id,driver_uuid,vehicle_uuid,partner_uuid,uuid,request_timestamp_local,status,is_cash_trip,begintrip_timestamp_local,begintrip_lat,begintrip_lng,destination_lat,destination_lng,dropoff_timestamp_local,dropoff_lat,dropoff_lng,Trip UUID,Driver UUID,Driver first name,Driver surname,Vehicle UUID,Number plate,Service type,Trip request time,Trip drop-off time,Pick-up address,Drop-off address,Trip distance,Trip status,Hour,DayOfWeek
2022-11-18,215,22118de6-78f5-4fa1-a152-45cdc1fe9f34,22b4b843-3879-413f-a1b7-c2177b603f73,f7a1c090-31f5-47cd-8fc8-832b6e06c2c4,77b77dec-46a5-4e78-950e-5de18b5b0381,2022-11-18 10:43:41,completed,True,2022-11-18 10:51:47,19.043589,73.08334,18.933582,73.08334,2022-11-18 12:06:39,18.933126,72.82632,77b77dec-46a5-4e78-950e-5de18b5b0381,22118de6-78f5-4fa1-a152-45cdc1fe9f34,Anand,Motewad,22b4b843-3879-413f-a1b7-c2177b603f73,MH01DR7098,personal_transport,2022-11-18 10:43:41,2022-11-18 12:06:39,"sai ganeah mandir, Vastu Vihar, Sector 16, Kharghar, Navi Mumbai, Maharashtra 410210, India","WRMH+C3V, Churchgate, Mumbai, Maharashtra 400020, India",42.19,completed,10,Friday
2022-11-18,215,22118de6-78f5-4fa1-a152-45cdc1fe9f34,22b4b843-3879-413f-a1b7-c2177b603f73,f7a1c090-31f5-47cd-8fc8-832b6e06c2c4,48c307a1-2c88-4263-b9d1-55a946672596,2022-11-18 12:17:25,completed,True,2022-11-18 12:25:21,18.932383,72.82348,19.022951,72.82348,2022-11-18 13:55:38,19.023006,73.015335,48c307a1-2c88-4263-b9d1-55a946672596,22118de6-78f5-4fa1-a152-45cdc1fe9f34,Anand,Motewad,22b4b843-3879-413f-a1b7-c2177b603f73,MH01DR7098,personal_transport,2022-11-18 12:17:25,2022-11-18 13:55:38,"145, Marine Dr, next to Pizza by the Bay, Churchgate, Mumbai, Maharashtra 400020, India","GoodWill Avenue, Seawoods West, Sector 40, Nerul, Navi Mumbai, Maharashtra 400706, India",38.4,completed,12,Friday
2022-11-18,215,22118de6-78f5-4fa1-a152-45cdc1fe9f34,22b4b843-3879-413f-a1b7-c2177b603f73,f7a1c090-31f5-47cd-8fc8-832b6e06c2c4,8438994a-33f6-41a8-b69f-7c5b3c337844,2022-11-18 14:41:54,completed,False,2022-11-18 14:48:04,19.02063,73.01845,19.103224,73.01845,2022-11-18 16:11:22,19.102283,72.87804,8438994a-33f6-41a8-b69f-7c5b3c337844,22118de6-78f5-4fa1-a152-45cdc1fe9f34,Anand,Motewad,22b4b843-3879-413f-a1b7-c2177b603f73,MH01DR7098,personal_transport,2022-11-18 14:41:54,2022-11-18 16:11:22,Seawoods Grand Central Mall,"Jw Marriott Sahar, Mumbai, Maharashtra, India",35.24,completed,14,Friday
2022-11-18,215,22118de6-78f5-4fa1-a152-45cdc1fe9f34,22b4b843-3879-413f-a1b7-c2177b603f73,f7a1c090-31f5-47cd-8fc8-832b6e06c2c4,19781700-25b5-4884-ba08-e2ae527f09b8,2022-11-18 16:57:01,unfulfilled,True,,19.102661,72.87679,19.128435,72.87679,,19.10266173,72.87679672,19781700-25b5-4884-ba08-e2ae527f09b8,22118de6-78f5-4fa1-a152-45cdc1fe9f34,Anand,Motewad,22b4b843-3879-413f-a1b7-c2177b603f73,MH01DR7098,personal_transport,2022-11-18 16:57:01,0,"Diamond Queen, Azad Nagar Lane No. 3, Building, Dattaguru Nagar, Azad Nagar, Andheri West, Mumbai, Maharashtra 400058, India","Diamond Queen, Azad Nagar Lane No. 3, Building, Dattaguru Nagar, Azad Nagar, Andheri West, Mumbai, Maharashtra 400058, India",0.0,delivery_failed,16,Friday
2022-11-18,215,22118de6-78f5-4fa1-a152-45cdc1fe9f34,22b4b843-3879-413f-a1b7-c2177b603f73,f7a1c090-31f5-47cd-8fc8-832b6e06c2c4,bdb60c42-0e73-4e62-8da7-d657192e4b73,2022-11-18 16:59:16,rider_canceled,True,,19.102661,72.87679,18.92408,72.87679,,19.1006521,72.87620282,bdb60c42-0e73-4e62-8da7-d657192e4b73,22118de6-78f5-4fa1-a152-45cdc1fe9f34,Anand,Motewad,22b4b843-3879-413f-a1b7-c2177b603f73,MH01DR7098,personal_transport,2022-11-18 16:59:16,0,"11a, Nathalal Parikh Marg, Scindia Society, Police Colony, Apollo Bandar, Colaba, Mumbai, Maharashtra 400001, India","11a, Nathalal Parikh Marg, Scindia Society, Police Colony, Apollo Bandar, Colaba, Mumbai, Maharashtra 400001, India",0.0,rider_cancelled,16,Friday
2022-11-18,215,22118de6-78f5-4fa1-a152-45cdc1fe9f34,22b4b843-3879-413f-a1b7-c2177b603f73,f7a1c090-31f5-47cd-8fc8-832b6e06c2c4,78747030-4894-45d9-ba3d-10719d252ad6,2022-11-18 17:57:50,completed,True,2022-11-18 18:07:08,19.100069,72.87615,19.132683,72.87615,2022-11-18 19:01:42,19.132696,72.82597,78747030-4894-45d9-ba3d-10719d252ad6,22118de6-78f5-4fa1-a152-45cdc1fe9f34,Anand,Motewad,22b4b843-3879-413f-a1b7-c2177b603f73,MH01DR7098,personal_transport,2022-11-18 17:57:50,2022-11-18 19:01:42,International,"RTO Rd, Shatataraka Co Op Housing Society, Suresh Nagar, Andheri West, Mumbai, Maharashtra 400053, India",8.86,completed,17,Friday
2022-11-18,215,22118de6-78f5-4fa1-a152-45cdc1fe9f34,22b4b843-3879-413f-a1b7-c2177b603f73,f7a1c090-31f5-47cd-8fc8-832b6e06c2c4,bc529d55-9f80-465e-bf05-fb705a149642,2022-11-18 20:58:41,completed,True,2022-11-18 21:13:55,18.983505,72.84083,19.0654,72.84083,2022-11-18 21:57:07,19.06546,72.8336,bc529d55-9f80-465e-bf05-fb705a149642,22118de6-78f5-4fa1-a152-45cdc1fe9f34,Anand,Motewad,22b4b843-3879-413f-a1b7-c2177b603f73,MH01DR7098,personal_transport,2022-11-18 20:58:41,2022-11-18 21:57:07,"Saifee Burhani Park Office, Mhada Colony, Ghodapdeo, New Patra Chawl, Dhaku Prabhuchi Wadi, Byculla East, Byculla, Mumbai, Maharashtra 400033, India","Crystal Shoppers Paradise 498, Off Link Road Junction of 24th and, 33rd Rd, Bandra West, Mumbai, Maharashtra 400050, India",10.76,completed,20,Friday
2022-11-18,215,22118de6-78f5-4fa1-a152-45cdc1fe9f34,22b4b843-3879-413f-a1b7-c2177b603f73,f7a1c090-31f5-47cd-8fc8-832b6e06c2c4,c14d241f-a0a6-4a87-aa33-ac3cfcae7a99,2022-11-18 21:49:43,completed,False,2022-11-18 22:00:41,19.065527,72.831375,19.255953,72.831375,2022-11-18 23:31:02,19.256018,72.97827,c14d241f-a0a6-4a87-aa33-ac3cfcae7a99,22118de6-78f5-4fa1-a152-45cdc1fe9f34,Anand,Motewad,22b4b843-3879-413f-a1b7-c2177b603f73,MH01DR7098,personal_transport,2022-11-18 21:49:43,2022-11-18 23:31:02,"Mini Punjab Hotel, Pali Darshan, 16th road/33rd road junction l, opp. Mini, Bandra West, Mumbai, Maharashtra 400050, India","7X4G+CQM, Vasant Leela Rd, Anu Nagar, Vijay Nagari, Thane West, Thane, Maharashtra 400607, India",36.62,completed,21,Friday
2022-11-18,215,22118de6-78f5-4fa1-a152-45cdc1fe9f34,22b4b843-3879-413f-a1b7-c2177b603f73,f7a1c090-31f5-47cd-8fc8-832b6e06c2c4,ee8ce4da-c22a-4313-8558-26ff3ecbd723,2022-11-18 23:46:01,completed,False,2022-11-18 23:55:00,19.20241,72.96601,19.119759,72.96601,2022-11-19 00:21:56,19.11977,72.992584,ee8ce4da-c22a-4313-8558-26ff3ecbd723,22118de6-78f5-4fa1-a152-45cdc1fe9f34,Anand,Motewad,22b4b843-3879-413f-a1b7-c2177b603f73,MH01DR7098,personal_transport,2022-11-18 23:46:01,2022-11-19 00:21:56,"Eastern Express Hwy, Samata Nagar, Thane West, Thane, Maharashtra 400606, India","Atlantis Atlantis_t2, Jijamata Nagar, Sector 11, Ghansoli, Navi Mumbai, Maharashtra 400701, India",14.95,completed,23,Friday
