day_b,city_id,driver_uuid,vehicle_uuid,partner_uuid,uuid,request_timestamp_local,status,is_cash_trip,begintrip_timestamp_local,begintrip_lat,begintrip_lng,destination_lat,destination_lng,dropoff_timestamp_local,dropoff_lat,dropoff_lng,Trip UUID,Driver UUID,Driver first name,Driver surname,Vehicle UUID,Number plate,Service type,Trip request time,Trip drop-off time,Pick-up address,Drop-off address,Trip distance,Trip status,Hour,DayOfWeek
2022-11-18,215,2fac3e76-e820-4587-9bd4-c24cbcbe84c3,6229e942-53c6-4923-9171-e8e2c4850897,41c9e90e-1d2c-4e4f-9f03-6e4bc89ac58c,17d003ba-3a23-4333-9e59-4e2f0f23e2cc,2022-11-18 12:39:16,completed,True,2022-11-18 12:57:29,19.170643,73.23562,19.21088,73.23562,2022-11-18 13:52:46,19.211342,73.09032,17d003ba-3a23-4333-9e59-4e2f0f23e2cc,2fac3e76-e820-4587-9bd4-c24cbcbe84c3,ROHIT,-,6229e942-53c6-4923-9171-e8e2c4850897,MH01DR8193,personal_transport,2022-11-18 12:39:16,2022-11-18 13:52:46,"Surya Sagar Apartment Dutta Chowk, 56CP+77R, Manjarli Rd, near Dattamandir, Datta Chowk, Belavali, Badlapur, Maharashtra 421503, India","Dombivli, 636R+74V, Sangeeta Wadi, Dombivli East, Dombivli, Maharashtra 421201, India",22.88,completed,12,Friday
2022-11-18,215,2fac3e76-e820-4587-9bd4-c24cbcbe84c3,6229e942-53c6-4923-9171-e8e2c4850897,41c9e90e-1d2c-4e4f-9f03-6e4bc89ac58c,af11ae52-3c93-47a7-a1ca-efc5bdec82bb,2022-11-18 13:44:41,completed,False,2022-11-18 14:02:07,19.217083,73.0806,18.956985,73.0806,2022-11-18 16:04:50,18.95662,72.82045,af11ae52-3c93-47a7-a1ca-efc5bdec82bb,2fac3e76-e820-4587-9bd4-c24cbcbe84c3,ROHIT,-,6229e942-53c6-4923-9171-e8e2c4850897,MH01DR8193,personal_transport,2022-11-18 13:44:41,2022-11-18 16:04:50,"Ganpati Plaza Apartment, Shastri Nagar, Dombivli West, Dombivli, Maharashtra 421202, India","Rainbow Heights, Vithalbhai Patel Rd, Charni Road East, Ambewadi, Girgaon, Mumbai, Maharashtra 400004, India",50.53,completed,13,Friday
2022-11-18,215,2fac3e76-e820-4587-9bd4-c24cbcbe84c3,6229e942-53c6-4923-9171-e8e2c4850897,41c9e90e-1d2c-4e4f-9f03-6e4bc89ac58c,4503f5ec-745b-4615-8825-8780fe0ef5bb,2022-11-18 16:02:16,completed,False,2022-11-18 16:12:34,18.959593,72.81547,19.017609,72.81547,2022-11-18 16:47:19,19.0177,72.85109,4503f5ec-745b-4615-8825-8780fe0ef5bb,2fac3e76-e820-4587-9bd4-c24cbcbe84c3,ROHIT,-,6229e942-53c6-4923-9171-e8e2c4850897,MH01DR8193,personal_transport,2022-11-18 16:02:16,2022-11-18 16:47:19,"Robert Money School Compound, Wadilal A, XR58+X5V, Vithalbhai Patel Rd, next to Queen Mary School, Grant Road East, Shapur Baug, Girgaon, Mumbai, Maharashtra 400007, India","P-745, Jahangir Vimadalal Rd, Central Railway Colony, Parsee Colony, Dadar, Mumbai, Maharashtra 400014, India",8.74,completed,16,Friday
2022-11-18,215,2fac3e76-e820-4587-9bd4-c24cbcbe84c3,6229e942-53c6-4923-9171-e8e2c4850897,41c9e90e-1d2c-4e4f-9f03-6e4bc89ac58c,3f580c1d-2756-47bf-8109-1943a5f1e27a,2022-11-18 16:42:37,completed,False,2022-11-18 16:54:37,19.016718,72.85629,19.099628,72.85629,2022-11-18 17:41:27,19.100496,72.87416,3f580c1d-2756-47bf-8109-1943a5f1e27a,2fac3e76-e820-4587-9bd4-c24cbcbe84c3,ROHIT,-,6229e942-53c6-4923-9171-e8e2c4850897,MH01DR8193,personal_transport,2022-11-18 16:42:37,2022-11-18 17:41:27,"C/258, CGHS Quarters, Jain Derasar Ln, near POST OFFICE, Wadala West, Wadala, Mumbai, Maharashtra 400031, India","Terminal 2, Navpada, Vile Parle East, Vile Parle, Mumbai, Maharashtra 400099, India",14.68,completed,16,Friday
2022-11-18,215,2fac3e76-e820-4587-9bd4-c24cbcbe84c3,6229e942-53c6-4923-9171-e8e2c4850897,41c9e90e-1d2c-4e4f-9f03-6e4bc89ac58c,bff630fb-db12-4e69-913f-f819627c0eb3,2022-11-18 17:45:02,unfulfilled,False,,19.106165,72.87475,19.10641,72.87475,,19.10543573,72.87465107,bff630fb-db12-4e69-913f-f819627c0eb3,2fac3e76-e820-4587-9bd4-c24cbcbe84c3,ROHIT,-,6229e942-53c6-4923-9171-e8e2c4850897,MH01DR8193,personal_transport,2022-11-18 17:45:02,0,"Ivy, Nahar Amrit Shakti, Chandivali, Powai, Mumbai, Maharashtra 400072, India","Ivy, Nahar Amrit Shakti, Chandivali, Powai, Mumbai, Maharashtra 400072, India",0.0,delivery_failed,17,Friday
2022-11-18,215,2fac3e76-e820-4587-9bd4-c24cbcbe84c3,6229e942-53c6-4923-9171-e8e2c4850897,41c9e90e-1d2c-4e4f-9f03-6e4bc89ac58c,075d945b-6921-4527-9bac-ae8dbbb4bf1c,2022-11-18 18:15:18,completed,False,2022-11-18 18:30:29,19.103195,72.87678,19.114729,72.87678,2022-11-18 20:01:29,19.11479,73.01772,075d945b-6921-4527-9bac-ae8dbbb4bf1c,2fac3e76-e820-4587-9bd4-c24cbcbe84c3,ROHIT,-,6229e942-53c6-4923-9171-e8e2c4850897,MH01DR8193,personal_transport,2022-11-18 18:15:18,2022-11-18 20:01:29,"Wing-A, Chimat Pada Rd, Chimatpada, Marol, Andheri East, Mumbai, Maharashtra 400059, India","X-5/2, T.T.C. Industrial Area, MIDC Industrial Area, Mahape, Navi Mumbai, Maharashtra 400710, India",26.14,completed,18,Friday
2022-11-18,215,2fac3e76-e820-4587-9bd4-c24cbcbe84c3,6229e942-53c6-4923-9171-e8e2c4850897,41c9e90e-1d2c-4e4f-9f03-6e4bc89ac58c,02bef96c-ee00-4019-b441-9be03c056726,2022-11-18 19:49:19,completed,True,2022-11-18 20:07:29,19.12428,73.00527,19.255333,73.00527,2022-11-18 21:17:36,19.255417,73.13313,02bef96c-ee00-4019-b441-9be03c056726,2fac3e76-e820-4587-9bd4-c24cbcbe84c3,ROHIT,-,6229e942-53c6-4923-9171-e8e2c4850897,MH01DR8193,personal_transport,2022-11-18 19:49:19,2022-11-18 21:17:36,"42F4+P7C, Reliance Corporate Park, MIDC Industrial Area, Ghansoli, Navi Mumbai, Maharashtra 400701, India","Wayle Nagar, Gandhar Nagar, Khadakpada, Kalyan, Maharashtra 421301, India",26.24,completed,19,Friday
2022-11-18,215,2fac3e76-e820-4587-9bd4-c24cbcbe84c3,6229e942-53c6-4923-9171-e8e2c4850897,41c9e90e-1d2c-4e4f-9f03-6e4bc89ac58c,33b6ce29-e377-4246-9171-3c507126b9be,2022-11-18 21:27:04,completed,True,2022-11-18 21:34:19,19.245087,73.12802,19.2367,73.12802,2022-11-18 21:53:54,19.236727,73.16073,33b6ce29-e377-4246-9171-3c507126b9be,2fac3e76-e820-4587-9bd4-c24cbcbe84c3,ROHIT,-,6229e942-53c6-4923-9171-e8e2c4850897,MH01DR8193,personal_transport,2022-11-18 21:27:04,2022-11-18 21:53:54,"Shop no. 1/2, Matruchhaya, C, H, S Old Agra Road Chowk, Tilak Chowk, Kalyan, Maharashtra 421301, India","65P6+J9J, Sidhi Vinayak Nagar, Ulhasnagar, Maharashtra 421002, India",5.25,completed,21,Friday
2022-11-18,215,2fac3e76-e820-4587-9bd4-c24cbcbe84c3,6229e942-53c6-4923-9171-e8e2c4850897,41c9e90e-1d2c-4e4f-9f03-6e4bc89ac58c,a9c938ce-f5a9-4eab-8365-8caf69b81152,2022-11-18 21:55:26,rider_canceled,True,,19.22897,73.16513,19.191906,73.16513,,19.22433436,73.16671252,a9c938ce-f5a9-4eab-8365-8caf69b81152,2fac3e76-e820-4587-9bd4-c24cbcbe84c3,ROHIT,-,6229e942-53c6-4923-9171-e8e2c4850897,MH01DR8193,personal_transport,2022-11-18 21:55:26,0,"Reliance Residency NX Rd, Kailash Colony, Pale Gaon, Maharashtra 421501, India","Reliance Residency NX Rd, Kailash Colony, Pale Gaon, Maharashtra 421501, India",0.0,rider_cancelled,21,Friday
