day_b,city_id,driver_uuid,vehicle_uuid,partner_uuid,uuid,request_timestamp_local,status,is_cash_trip,begintrip_timestamp_local,begintrip_lat,begintrip_lng,destination_lat,destination_lng,dropoff_timestamp_local,dropoff_lat,dropoff_lng,Trip UUID,Driver UUID,Driver first name,Driver surname,Vehicle UUID,Number plate,Service type,Trip request time,Trip drop-off time,Pick-up address,Drop-off address,Trip distance,Trip status,Hour,DayOfWeek
2022-11-18,215,3857204e-bbc5-4658-8774-13bc219232c6,6d98074e-4003-437b-afcc-7e41d4012f45,8b20931b-0c97-4b92-88a5-ddb8bb08bd0e,68147ab1-d645-4da3-8a23-033b926c8220,2022-11-18 12:50:04,completed,True,2022-11-18 13:16:04,19.244425,73.14025,19.158663,73.14025,2022-11-18 14:27:38,19.15841,72.94743,68147ab1-d645-4da3-8a23-033b926c8220,3857204e-bbc5-4658-8774-13bc219232c6,Gholam,Simnani,6d98074e-4003-437b-afcc-7e41d4012f45,MH01CV7570,personal_transport,2022-11-18 12:50:04,2022-11-18 14:27:38,"Chikan Ghar, Kalyan, Maharashtra 421301, India","Mulund - Goregaon Link Rd, opposite Registration Office, Nahur West, Hira Nagar, Mulund West, Mumbai, Maharashtra 400080, India",29.91,completed,12,Friday
2022-11-18,215,3857204e-bbc5-4658-8774-13bc219232c6,6d98074e-4003-437b-afcc-7e41d4012f45,8b20931b-0c97-4b92-88a5-ddb8bb08bd0e,6c3cab0e-21a5-479d-9f3c-01b3561f17c3,2022-11-18 14:14:48,completed,True,2022-11-18 14:43:53,19.159512,72.94706,19.266653,72.94706,2022-11-18 15:51:24,19.266695,72.877235,6c3cab0e-21a5-479d-9f3c-01b3561f17c3,3857204e-bbc5-4658-8774-13bc219232c6,Gholam,Simnani,6d98074e-4003-437b-afcc-7e41d4012f45,MH01CV7570,personal_transport,2022-11-18 14:14:48,2022-11-18 15:51:24,"RUNWAL GREENS CYPRESS, RUNWAL GREENS, Nahur, Industrial Area, Bhandup West, Mumbai, Maharashtra 400078, India","Mahavishnu Temple Rd, Mahajan Wadi, Mira Road, Mira Bhayandar, Maharashtra 400068, India",28.63,completed,14,Friday
2022-11-18,215,3857204e-bbc5-4658-8774-13bc219232c6,6d98074e-4003-437b-afcc-7e41d4012f45,8b20931b-0c97-4b92-88a5-ddb8bb08bd0e,58341f5c-fc80-4820-ad5f-fc0aa4378274,2022-11-18 15:32:00,completed,True,2022-11-18 15:59:39,19.262798,72.87352,19.208054,72.87352,2022-11-18 16:40:51,19.207819,72.97175,58341f5c-fc80-4820-ad5f-fc0aa4378274,3857204e-bbc5-4658-8774-13bc219232c6,Gholam,Simnani,6d98074e-4003-437b-afcc-7e41d4012f45,MH01CV7570,personal_transport,2022-11-18 15:32:00,2022-11-18 16:40:51,"106/3, near Dahisar Check Naka, Pandurang Wadi, Penkarpada, Mira Road, Mumbai, Maharashtra 401107, India","On Eastern Express Highway, Service Rd, Laxmi Nagar, Thane West, Thane, Maharashtra 400601, India",21.47,completed,15,Friday
2022-11-18,215,3857204e-bbc5-4658-8774-13bc219232c6,6d98074e-4003-437b-afcc-7e41d4012f45,8b20931b-0c97-4b92-88a5-ddb8bb08bd0e,af367e4b-c159-4fa9-b099-b62c62aa245e,2022-11-18 16:32:27,completed,True,2022-11-18 17:01:34,19.190996,72.965744,19.272478,72.965744,2022-11-18 17:49:47,19.272537,72.87946,af367e4b-c159-4fa9-b099-b62c62aa245e,3857204e-bbc5-4658-8774-13bc219232c6,Gholam,Simnani,6d98074e-4003-437b-afcc-7e41d4012f45,MH01CV7570,personal_transport,2022-11-18 16:32:27,2022-11-18 17:49:47,"4, Lal Bahadur Shastri Rd, Vishnu Nagar, Thane West, Thane, Maharashtra 400602, India","14, MIra Co-operative Housing Society, AG Nagar, MIDC, Mira Road East, AG Nagar, MIDC, Mira Road, Mira Bhayandar, Maharashtra 401107, India",23.78,completed,16,Friday
2022-11-18,215,3857204e-bbc5-4658-8774-13bc219232c6,6d98074e-4003-437b-afcc-7e41d4012f45,8b20931b-0c97-4b92-88a5-ddb8bb08bd0e,f2a42832-7b8f-43d2-b9d7-8a99d4e32894,2022-11-18 19:34:20,completed,True,2022-11-18 19:46:18,19.293251,72.848015,19.05972,72.848015,2022-11-18 21:35:20,19.059431,72.86644,f2a42832-7b8f-43d2-b9d7-8a99d4e32894,3857204e-bbc5-4658-8774-13bc219232c6,Gholam,Simnani,6d98074e-4003-437b-afcc-7e41d4012f45,MH01CV7570,personal_transport,2022-11-18 19:34:20,2022-11-18 21:35:20,"Unnamed Road, 7RVX+77X, Bhayandar, Bhayandar West, Mira Bhayandar, Maharashtra 401101, India","3V68+W2F, G Block BKC, Bandra Kurla Complex, Bandra East, Mumbai, Maharashtra 400051, India",35.72,completed,19,Friday
2022-11-18,215,3857204e-bbc5-4658-8774-13bc219232c6,6d98074e-4003-437b-afcc-7e41d4012f45,8b20931b-0c97-4b92-88a5-ddb8bb08bd0e,c09f1fbb-97ee-4212-9436-44d4dad708e0,2022-11-18 21:27:07,completed,True,2022-11-18 21:44:15,19.062813,72.867714,19.104822,72.867714,2022-11-18 22:10:28,19.104399,72.88641,c09f1fbb-97ee-4212-9436-44d4dad708e0,3857204e-bbc5-4658-8774-13bc219232c6,Gholam,Simnani,6d98074e-4003-437b-afcc-7e41d4012f45,MH01CV7570,personal_transport,2022-11-18 21:27:07,2022-11-18 22:10:28,"Avenue 3, G Block BKC, Bandra Kurla Complex, Bandra East, Mumbai, Maharashtra 400051, India","Neelkanth Udyog Bhavan, Saki Vihar Road, Saki Naka Junction, Sag Baug, Marol, Saki Naka, Mumbai, Maharashtra 400072, India",5.6,completed,21,Friday
