day_b,city_id,driver_uuid,vehicle_uuid,partner_uuid,uuid,request_timestamp_local,status,is_cash_trip,begintrip_timestamp_local,begintrip_lat,begintrip_lng,destination_lat,destination_lng,dropoff_timestamp_local,dropoff_lat,dropoff_lng,Trip UUID,Driver UUID,Driver first name,Driver surname,Vehicle UUID,Number plate,Service type,Trip request time,Trip drop-off time,Pick-up address,Drop-off address,Trip distance,Trip status,Hour,DayOfWeek
2022-11-18,215,386124d5-6aef-422f-9944-3e33133dc804,f447b149-c104-4744-b010-3ddcdf040d42,f7a1c090-31f5-47cd-8fc8-832b6e06c2c4,ce0522bf-8b6b-4dc2-8776-8caeac4ee808,2022-11-18 13:37:20,unfulfilled,False,,19.124054,73.00285,19.242317,73.00285,,19.15383959,73.0004636,ce0522bf-8b6b-4dc2-8776-8caeac4ee808,386124d5-6aef-422f-9944-3e33133dc804,Nilesh,Kamble,f447b149-c104-4744-b010-3ddcdf040d42,MH01DR5717,personal_transport,2022-11-18 13:37:20,0,"BLDG NO. 125-139 , 1ST FLOOR , GALA NO. 4&5 INDIAN CORPORATION COMPLEX , MANKOLI NAKA, Dapode, Bhiwandi, Maharashtra 421302, India","BLDG NO. 125-139 , 1ST FLOOR , GALA NO. 4&5 INDIAN CORPORATION COMPLEX , MANKOLI NAKA, Dapode, Bhiwandi, Maharashtra 421302, India",0.0,delivery_failed,13,Friday
2022-11-18,215,386124d5-6aef-422f-9944-3e33133dc804,f447b149-c104-4744-b010-3ddcdf040d42,f7a1c090-31f5-47cd-8fc8-832b6e06c2c4,6c34805c-6d1e-469f-957e-022feca35f6f,2022-11-18 16:45:44,completed,False,2022-11-18 16:56:43,19.21174,72.96066,19.260258,72.96066,2022-11-18 17:21:30,19.260212,72.95718,6c34805c-6d1e-469f-957e-022feca35f6f,386124d5-6aef-422f-9944-3e33133dc804,Nilesh,Kamble,f447b149-c104-4744-b010-3ddcdf040d42,MH01DR5717,personal_transport,2022-11-18 16:45:44,2022-11-18 17:21:30,"Puraniks Sales office, Puraniks Grand Central, 01, Pokharan Rd Number 2, Vartak Nagar, Thane West, Thane, Maharashtra 400606, India","Puranik Tokyo Bay, Ghodbunder Rd, behind Dmart, Haware City, Thane West, Thane, Maharashtra 400615, India",9.46,completed,16,Friday
2022-11-18,215,386124d5-6aef-422f-9944-3e33133dc804,f447b149-c104-4744-b010-3ddcdf040d42,f7a1c090-31f5-47cd-8fc8-832b6e06c2c4,9f862014-c80c-4105-a6b1-9db506c8de45,2022-11-18 17:10:10,completed,False,2022-11-18 17:26:57,19.264088,72.96066,19.200699,72.96066,2022-11-18 17:53:25,19.200403,72.95052,9f862014-c80c-4105-a6b1-9db506c8de45,386124d5-6aef-422f-9944-3e33133dc804,Nilesh,Kamble,f447b149-c104-4744-b010-3ddcdf040d42,MH01DR5717,personal_transport,2022-11-18 17:10:10,2022-11-18 17:53:25,"Vihang Valley Phase 1, Sai Nagar, Owale, Vihang Valley Phase 1, Sai Nagar, Kasarvadavali, Thane West, Thane, Maharashtra 400615, India","B-65, CyberTech House, J. B. Sawant Marg, Thane, Neheru Nagar, Wagle Industrial Estate, Thane West, Mumbai, Maharashtra 400604, India",12.12,completed,17,Friday
2022-11-18,215,386124d5-6aef-422f-9944-3e33133dc804,f447b149-c104-4744-b010-3ddcdf040d42,f7a1c090-31f5-47cd-8fc8-832b6e06c2c4,0eb5ddfb-859a-48eb-9214-d231bd70c1bc,2022-11-18 17:39:51,completed,True,2022-11-18 18:04:51,19.205734,72.951195,19.225317,72.951195,2022-11-18 18:33:33,19.227505,72.99395,0eb5ddfb-859a-48eb-9214-d231bd70c1bc,386124d5-6aef-422f-9944-3e33133dc804,Nilesh,Kamble,f447b149-c104-4744-b010-3ddcdf040d42,MH01DR5717,personal_transport,2022-11-18 17:39:51,2022-11-18 18:33:33,"6X42+8FQ, Veer Savarkar Nagar, Lokmanya Nagar, Thane West, Thane, Maharashtra 400606, India","Bhiwandi - Wadpa Road, Old, Mumbai - Agra National Hwy, Balkum Pada, Thane West, Thane, Maharashtra 400608, India",6.55,completed,17,Friday
2022-11-18,215,386124d5-6aef-422f-9944-3e33133dc804,f447b149-c104-4744-b010-3ddcdf040d42,f7a1c090-31f5-47cd-8fc8-832b6e06c2c4,daef199e-5b09-4aa1-9b0f-1eb7e5d2e865,2022-11-18 18:27:28,completed,True,2022-11-18 18:40:01,19.222912,72.988014,19.173239,72.988014,2022-11-18 19:10:55,19.173431,72.953606,daef199e-5b09-4aa1-9b0f-1eb7e5d2e865,386124d5-6aef-422f-9944-3e33133dc804,Nilesh,Kamble,f447b149-c104-4744-b010-3ddcdf040d42,MH01DR5717,personal_transport,2022-11-18 18:27:28,2022-11-18 19:10:55,"University Rd, Balkum Pada, Thane West, Mumbai, Maharashtra 400607, India","No.1&2 , Ram Niwas, RRT Rd, Mulund West, Mumbai, Maharashtra 400080, India",9.37,completed,18,Friday
