day_b,city_id,driver_uuid,vehicle_uuid,partner_uuid,uuid,request_timestamp_local,status,is_cash_trip,begintrip_timestamp_local,begintrip_lat,begintrip_lng,destination_lat,destination_lng,dropoff_timestamp_local,dropoff_lat,dropoff_lng,Trip UUID,Driver UUID,Driver first name,Driver surname,Vehicle UUID,Number plate,Service type,Trip request time,Trip drop-off time,Pick-up address,Drop-off address,Trip distance,Trip status,Hour,DayOfWeek
2022-11-18,215,409fedfb-5bf0-4053-8f98-d6fede9f9544,c82ea0a0-e965-484a-8379-867d7839dc60,8b20931b-0c97-4b92-88a5-ddb8bb08bd0e,97624c57-8ac3-48de-a3fd-6da19e393864,2022-11-18 06:09:24,completed,False,2022-11-18 06:16:28,19.114185,72.892395,19.122326,72.892395,2022-11-18 07:22:32,19.21129,73.106995,97624c57-8ac3-48de-a3fd-6da19e393864,409fedfb-5bf0-4053-8f98-d6fede9f9544,Tarik,Khan,c82ea0a0-e965-484a-8379-867d7839dc60,MH01DR5842,personal_transport,2022-11-18 06:09:24,2022-11-18 07:22:32,"Mahada chandivali 27/D/ 602 Sun shine society, Yadav Nagar, Chandivali, Powai, Mumbai, Maharashtra 400072, India","R29, R29, Sudarshan Nagar, near Pendharkar College, Azde Gaon, Sudarshan Nagar, Dombivli East, Dombivli, Maharashtra 421203, India",40.71,completed,6,Friday
2022-11-18,215,409fedfb-5bf0-4053-8f98-d6fede9f9544,c82ea0a0-e965-484a-8379-867d7839dc60,8b20931b-0c97-4b92-88a5-ddb8bb08bd0e,b9c0e508-5d3c-4ffd-ac72-b1a989f4e349,2022-11-18 07:28:03,completed,False,2022-11-18 07:44:15,19.20143,73.10935,19.215,73.10935,2022-11-18 07:59:28,19.214941,73.083786,b9c0e508-5d3c-4ffd-ac72-b1a989f4e349,409fedfb-5bf0-4053-8f98-d6fede9f9544,Tarik,Khan,c82ea0a0-e965-484a-8379-867d7839dc60,MH01DR5842,personal_transport,2022-11-18 07:28:03,2022-11-18 07:59:28,"22 No Building, Regency Estate, Kalyan - Shilphata Rd, Sonar Pada, Dombivli East, Dombivli, Maharashtra 421203, India","638M+3GG, Rajaji Path, Ramnagar, Dombivli East, Dombivli, Maharashtra 421201, India",4.41,completed,7,Friday
2022-11-18,215,409fedfb-5bf0-4053-8f98-d6fede9f9544,c82ea0a0-e965-484a-8379-867d7839dc60,8b20931b-0c97-4b92-88a5-ddb8bb08bd0e,389a7e74-bb33-4e6e-b5f2-87aa439ea7f7,2022-11-18 07:54:34,completed,False,2022-11-18 08:07:38,19.210651,73.090996,19.206335,73.090996,2022-11-18 10:11:30,19.206327,72.82507,389a7e74-bb33-4e6e-b5f2-87aa439ea7f7,409fedfb-5bf0-4053-8f98-d6fede9f9544,Tarik,Khan,c82ea0a0-e965-484a-8379-867d7839dc60,MH01DR5842,personal_transport,2022-11-18 07:54:34,2022-11-18 10:11:30,"udaywadi no. 2, pandurang wadi opp sarvoday garden, Manpada Rd, Sangeeta Wadi, Dombivli East, Dombivli, Maharashtra 421201, India","70-A, Kandivali, Charkop Rd, Kandivali, Charkop, Charkop Industrial Estate, Kandivali West, Mumbai, Maharashtra 400067, India",58.11,completed,7,Friday
2022-11-19,215,409fedfb-5bf0-4053-8f98-d6fede9f9544,c82ea0a0-e965-484a-8379-867d7839dc60,8b20931b-0c97-4b92-88a5-ddb8bb08bd0e,6eb21bc2-f8f7-4d81-aae5-bfb7e9b42076,2022-11-19 00:51:32,completed,False,2022-11-19 00:58:45,19.106325,72.91706,19.13503,72.91706,2022-11-19 01:25:14,19.135006,72.999146,6eb21bc2-f8f7-4d81-aae5-bfb7e9b42076,409fedfb-5bf0-4053-8f98-d6fede9f9544,Tarik,Khan,c82ea0a0-e965-484a-8379-867d7839dc60,MH01DR5842,personal_transport,2022-11-19 00:51:32,2022-11-19 01:25:14,"E-12, Lal Bahadur Shastri Rd, Godrej Hillside Colony, Vikhroli West, Mumbai, Maharashtra 400079, India","Plot No 8, Sector 23, Ghansoli, Navi Mumbai, Maharashtra 400701, India",15.34,completed,0,Saturday
2022-11-19,215,409fedfb-5bf0-4053-8f98-d6fede9f9544,c82ea0a0-e965-484a-8379-867d7839dc60,8b20931b-0c97-4b92-88a5-ddb8bb08bd0e,be8370a2-2fb6-4473-9df2-ae45eeb53c78,2022-11-19 02:52:27,completed,True,2022-11-19 03:01:20,19.159142,72.99093,19.23882,72.99093,2022-11-19 03:20:56,19.23852,72.97538,be8370a2-2fb6-4473-9df2-ae45eeb53c78,409fedfb-5bf0-4053-8f98-d6fede9f9544,Tarik,Khan,c82ea0a0-e965-484a-8379-867d7839dc60,MH01DR5842,personal_transport,2022-11-19 02:52:27,2022-11-19 03:20:56,"50, Mugalsan Rd, Sector-19, Airoli, Navi Mumbai, Maharashtra 400708, India","Manpada, Thane West, Thane, Maharashtra 400607, India",10.71,completed,2,Saturday
2022-11-19,215,409fedfb-5bf0-4053-8f98-d6fede9f9544,c82ea0a0-e965-484a-8379-867d7839dc60,8b20931b-0c97-4b92-88a5-ddb8bb08bd0e,2825a10f-29a6-43c7-b5a2-6a371198057d,2022-11-19 03:19:47,completed,False,2022-11-19 03:27:39,19.235598,72.96926,19.161074,72.96926,2022-11-19 03:46:37,19.161024,72.94354,2825a10f-29a6-43c7-b5a2-6a371198057d,409fedfb-5bf0-4053-8f98-d6fede9f9544,Tarik,Khan,c82ea0a0-e965-484a-8379-867d7839dc60,MH01DR5842,personal_transport,2022-11-19 03:19:47,2022-11-19 03:46:37,"C1/B1 kothari compound 27acres, Chithalsar Manpada, Hill Garden, Kokanipada, Thane West, Thane, Maharashtra 400610, India","Mulund - Goregaon Link Rd, next to Fortis Hospital, Nahur, Industrial Area, Mulund West, Mumbai, Maharashtra 400078, India",13.78,completed,3,Saturday
