day_b,city_id,driver_uuid,vehicle_uuid,partner_uuid,uuid,request_timestamp_local,status,is_cash_trip,begintrip_timestamp_local,begintrip_lat,begintrip_lng,destination_lat,destination_lng,dropoff_timestamp_local,dropoff_lat,dropoff_lng,Trip UUID,Driver UUID,Driver first name,Driver surname,Vehicle UUID,Number plate,Service type,Trip request time,Trip drop-off time,Pick-up address,Drop-off address,Trip distance,Trip status,Hour,DayOfWeek
2022-11-18,215,48e31a39-a5e1-4986-ab36-02a6f70978ff,fb52c23f-b300-4616-9766-104280a1b8aa,a18502aa-847e-4e8d-8af5-a9783722040f,872c7aa2-6b5c-4705-b676-e7baed48cd1e,2022-11-18 09:35:58,completed,True,2022-11-18 09:50:59,19.12864,72.84736,18.9914,72.84736,2022-11-18 11:06:01,18.991459,72.84035,872c7aa2-6b5c-4705-b676-e7baed48cd1e,48e31a39-a5e1-4986-ab36-02a6f70978ff,Vachspati,Chaubey,fb52c23f-b300-4616-9766-104280a1b8aa,MH01DR9941,personal_transport,2022-11-18 09:35:58,2022-11-18 11:06:01,"Bonanza Arcade 303-306, Swami Vivekananda Road opp Amboli phatakk, Kevni Pada, Andheri West, W, Maharashtra 400058, India","GD Ambekar Marg, Lal Baug, Parel, Mumbai, Maharashtra 400033, India",20.58,completed,9,Friday
2022-11-18,215,48e31a39-a5e1-4986-ab36-02a6f70978ff,fb52c23f-b300-4616-9766-104280a1b8aa,a18502aa-847e-4e8d-8af5-a9783722040f,48c395d0-93aa-408f-81ff-b66291c0942b,2022-11-18 12:09:56,completed,False,2022-11-18 12:21:07,19.003534,72.84174,18.941196,72.84174,2022-11-18 12:49:47,18.941174,72.82776,48c395d0-93aa-408f-81ff-b66291c0942b,48e31a39-a5e1-4986-ab36-02a6f70978ff,Vachspati,Chaubey,fb52c23f-b300-4616-9766-104280a1b8aa,MH01DR9941,personal_transport,2022-11-18 12:09:56,2022-11-18 12:49:47,"2345, Dr Ernest Borges Rd, Opp to KMS Hospital, Parel East, Parel, Mumbai, Maharashtra 400012, India","Bombay Hospital, New Marine Lines, Marine Lines, Mumbai, Maharashtra 400020, India",8.54,completed,12,Friday
2022-11-18,215,48e31a39-a5e1-4986-ab36-02a6f70978ff,fb52c23f-b300-4616-9766-104280a1b8aa,a18502aa-847e-4e8d-8af5-a9783722040f,55871267-acbc-4097-8c25-940de2acadb2,2022-11-18 13:03:21,completed,True,2022-11-18 13:14:24,18.959238,72.81735,19.00199,72.81735,2022-11-18 13:39:14,19.001934,72.82784,55871267-acbc-4097-8c25-940de2acadb2,48e31a39-a5e1-4986-ab36-02a6f70978ff,Vachspati,Chaubey,fb52c23f-b300-4616-9766-104280a1b8aa,MH01DR9941,personal_transport,2022-11-18 13:03:21,2022-11-18 13:39:14,"Shop No 357/13, Ganesh Bhavan Building, Lamington Rd, near Sarala Temple Line, Krishna Kunj, Grant Road East, Shapur Baug, Grant Road, Mumbai, Maharashtra 400007, India","Ditas, World Crest Ground Floor, Lodha, 402, Senapati Bapat Marg, Lower Parel, Mumbai, Maharashtra 400013, India",5.82,completed,13,Friday
2022-11-18,215,48e31a39-a5e1-4986-ab36-02a6f70978ff,fb52c23f-b300-4616-9766-104280a1b8aa,a18502aa-847e-4e8d-8af5-a9783722040f,4528f155-f0fc-4601-8bf5-c399f5a4777c,2022-11-18 14:25:00,completed,False,2022-11-18 14:37:14,19.006699,72.83353,18.929365,72.83353,2022-11-18 15:21:49,18.929058,72.826546,4528f155-f0fc-4601-8bf5-c399f5a4777c,48e31a39-a5e1-4986-ab36-02a6f70978ff,Vachspati,Chaubey,fb52c23f-b300-4616-9766-104280a1b8aa,MH01DR9941,personal_transport,2022-11-18 14:25:00,2022-11-18 15:21:49,One World Center,"170, Jamshedji Tata Road, Churchgate, Mumbai, Maharashtra 400020, India",12.12,completed,14,Friday
2022-11-18,215,48e31a39-a5e1-4986-ab36-02a6f70978ff,fb52c23f-b300-4616-9766-104280a1b8aa,a18502aa-847e-4e8d-8af5-a9783722040f,68456f35-699e-4dc7-9bfb-aaf692e39664,2022-11-18 15:30:03,completed,False,2022-11-18 15:41:56,18.928688,72.82723,18.986752,72.82723,2022-11-18 16:08:58,18.987038,72.828415,68456f35-699e-4dc7-9bfb-aaf692e39664,48e31a39-a5e1-4986-ab36-02a6f70978ff,Vachspati,Chaubey,fb52c23f-b300-4616-9766-104280a1b8aa,MH01DR9941,personal_transport,2022-11-18 15:30:03,2022-11-18 16:08:58,"146, HT Parekh Marg, Churchgate, Mumbai, Maharashtra 400020, India","Mahalaxmi, Lodha Bellissimo, Minerva Rd, Shastri Nagar, Adarsh Nagar, Lower Parel, Mumbai, Maharashtra 400013, India",8.38,completed,15,Friday
2022-11-18,215,48e31a39-a5e1-4986-ab36-02a6f70978ff,fb52c23f-b300-4616-9766-104280a1b8aa,a18502aa-847e-4e8d-8af5-a9783722040f,9f6dd078-b0ab-4ed4-ac5e-0ebaaacd333d,2022-11-18 16:47:28,completed,True,2022-11-18 17:00:42,18.98408,72.839355,19.306797,72.839355,2022-11-18 19:39:13,19.300535,72.86868,9f6dd078-b0ab-4ed4-ac5e-0ebaaacd333d,48e31a39-a5e1-4986-ab36-02a6f70978ff,Vachspati,Chaubey,fb52c23f-b300-4616-9766-104280a1b8aa,MH01DR9941,personal_transport,2022-11-18 16:47:28,2022-11-18 19:39:13,"2A, New Hind Mill Compound Rambhau Bhogle Marg NMhada, Prabhakar Nagar, Ghodapdeo, Byculla East, Byculla, Mumbai, Maharashtra 400033, India","Bhayandar, Bhayandar East, Mira Bhayandar, Maharashtra, India",41.29,completed,16,Friday
2022-11-18,215,48e31a39-a5e1-4986-ab36-02a6f70978ff,fb52c23f-b300-4616-9766-104280a1b8aa,a18502aa-847e-4e8d-8af5-a9783722040f,eada6dce-0677-4928-8020-6e53b7dc7b90,2022-11-18 19:47:26,completed,False,2022-11-18 20:02:20,19.287888,72.877106,19.142076,72.877106,2022-11-18 21:08:44,19.141241,72.844734,eada6dce-0677-4928-8020-6e53b7dc7b90,48e31a39-a5e1-4986-ab36-02a6f70978ff,Vachspati,Chaubey,fb52c23f-b300-4616-9766-104280a1b8aa,MH01DR9941,personal_transport,2022-11-18 19:47:26,2022-11-18 21:08:44,"Near Gaurav Residency, Phase II RBK School Lane, Off, Mira Bhayandar Rd, Beverly Park, Mira Road, Mira Bhayandar, Maharashtra 401107, India","SPANISH VILLA, JAMUNA AMRUT CO-OPERATIVE HOUSING SOCIETY, 3, Patel Estate Rd, मोमिन नगर, जोगेश्वरी वेस्ट, मुंबई, महाराष्ट्र 400102, India",20.79,completed,19,Friday
