day_b,city_id,driver_uuid,vehicle_uuid,partner_uuid,uuid,request_timestamp_local,status,is_cash_trip,begintrip_timestamp_local,begintrip_lat,begintrip_lng,destination_lat,destination_lng,dropoff_timestamp_local,dropoff_lat,dropoff_lng,Trip UUID,Driver UUID,Driver first name,Driver surname,Vehicle UUID,Number plate,Service type,Trip request time,Trip drop-off time,Pick-up address,Drop-off address,Trip distance,Trip status,Hour,DayOfWeek
2022-11-18,215,4e26bc3c-bb0f-4611-849a-a4154d376432,11b10b5e-8583-4321-9e56-7938e011fcc5,8b20931b-0c97-4b92-88a5-ddb8bb08bd0e,992c6412-b054-4613-9551-fa02b776c3b7,2022-11-18 13:19:00,completed,True,2022-11-18 13:33:35,19.35755,72.85674,19.236511,72.85674,2022-11-18 15:13:18,19.23638,73.131096,992c6412-b054-4613-9551-fa02b776c3b7,4e26bc3c-bb0f-4611-849a-a4154d376432,DEEPAK KUMAR,-,11b10b5e-8583-4321-9e56-7938e011fcc5,MH01DR1851,personal_transport,2022-11-18 13:19:00,2022-11-18 15:13:18,"1, Sai Enclave, Naigaon East, Maharashtra 401208, India","Bhanu Sagar Talkies, Bhanunagar Kalyan(West), Bhoiwada, Kalyan, Maharashtra 421301, India",43.29,completed,13,Friday
2022-11-18,215,4e26bc3c-bb0f-4611-849a-a4154d376432,11b10b5e-8583-4321-9e56-7938e011fcc5,8b20931b-0c97-4b92-88a5-ddb8bb08bd0e,9512e602-9956-478b-97fd-062c83147e4c,2022-11-18 14:42:49,completed,False,2022-11-18 15:22:26,19.23607,73.12828,19.076277,73.12828,2022-11-18 16:15:05,19.076303,73.08303,9512e602-9956-478b-97fd-062c83147e4c,4e26bc3c-bb0f-4611-849a-a4154d376432,DEEPAK KUMAR,-,11b10b5e-8583-4321-9e56-7938e011fcc5,MH01DR1851,personal_transport,2022-11-18 14:42:49,2022-11-18 16:15:05,"421301, Kalyan Building, Pathe Bapurao Marg, Grant Road East, Bharat Nagar, Grant Road, Mumbai, Maharashtra 400007, India","Plot No. 2 A, Sri Sathya Sai Sanjeevani Centre For Child Heart Care, Sector 38, Kharghar, Navi Mumbai, Maharashtra 410208, India",24.53,completed,14,Friday
2022-11-18,215,4e26bc3c-bb0f-4611-849a-a4154d376432,11b10b5e-8583-4321-9e56-7938e011fcc5,8b20931b-0c97-4b92-88a5-ddb8bb08bd0e,487eaccf-77f5-43ae-9a8d-99575167002c,2022-11-18 16:12:06,completed,False,2022-11-18 16:24:27,19.044746,73.08142,19.271416,73.08142,2022-11-18 18:05:41,19.271421,72.875046,487eaccf-77f5-43ae-9a8d-99575167002c,4e26bc3c-bb0f-4611-849a-a4154d376432,DEEPAK KUMAR,-,11b10b5e-8583-4321-9e56-7938e011fcc5,MH01DR1851,personal_transport,2022-11-18 16:12:06,2022-11-18 18:05:41,"Sector 16-17,, Vastuvihar KH1, Kalamboli Link Rd, Vastu Vihar, Sector 17, Kharghar, Navi Mumbai, Maharashtra 410210, India","7VCG+J38, Mira Rd, MIDC, Mira Road, Mira Bhayandar, Maharashtra 400068, India",47.49,completed,16,Friday
2022-11-18,215,4e26bc3c-bb0f-4611-849a-a4154d376432,11b10b5e-8583-4321-9e56-7938e011fcc5,8b20931b-0c97-4b92-88a5-ddb8bb08bd0e,4d2919bf-726e-4294-956c-011ea3975251,2022-11-18 17:47:40,rider_canceled,False,,19.276209,72.888916,19.304686,72.888916,,19.27800131,72.87893057,4d2919bf-726e-4294-956c-011ea3975251,4e26bc3c-bb0f-4611-849a-a4154d376432,DEEPAK KUMAR,-,11b10b5e-8583-4321-9e56-7938e011fcc5,MH01DR1851,personal_transport,2022-11-18 17:47:40,0,"Jain Mandir Rd, Devchand Nagar, Sripal Nagar, Bhayandar West, Mira Bhayandar, Maharashtra 401101, India","Jain Mandir Rd, Devchand Nagar, Sripal Nagar, Bhayandar West, Mira Bhayandar, Maharashtra 401101, India",0.0,rider_cancelled,17,Friday
2022-11-18,215,4e26bc3c-bb0f-4611-849a-a4154d376432,11b10b5e-8583-4321-9e56-7938e011fcc5,8b20931b-0c97-4b92-88a5-ddb8bb08bd0e,9c6569e2-7e6f-4acd-a7ee-5f90ebd36cd0,2022-11-18 18:17:03,completed,True,2022-11-18 18:28:12,19.27734,72.86535,19.257149,72.86535,2022-11-18 19:14:17,19.247673,72.97761,9c6569e2-7e6f-4acd-a7ee-5f90ebd36cd0,4e26bc3c-bb0f-4611-849a-a4154d376432,DEEPAK KUMAR,-,11b10b5e-8583-4321-9e56-7938e011fcc5,MH01DR1851,personal_transport,2022-11-18 18:17:03,2022-11-18 19:14:17,"RNA COURTYARD CHS, opp. Sector 8, Shanti Park, Mira Road, Mira Bhayandar, Maharashtra 401107, India","7X4Q+W32, Rodas Enclave Circular Rd, Hiranandani Estate, Thane West, Thane, Maharashtra 400607, India",18.41,completed,18,Friday
2022-11-18,215,4e26bc3c-bb0f-4611-849a-a4154d376432,11b10b5e-8583-4321-9e56-7938e011fcc5,8b20931b-0c97-4b92-88a5-ddb8bb08bd0e,2f04f560-0148-4ec9-ba1e-948a9a031201,2022-11-18 19:09:19,rider_canceled,False,,19.251038,72.973274,19.20944,72.973274,,19.25547695,72.98266745,2f04f560-0148-4ec9-ba1e-948a9a031201,4e26bc3c-bb0f-4611-849a-a4154d376432,DEEPAK KUMAR,-,11b10b5e-8583-4321-9e56-7938e011fcc5,MH01DR1851,personal_transport,2022-11-18 19:09:19,0,"RW Sawant Rd, Devkrupa Society, Rutu Park, F-3, Thane West, Thane, Maharashtra 400601, India","RW Sawant Rd, Devkrupa Society, Rutu Park, F-3, Thane West, Thane, Maharashtra 400601, India",0.0,rider_cancelled,19,Friday
2022-11-18,215,4e26bc3c-bb0f-4611-849a-a4154d376432,11b10b5e-8583-4321-9e56-7938e011fcc5,8b20931b-0c97-4b92-88a5-ddb8bb08bd0e,6f1b9f74-acf8-49ab-915d-1a93bc0ac4ab,2022-11-18 19:16:19,completed,True,2022-11-18 19:33:16,19.272224,72.971275,19.240593,72.971275,2022-11-18 20:37:22,19.240543,73.140785,6f1b9f74-acf8-49ab-915d-1a93bc0ac4ab,4e26bc3c-bb0f-4611-849a-a4154d376432,DEEPAK KUMAR,-,11b10b5e-8583-4321-9e56-7938e011fcc5,MH01DR1851,personal_transport,2022-11-18 19:16:19,2022-11-18 20:37:22,"SHOP NO 10 & 11 GROUND FLOOR B WING ACE SQUARE, Ghodbunder Rd, Kasarvadavali, Thane West, Thane, Maharashtra 400615, India","Opposite​ Holy Cross Hospital, Karnik road, Syndicate, Kalyan west, Maharashtra 421301, India",28.2,completed,19,Friday
