day_b,city_id,driver_uuid,vehicle_uuid,partner_uuid,uuid,request_timestamp_local,status,is_cash_trip,begintrip_timestamp_local,begintrip_lat,begintrip_lng,destination_lat,destination_lng,dropoff_timestamp_local,dropoff_lat,dropoff_lng,Trip UUID,Driver UUID,Driver first name,Driver surname,Vehicle UUID,Number plate,Service type,Trip request time,Trip drop-off time,Pick-up address,Drop-off address,Trip distance,Trip status,Hour,DayOfWeek
2022-11-18,215,5fa4096a-6bd1-4f8d-9daf-de6d7d20147e,be2d1699-5a52-429d-9d6b-d664663e73f1,3b4d8666-3ea1-45a1-b270-f879eed28df0,73934bcd-609d-4a62-ba9e-b13e9a83f0b1,2022-11-18 08:37:55,completed,False,2022-11-18 08:51:41,19.405745,72.83927,19.458347,72.83927,2022-11-18 09:22:04,19.458218,72.80107,73934bcd-609d-4a62-ba9e-b13e9a83f0b1,5fa4096a-6bd1-4f8d-9daf-de6d7d20147e,Irshad,Ahmed,be2d1699-5a52-429d-9d6b-d664663e73f1,MH01DR6127,personal_transport,2022-11-18 08:37:55,2022-11-18 09:22:04,"5, Evershine City, Vasai East, Vasai-Virar, Maharashtra 401209, India","FR53+5XX, Viva College Rd, Vartak Ward, Virar West, Thane, Maharashtra 401303, India",10.03,completed,8,Friday
2022-11-18,215,5fa4096a-6bd1-4f8d-9daf-de6d7d20147e,be2d1699-5a52-429d-9d6b-d664663e73f1,3b4d8666-3ea1-45a1-b270-f879eed28df0,4e3faf34-0716-4746-9b9b-fe72fa2b218a,2022-11-18 10:06:46,rider_canceled,False,,19.466307,72.806465,19.455145,72.806465,,19.46630657,72.80646503,4e3faf34-0716-4746-9b9b-fe72fa2b218a,5fa4096a-6bd1-4f8d-9daf-de6d7d20147e,Irshad,Ahmed,be2d1699-5a52-429d-9d6b-d664663e73f1,MH01DR6127,personal_transport,2022-11-18 10:06:46,0,"Raja Chatrapati Shivaji Marg, Vartak Ward, Virar West, Virar, Maharashtra 401303, India","Raja Chatrapati Shivaji Marg, Vartak Ward, Virar West, Virar, Maharashtra 401303, India",0.0,rider_cancelled,10,Friday
2022-11-18,215,5fa4096a-6bd1-4f8d-9daf-de6d7d20147e,be2d1699-5a52-429d-9d6b-d664663e73f1,3b4d8666-3ea1-45a1-b270-f879eed28df0,e87e2063-a597-4873-9b59-e131f7b33f49,2022-11-18 10:14:11,rider_canceled,False,,19.460405,72.80474,19.455145,72.80474,,19.47037315,72.79687321,e87e2063-a597-4873-9b59-e131f7b33f49,5fa4096a-6bd1-4f8d-9daf-de6d7d20147e,Irshad,Ahmed,be2d1699-5a52-429d-9d6b-d664663e73f1,MH01DR6127,personal_transport,2022-11-18 10:14:11,0,"Raja Chatrapati Shivaji Marg, Vartak Ward, Virar West, Virar, Maharashtra 401303, India","Raja Chatrapati Shivaji Marg, Vartak Ward, Virar West, Virar, Maharashtra 401303, India",0.0,rider_cancelled,10,Friday
2022-11-18,215,5fa4096a-6bd1-4f8d-9daf-de6d7d20147e,be2d1699-5a52-429d-9d6b-d664663e73f1,3b4d8666-3ea1-45a1-b270-f879eed28df0,a1f3a4c9-471e-496b-adcf-ddbc3a412aa7,2022-11-18 12:42:56,completed,False,2022-11-18 12:54:15,19.44324,72.800385,19.469461,72.800385,2022-11-18 13:19:24,19.453396,72.80124,a1f3a4c9-471e-496b-adcf-ddbc3a412aa7,5fa4096a-6bd1-4f8d-9daf-de6d7d20147e,Irshad,Ahmed,be2d1699-5a52-429d-9d6b-d664663e73f1,MH01DR6127,personal_transport,2022-11-18 12:42:56,2022-11-18 13:19:24,"Virar Gardens, Bolinj, Virar West, Virar, Maharashtra 401303, India","Agarwal Paramount, Rustomjee Global City, Virar West, Virar, Maharashtra",4.37,completed,12,Friday
2022-11-18,215,5fa4096a-6bd1-4f8d-9daf-de6d7d20147e,be2d1699-5a52-429d-9d6b-d664663e73f1,3b4d8666-3ea1-45a1-b270-f879eed28df0,d64b6276-7a85-45e9-b5da-3e3c558f7599,2022-11-18 13:33:37,rider_canceled,False,,19.444342,72.81844,19.441095,72.81844,,19.4381367,72.81785667,d64b6276-7a85-45e9-b5da-3e3c558f7599,5fa4096a-6bd1-4f8d-9daf-de6d7d20147e,Irshad,Ahmed,be2d1699-5a52-429d-9d6b-d664663e73f1,MH01DR6127,personal_transport,2022-11-18 13:33:37,0,"Aarush Hospital Suruchi Apartment Manvelpada Virar East, Aarush Hospital, Ground floor, Suruchi Apartment, Manvelpada Rd, near Mohak City, Ekvira Darshan, Virar East, Virar, Maharashtra","Aarush Hospital Suruchi Apartment Manvelpada Virar East, Aarush Hospital, Ground floor, Suruchi Apartment, Manvelpada Rd, near Mohak City, Ekvira Darshan, Virar East, Virar, Maharashtra",0.0,rider_cancelled,13,Friday
2022-11-18,215,5fa4096a-6bd1-4f8d-9daf-de6d7d20147e,be2d1699-5a52-429d-9d6b-d664663e73f1,3b4d8666-3ea1-45a1-b270-f879eed28df0,826dbd02-e88e-4229-b5fc-8bd9dbd3b09c,2022-11-18 16:43:08,completed,False,2022-11-18 16:58:02,19.404226,72.8332,19.247831,72.8332,2022-11-18 18:05:59,19.24784,72.984,826dbd02-e88e-4229-b5fc-8bd9dbd3b09c,5fa4096a-6bd1-4f8d-9daf-de6d7d20147e,Irshad,Ahmed,be2d1699-5a52-429d-9d6b-d664663e73f1,MH01DR6127,personal_transport,2022-11-18 16:43:08,2022-11-18 18:05:59,"WING B-28, INDIRAPURAM CO-OPERATIVE HOUSING SOCIETY, वसंत नगरि, वसई पूर्व, वसई, महाराष्ट्र 401209, India","A6, Brahmand, Thane West, Thane, Maharashtra 400607, India",33.72,completed,16,Friday
