day_b,city_id,driver_uuid,vehicle_uuid,partner_uuid,uuid,request_timestamp_local,status,is_cash_trip,begintrip_timestamp_local,begintrip_lat,begintrip_lng,destination_lat,destination_lng,dropoff_timestamp_local,dropoff_lat,dropoff_lng,Trip UUID,Driver UUID,Driver first name,Driver surname,Vehicle UUID,Number plate,Service type,Trip request time,Trip drop-off time,Pick-up address,Drop-off address,Trip distance,Trip status,Hour,DayOfWeek
2022-11-18,215,6042a2ed-2e9b-4724-9cbe-6d855a256c9e,228bf426-24f8-444e-8f6a-4cd21dcc8d1f,a18502aa-847e-4e8d-8af5-a9783722040f,df4e35ac-9a8e-4cc6-b467-56d96d0aaa20,2022-11-18 06:33:55,rider_canceled,False,,19.199673,72.99744,19.187113,72.99744,,19.19660485,72.99044132,df4e35ac-9a8e-4cc6-b467-56d96d0aaa20,6042a2ed-2e9b-4724-9cbe-6d855a256c9e,Mohd Zubair,-,228bf426-24f8-444e-8f6a-4cd21dcc8d1f,MH01DR7679,personal_transport,2022-11-18 06:33:55,0,"Thane Railway Station, Thane West, Thane, Maharashtra, India","Thane Railway Station, Thane West, Thane, Maharashtra, India",0.0,rider_cancelled,6,Friday
2022-11-18,215,6042a2ed-2e9b-4724-9cbe-6d855a256c9e,228bf426-24f8-444e-8f6a-4cd21dcc8d1f,a18502aa-847e-4e8d-8af5-a9783722040f,ad9f8115-2409-4752-aed5-1ceb3a237b6c,2022-11-18 06:41:32,completed,True,2022-11-18 06:49:22,19.187325,72.977005,19.258804,72.977005,2022-11-18 07:40:13,19.259027,72.85977,ad9f8115-2409-4752-aed5-1ceb3a237b6c,6042a2ed-2e9b-4724-9cbe-6d855a256c9e,Mohd Zubair,-,228bf426-24f8-444e-8f6a-4cd21dcc8d1f,MH01DR7679,personal_transport,2022-11-18 06:41:32,2022-11-18 07:40:13,"Station Rd, Juhu Chandan Society, Jambli Naka, Thane West, Thane, Maharashtra 400601, India","Earlier ""Veg Klub"" Restaurant was located here), 3, CS Link Rd, opposite Swami Narayan temple, Sudhindra Nagar, Dahisar East, Mumbai, Maharashtra 400068, India",25.75,completed,6,Friday
2022-11-18,215,6042a2ed-2e9b-4724-9cbe-6d855a256c9e,228bf426-24f8-444e-8f6a-4cd21dcc8d1f,a18502aa-847e-4e8d-8af5-a9783722040f,109bf58e-3460-4462-b509-7420e03073a0,2022-11-18 07:37:35,completed,True,2022-11-18 07:45:42,19.252628,72.86009,19.064154,72.86009,2022-11-18 09:00:07,19.064249,72.86345,109bf58e-3460-4462-b509-7420e03073a0,6042a2ed-2e9b-4724-9cbe-6d855a256c9e,Mohd Zubair,-,228bf426-24f8-444e-8f6a-4cd21dcc8d1f,MH01DR7679,personal_transport,2022-11-18 07:37:35,2022-11-18 09:00:07,"Shop no 8 Old Parsi Chawl Harishankar Road Dahisar East, Krishna Colony, Dahisar East, Mumbai, Maharashtra 400068, India","diamond market, G Block BKC, Bandra Kurla Complex, Bandra East, Mumbai, Maharashtra 400051, India",25.95,completed,7,Friday
2022-11-18,215,6042a2ed-2e9b-4724-9cbe-6d855a256c9e,228bf426-24f8-444e-8f6a-4cd21dcc8d1f,a18502aa-847e-4e8d-8af5-a9783722040f,cffcfdc9-3c80-40e0-8a70-289079ca8f2a,2022-11-18 09:01:41,completed,False,2022-11-18 09:12:44,19.06557,72.854385,18.999468,72.854385,2022-11-18 09:46:15,18.998135,72.829124,cffcfdc9-3c80-40e0-8a70-289079ca8f2a,6042a2ed-2e9b-4724-9cbe-6d855a256c9e,Mohd Zubair,-,228bf426-24f8-444e-8f6a-4cd21dcc8d1f,MH01DR7679,personal_transport,2022-11-18 09:01:41,2022-11-18 09:46:15,"Bharat Nagar, 3V83+5RP, Ekta Society, Patthar Nagar, Valmiki Nagar, Bandra East, Mumbai, Maharashtra 400051, India","Peninsula Spenta, Mathuradas Mill Compound, 1, Senapati Bapat Marg, Lower Parel, Mumbai, Maharashtra 400013, India",10.39,completed,9,Friday
2022-11-18,215,6042a2ed-2e9b-4724-9cbe-6d855a256c9e,228bf426-24f8-444e-8f6a-4cd21dcc8d1f,a18502aa-847e-4e8d-8af5-a9783722040f,99ce7559-b6d4-41dc-9b4f-eda98a159d9f,2022-11-18 10:02:26,completed,False,2022-11-18 10:08:36,19.016556,72.829254,19.020723,72.829254,2022-11-18 10:15:36,19.020737,72.84148,99ce7559-b6d4-41dc-9b4f-eda98a159d9f,6042a2ed-2e9b-4724-9cbe-6d855a256c9e,Mohd Zubair,-,228bf426-24f8-444e-8f6a-4cd21dcc8d1f,MH01DR7679,personal_transport,2022-11-18 10:02:26,2022-11-18 10:15:36,"G/8, Tapasya Building, Opposite Ravindra Natya Mandir Dr Dsilva Wadi, V S Marg, Prabhadevi, Mumbai - 400025, RBI Colony, Prabhadevi, Mumbai, Maharashtra 400025, India","364/A, Bedekar Sadan, N C. Kelkar Rd, Dadar West, Dadar, Mumbai, Maharashtra 400028, India",1.51,completed,10,Friday
2022-11-18,215,6042a2ed-2e9b-4724-9cbe-6d855a256c9e,228bf426-24f8-444e-8f6a-4cd21dcc8d1f,a18502aa-847e-4e8d-8af5-a9783722040f,88080f9b-8596-4943-9e35-468952e0bdee,2022-11-18 10:14:21,completed,False,2022-11-18 10:23:14,19.020613,72.848495,19.130848,72.848495,2022-11-18 11:11:44,19.130777,72.86737,88080f9b-8596-4943-9e35-468952e0bdee,6042a2ed-2e9b-4724-9cbe-6d855a256c9e,Mohd Zubair,-,228bf426-24f8-444e-8f6a-4cd21dcc8d1f,MH01DR7679,personal_transport,2022-11-18 10:14:21,2022-11-18 11:11:44,"180, Hindu Colony, Dadar, Mumbai, Maharashtra 400014, India","18 -A, Vallabhai Patel Rd, Takshila Colony, Indira Nagar, Jogeshwari East, Mumbai, Maharashtra 400093, India",15.94,completed,10,Friday
2022-11-18,215,6042a2ed-2e9b-4724-9cbe-6d855a256c9e,228bf426-24f8-444e-8f6a-4cd21dcc8d1f,a18502aa-847e-4e8d-8af5-a9783722040f,efbc58b8-0f89-43aa-971e-705f52177723,2022-11-18 11:02:13,completed,False,2022-11-18 11:24:14,19.128769,72.86366,19.14036,72.86366,2022-11-18 12:22:36,19.141083,72.82486,efbc58b8-0f89-43aa-971e-705f52177723,6042a2ed-2e9b-4724-9cbe-6d855a256c9e,Mohd Zubair,-,228bf426-24f8-444e-8f6a-4cd21dcc8d1f,MH01DR7679,personal_transport,2022-11-18 11:02:13,2022-11-18 12:22:36,"Shere Punjab gymkhana, Madhukunj Society, Sher E Punjab Colony, Jogeshwari East, Mumbai, Maharashtra 400093, India","401, Swami Samarth Nagar, Lokhandwala Complex, Andheri West, Mumbai, Maharashtra 400053, India",8.95,completed,11,Friday
2022-11-18,215,6042a2ed-2e9b-4724-9cbe-6d855a256c9e,228bf426-24f8-444e-8f6a-4cd21dcc8d1f,a18502aa-847e-4e8d-8af5-a9783722040f,d4cd4c59-9357-4075-85da-8fb2923508da,2022-11-18 12:21:31,completed,True,2022-11-18 12:26:13,19.137539,72.825615,19.157656,72.825615,2022-11-18 12:42:19,19.15784,72.839806,d4cd4c59-9357-4075-85da-8fb2923508da,6042a2ed-2e9b-4724-9cbe-6d855a256c9e,Mohd Zubair,-,228bf426-24f8-444e-8f6a-4cd21dcc8d1f,MH01DR7679,personal_transport,2022-11-18 12:21:31,2022-11-18 12:42:19,"201, Vastu Precinct, Lokhandwala Complex Rd, opp. Mercedes Showroom, Shastri Nagar, Andheri West, Mumbai, Maharashtra 400053, India","83/665, near The Salvation Army Church, Motilal Nagar I, Goregaon West, Mumbai, Maharashtra 400104, India",3.99,completed,12,Friday
