day_b,city_id,driver_uuid,vehicle_uuid,partner_uuid,uuid,request_timestamp_local,status,is_cash_trip,begintrip_timestamp_local,begintrip_lat,begintrip_lng,destination_lat,destination_lng,dropoff_timestamp_local,dropoff_lat,dropoff_lng,Trip UUID,Driver UUID,Driver first name,Driver surname,Vehicle UUID,Number plate,Service type,Trip request time,Trip drop-off time,Pick-up address,Drop-off address,Trip distance,Trip status,Hour,DayOfWeek
2022-11-18,215,60651d97-7053-487d-b33c-e13ccb520f21,b287f362-9d2e-443e-a2c5-faf2181f46ce,293fe8ea-1c04-4813-aa30-27ccb0c4cda3,9295c3e9-0727-4ccb-9179-ab4c65f0e200,2022-11-18 08:43:50,completed,False,2022-11-18 08:54:21,19.242168,72.86506,19.103697,72.86506,2022-11-18 10:06:57,19.103712,72.88461,9295c3e9-0727-4ccb-9179-ab4c65f0e200,60651d97-7053-487d-b33c-e13ccb520f21,MOHD AFTAB ALAM,-,b287f362-9d2e-443e-a2c5-faf2181f46ce,MH01DR8680,personal_transport,2022-11-18 08:43:50,2022-11-18 10:06:57,"Shop No-4,5,6 & 7, Nancy Colony, Sant Dnyaneshwar Rd, Veer Savarkar Nagar, Shankheshwar Nagar, Borivali East, Mumbai, Maharashtra 400066, India","Andheri - Kurla Rd, Andheri (E, Saki Naka, Mumbai, Maharashtra 400072, India",19.09,completed,8,Friday
2022-11-18,215,60651d97-7053-487d-b33c-e13ccb520f21,b287f362-9d2e-443e-a2c5-faf2181f46ce,293fe8ea-1c04-4813-aa30-27ccb0c4cda3,e22cbf95-d77f-49a8-a088-aff03ded314d,2022-11-18 10:06:17,completed,True,2022-11-18 10:21:13,19.110418,72.88383,19.441534,72.88383,2022-11-18 11:38:24,19.441399,72.87232,e22cbf95-d77f-49a8-a088-aff03ded314d,60651d97-7053-487d-b33c-e13ccb520f21,MOHD AFTAB ALAM,-,b287f362-9d2e-443e-a2c5-faf2181f46ce,MH01DR8680,personal_transport,2022-11-18 10:06:17,2022-11-18 11:38:24,"401, Shivai Plaza, 79, Marol Cooperative Industrial Estate Rd, Gamdevi, Marol, Andheri East, Mumbai, Maharashtra 400059, India","Unnamed Road, Wakanpada, Nalasopara East, Nala Sopara, Maharashtra 401208, India",46.2,completed,10,Friday
2022-11-18,215,60651d97-7053-487d-b33c-e13ccb520f21,b287f362-9d2e-443e-a2c5-faf2181f46ce,293fe8ea-1c04-4813-aa30-27ccb0c4cda3,3a08c876-95ff-4f40-aaef-ef7ec374c403,2022-11-18 11:53:50,completed,True,2022-11-18 12:00:44,19.44025,72.876335,19.162855,72.876335,2022-11-18 13:24:35,19.163506,72.83316,3a08c876-95ff-4f40-aaef-ef7ec374c403,60651d97-7053-487d-b33c-e13ccb520f21,MOHD AFTAB ALAM,-,b287f362-9d2e-443e-a2c5-faf2181f46ce,MH01DR8680,personal_transport,2022-11-18 11:53:50,2022-11-18 13:24:35,"Pelhar Rd, Wakanpada, Nalasopara East, Dhaniv, Maharashtra 401208, India","Orion-C Vasant Galaxy, 5R7M+422, Jai Taramani CHS, Bangur Nagar, Goregaon West, Mumbai, Maharashtra 400104, India",38.78,completed,11,Friday
2022-11-18,215,60651d97-7053-487d-b33c-e13ccb520f21,b287f362-9d2e-443e-a2c5-faf2181f46ce,293fe8ea-1c04-4813-aa30-27ccb0c4cda3,f9c3dfaa-b43d-472b-82a7-9a3ec067c205,2022-11-18 14:43:43,completed,False,2022-11-18 14:53:35,19.167343,72.83527,19.12178,72.83527,2022-11-18 15:33:53,19.12175,72.892204,f9c3dfaa-b43d-472b-82a7-9a3ec067c205,60651d97-7053-487d-b33c-e13ccb520f21,MOHD AFTAB ALAM,-,b287f362-9d2e-443e-a2c5-faf2181f46ce,MH01DR8680,personal_transport,2022-11-18 14:43:43,2022-11-18 15:33:53,"343/2739, Motilal Nagar 2, Opp. Bangur Nagar, Link Road, Goregaon west, Motilal Nagar II, Goregaon West, Mumbai, Maharashtra 400104, India","L&T Emerald Isle, Gate No 6, Tower-8, Saki Vihar Rd, New Mhada Colony, Savarkar Nagar, Chandivali, Powai, Mumbai, Maharashtra 400072, India",14.92,completed,14,Friday
2022-11-18,215,60651d97-7053-487d-b33c-e13ccb520f21,b287f362-9d2e-443e-a2c5-faf2181f46ce,293fe8ea-1c04-4813-aa30-27ccb0c4cda3,38cd63aa-5dd5-4fd4-b22e-6f5449225579,2022-11-18 15:32:23,completed,True,2022-11-18 15:46:30,19.134018,72.89949,19.190838,72.89949,2022-11-18 16:31:32,19.191729,72.83653,38cd63aa-5dd5-4fd4-b22e-6f5449225579,60651d97-7053-487d-b33c-e13ccb520f21,MOHD AFTAB ALAM,-,b287f362-9d2e-443e-a2c5-faf2181f46ce,MH01DR8680,personal_transport,2022-11-18 15:32:23,2022-11-18 16:31:32,"Central Chinmaya Mission Trust, Saki Vihar Rd, next to Hotel Renaissance, Kailash Nagar, Mayur Nagar, Morarji Nagar, Powai, Mumbai, Maharashtra 400072, India","Agarwal B2B Centre, D'monte Lane Next to Malad Industrial Estate, Malad, Kanchpada, Malad West, Mumbai, Maharashtra 400064, India",14.34,completed,15,Friday
2022-11-18,215,60651d97-7053-487d-b33c-e13ccb520f21,b287f362-9d2e-443e-a2c5-faf2181f46ce,293fe8ea-1c04-4813-aa30-27ccb0c4cda3,0fe740f5-6f54-48cf-81a4-a922c66c640d,2022-11-18 17:22:03,completed,False,2022-11-18 17:42:40,19.187437,72.84817,19.38065,72.84817,2022-11-18 19:17:46,19.38072,72.824,0fe740f5-6f54-48cf-81a4-a922c66c640d,60651d97-7053-487d-b33c-e13ccb520f21,MOHD AFTAB ALAM,-,b287f362-9d2e-443e-a2c5-faf2181f46ce,MH01DR8680,personal_transport,2022-11-18 17:22:03,2022-11-18 19:17:46,"1, Parekh Road, Malad, Vijaykar Wadi Industrial, Vijaykar Wadi, Malad West, Mumbai, Maharashtra 400064, India","DG Nagar Rd, Navghar, Vasai West, Navghar-Manikpur, Maharashtra 401202, India",37.82,completed,17,Friday
2022-11-18,215,60651d97-7053-487d-b33c-e13ccb520f21,b287f362-9d2e-443e-a2c5-faf2181f46ce,293fe8ea-1c04-4813-aa30-27ccb0c4cda3,269a3872-c8c7-479c-ace6-ed73a9e27a3b,2022-11-18 19:24:52,completed,False,2022-11-18 19:46:51,19.406736,72.83672,19.220531,72.83672,2022-11-18 20:52:34,19.22046,72.86279,269a3872-c8c7-479c-ace6-ed73a9e27a3b,60651d97-7053-487d-b33c-e13ccb520f21,MOHD AFTAB ALAM,-,b287f362-9d2e-443e-a2c5-faf2181f46ce,MH01DR8680,personal_transport,2022-11-18 19:24:52,2022-11-18 20:52:34,"CR4P+PR4 Vasai-Virar, Maharashtra, India","Apex Multispeciality Hospital, Dattapada Road, Off, Western Express Hwy, next to Suswagat Restaurant, Food Corporation of India Warehouse, Borivali East, Mumbai, Maharashtra 400066, India",30.45,completed,19,Friday
