day_b,city_id,driver_uuid,vehicle_uuid,partner_uuid,uuid,request_timestamp_local,status,is_cash_trip,begintrip_timestamp_local,begintrip_lat,begintrip_lng,destination_lat,destination_lng,dropoff_timestamp_local,dropoff_lat,dropoff_lng,Trip UUID,Driver UUID,Driver first name,Driver surname,Vehicle UUID,Number plate,Service type,Trip request time,Trip drop-off time,Pick-up address,Drop-off address,Trip distance,Trip status,Hour,DayOfWeek
2022-11-18,215,6147d42e-9cec-4ef7-92bc-67edd91065a0,4ececc6b-f58f-4bf2-8354-ac9f8a84eb06,8f1c637d-3b94-4534-85d4-db43842363d1,615e5edb-a77c-421f-93ce-9320ef175379,2022-11-18 18:11:06,completed,False,2022-11-18 18:22:45,19.060722,72.86441,19.130774,72.86441,2022-11-18 20:20:20,19.12899,72.82561,615e5edb-a77c-421f-93ce-9320ef175379,6147d42e-9cec-4ef7-92bc-67edd91065a0,NARAYAN,NADAR,4ececc6b-f58f-4bf2-8354-ac9f8a84eb06,MH01DR6083,personal_transport,2022-11-18 18:11:06,2022-11-18 20:20:20,One BKC,"Rao Saheb, Achutrao Patwardhan Marg, Four Bungalows, Andheri West, Mumbai, Maharashtra 400053, India",18.16,completed,18,Friday
2022-11-18,215,6147d42e-9cec-4ef7-92bc-67edd91065a0,4ececc6b-f58f-4bf2-8354-ac9f8a84eb06,8f1c637d-3b94-4534-85d4-db43842363d1,d86eab7d-a9a9-41a5-8abd-1636fbe926fa,2022-11-18 20:16:39,driver_canceled,False,,19.12899,72.82562,19.14204,72.82562,,19.13052487,72.82829535,d86eab7d-a9a9-41a5-8abd-1636fbe926fa,6147d42e-9cec-4ef7-92bc-67edd91065a0,NARAYAN,NADAR,4ececc6b-f58f-4bf2-8354-ac9f8a84eb06,MH01DR6083,personal_transport,2022-11-18 20:16:39,0,"Patel Estate Road, 4RRV+PHQ, Momin Nagar, Jogeshwari West, Momin Nagar, Jogeshwari West, Mumbai, Maharashtra 400102, India","Patel Estate Road, 4RRV+PHQ, Momin Nagar, Jogeshwari West, Momin Nagar, Jogeshwari West, Mumbai, Maharashtra 400102, India",0.0,driver_cancelled,20,Friday
2022-11-18,215,6147d42e-9cec-4ef7-92bc-67edd91065a0,4ececc6b-f58f-4bf2-8354-ac9f8a84eb06,8f1c637d-3b94-4534-85d4-db43842363d1,fce89bb4-8606-4a1b-a05c-817ec3f5ae62,2022-11-18 20:37:05,rider_canceled,False,,19.130535,72.828285,19.135271,72.828285,,19.13053024,72.82834995,fce89bb4-8606-4a1b-a05c-817ec3f5ae62,6147d42e-9cec-4ef7-92bc-67edd91065a0,NARAYAN,NADAR,4ececc6b-f58f-4bf2-8354-ac9f8a84eb06,MH01DR6083,personal_transport,2022-11-18 20:37:05,0,"Fun Republic Multiplex Cenepolies Fun Rebublic Cinima Theater, Industrial Area, Andheri West, Mumbai, Maharashtra 400047","Fun Republic Multiplex Cenepolies Fun Rebublic Cinima Theater, Industrial Area, Andheri West, Mumbai, Maharashtra 400047",0.0,rider_cancelled,20,Friday
2022-11-18,215,6147d42e-9cec-4ef7-92bc-67edd91065a0,4ececc6b-f58f-4bf2-8354-ac9f8a84eb06,8f1c637d-3b94-4534-85d4-db43842363d1,80146f2e-a291-446a-92c4-eefaaf133777,2022-11-18 20:39:26,rider_canceled,False,,19.130022,72.82819,19.064604,72.82819,,19.13109291,72.8255986,80146f2e-a291-446a-92c4-eefaaf133777,6147d42e-9cec-4ef7-92bc-67edd91065a0,NARAYAN,NADAR,4ececc6b-f58f-4bf2-8354-ac9f8a84eb06,MH01DR6083,personal_transport,2022-11-18 20:39:26,0,"Old, Swami Vivekananda Rd, near Midland Timber & Co, Khar, Khar West, Mumbai, Maharashtra 400052, India","Old, Swami Vivekananda Rd, near Midland Timber & Co, Khar, Khar West, Mumbai, Maharashtra 400052, India",0.0,rider_cancelled,20,Friday
2022-11-18,215,6147d42e-9cec-4ef7-92bc-67edd91065a0,4ececc6b-f58f-4bf2-8354-ac9f8a84eb06,8f1c637d-3b94-4534-85d4-db43842363d1,0f9ff135-9384-4b1b-abb5-983da80a3b4b,2022-11-18 20:49:12,completed,True,2022-11-18 21:02:50,19.134647,72.82108,19.069542,72.82108,2022-11-18 21:44:22,19.069344,72.829994,0f9ff135-9384-4b1b-abb5-983da80a3b4b,6147d42e-9cec-4ef7-92bc-67edd91065a0,NARAYAN,NADAR,4ececc6b-f58f-4bf2-8354-ac9f8a84eb06,MH01DR6083,personal_transport,2022-11-18 20:49:12,2022-11-18 21:44:22,"Plot no 21, Vidhneswar Temple Marg, Swastik Cooperative Housing Society, SV Patel Nagar, Andheri West, Mumbai, Maharashtra 400053, India","Dunhill, Dr Ambedkar Rd, Khar West, Mumbai, Maharashtra 400052, India",10.34,completed,20,Friday
2022-11-18,215,6147d42e-9cec-4ef7-92bc-67edd91065a0,4ececc6b-f58f-4bf2-8354-ac9f8a84eb06,8f1c637d-3b94-4534-85d4-db43842363d1,5c2d9bca-7e70-476b-9f7a-f6618270f2c2,2022-11-18 21:56:39,completed,False,2022-11-18 22:00:49,19.065578,72.83102,19.062038,72.83102,2022-11-18 22:27:46,19.061764,72.89354,5c2d9bca-7e70-476b-9f7a-f6618270f2c2,6147d42e-9cec-4ef7-92bc-67edd91065a0,NARAYAN,NADAR,4ececc6b-f58f-4bf2-8354-ac9f8a84eb06,MH01DR6083,personal_transport,2022-11-18 21:56:39,2022-11-18 22:27:46,"16th & 33rd Cross Road, Pali, Khar West, Bandra West, Mumbai, Maharashtra 400050, India","Mm Spectra, Sai Baba Nagar, Kurla, Mumbai, Maharashtra 400071, India",9.9,completed,21,Friday
