day_b,city_id,driver_uuid,vehicle_uuid,partner_uuid,uuid,request_timestamp_local,status,is_cash_trip,begintrip_timestamp_local,begintrip_lat,begintrip_lng,destination_lat,destination_lng,dropoff_timestamp_local,dropoff_lat,dropoff_lng,Trip UUID,Driver UUID,Driver first name,Driver surname,Vehicle UUID,Number plate,Service type,Trip request time,Trip drop-off time,Pick-up address,Drop-off address,Trip distance,Trip status,Hour,DayOfWeek
2022-11-18,215,66a58f75-2acd-41e7-a714-274faf026eb6,b73315f6-757e-46d2-a95e-eff149470162,8b20931b-0c97-4b92-88a5-ddb8bb08bd0e,521978ca-585c-4b62-92c7-e694f70a52cc,2022-11-18 18:14:17,completed,False,2022-11-18 18:28:08,19.07808,72.85233,19.285563,72.85233,2022-11-18 20:20:27,19.285458,72.87268,521978ca-585c-4b62-92c7-e694f70a52cc,66a58f75-2acd-41e7-a714-274faf026eb6,Ashish,-,b73315f6-757e-46d2-a95e-eff149470162,MH01DR4086,personal_transport,2022-11-18 18:14:17,2022-11-18 20:20:27,"Gharkul Society, Gharkul Society, Siddharath Nagar, Vakola, Santacruz East, Mumbai, Maharashtra 400055, India","Happy Home Heights, Poonam Gardans, Chandan Shanti, Mira Road, Mira Bhayandar, Maharashtra 401107, India",26.29,completed,18,Friday
2022-11-18,215,66a58f75-2acd-41e7-a714-274faf026eb6,b73315f6-757e-46d2-a95e-eff149470162,8b20931b-0c97-4b92-88a5-ddb8bb08bd0e,284cadbb-777b-4207-9619-11f1261ae422,2022-11-18 20:40:47,completed,True,2022-11-18 20:54:48,19.286598,72.867714,19.219522,72.867714,2022-11-18 22:06:13,19.21949,72.95275,284cadbb-777b-4207-9619-11f1261ae422,66a58f75-2acd-41e7-a714-274faf026eb6,Ashish,-,b73315f6-757e-46d2-a95e-eff149470162,MH01DR4086,personal_transport,2022-11-18 20:40:47,2022-11-18 22:06:13,"S.V.CBANK BUILDING, Mira Bhayandar Rd, near IceFactory, opp. McDonald's, Bharti Nagar, Mira Road, Thane, Maharashtra 401107, India","Upvan Lake, Thane West, Thane, Maharashtra",23.24,completed,20,Friday
2022-11-18,215,66a58f75-2acd-41e7-a714-274faf026eb6,b73315f6-757e-46d2-a95e-eff149470162,8b20931b-0c97-4b92-88a5-ddb8bb08bd0e,203045a9-0f51-4354-b4a5-cb1f6dcf9e13,2022-11-18 22:22:39,completed,True,2022-11-18 22:35:19,19.225157,72.963455,19.017534,72.963455,2022-11-18 23:30:15,19.017576,72.84394,203045a9-0f51-4354-b4a5-cb1f6dcf9e13,66a58f75-2acd-41e7-a714-274faf026eb6,Ashish,-,b73315f6-757e-46d2-a95e-eff149470162,MH01DR4086,personal_transport,2022-11-18 22:22:39,2022-11-18 23:30:15,"2B, SIDDHACHAL HOUSING SOCIETY-1 PHASE 6, सिद्धाचल हाउसिंग सोसायटी, पवार नगर, ठाणे वेस्ट, ठाणे, महाराष्ट्र 400610, India","2R9V+Q5Q, Kavi Keshavsut Flyover, Lokmanya Tilak Colony, Dadar, Mumbai, Maharashtra 400028, India",29.59,completed,22,Friday
2022-11-18,215,66a58f75-2acd-41e7-a714-274faf026eb6,b73315f6-757e-46d2-a95e-eff149470162,8b20931b-0c97-4b92-88a5-ddb8bb08bd0e,74352499-e09a-41c6-b0c0-2395cd4d54af,2022-11-18 23:32:43,completed,True,2022-11-18 23:42:22,19.016842,72.84343,19.194046,72.84343,2022-11-19 00:34:55,19.193924,72.85901,74352499-e09a-41c6-b0c0-2395cd4d54af,66a58f75-2acd-41e7-a714-274faf026eb6,Ashish,-,b73315f6-757e-46d2-a95e-eff149470162,MH01DR4086,personal_transport,2022-11-18 23:32:43,2022-11-19 00:34:55,"5/14, DSP Rd, near Kailash Mandir Lassi & Sweets, Lokmanya Tilak Colony, Dadar, Mumbai, Maharashtra 400014, India","Malad, Padmaba Nagar, Kandivali East, Mumbai, Maharashtra 400101, India",22.26,completed,23,Friday
2022-11-19,215,66a58f75-2acd-41e7-a714-274faf026eb6,b73315f6-757e-46d2-a95e-eff149470162,8b20931b-0c97-4b92-88a5-ddb8bb08bd0e,48efaff7-5eed-4683-89e0-019ecec8025b,2022-11-19 01:21:59,completed,False,2022-11-19 01:25:48,19.174091,72.86051,19.234404,72.86051,2022-11-19 02:31:10,19.233042,72.98866,48efaff7-5eed-4683-89e0-019ecec8025b,66a58f75-2acd-41e7-a714-274faf026eb6,Ashish,-,b73315f6-757e-46d2-a95e-eff149470162,MH01DR4086,personal_transport,2022-11-19 01:21:59,2022-11-19 02:31:10,Oberoi Mall,"Kolshet Rd, Kolshet Industrial Area, Thane West, Thane, Maharashtra 400607, India",31.65,completed,1,Saturday
2022-11-19,215,66a58f75-2acd-41e7-a714-274faf026eb6,b73315f6-757e-46d2-a95e-eff149470162,8b20931b-0c97-4b92-88a5-ddb8bb08bd0e,65fe53fd-f4d5-4f86-8dd9-ecdb45afb6d0,2022-11-19 03:20:33,rider_canceled,False,,19.229996,72.98499,19.099628,72.98499,,19.22999597,72.98498964,65fe53fd-f4d5-4f86-8dd9-ecdb45afb6d0,66a58f75-2acd-41e7-a714-274faf026eb6,Ashish,-,b73315f6-757e-46d2-a95e-eff149470162,MH01DR4086,personal_transport,2022-11-19 03:20:33,0,"Terminal 2, Navpada, Vile Parle East, Vile Parle, Mumbai, Maharashtra 400099, India","Terminal 2, Navpada, Vile Parle East, Vile Parle, Mumbai, Maharashtra 400099, India",0.0,rider_cancelled,3,Saturday
