day_b,city_id,driver_uuid,vehicle_uuid,partner_uuid,uuid,request_timestamp_local,status,is_cash_trip,begintrip_timestamp_local,begintrip_lat,begintrip_lng,destination_lat,destination_lng,dropoff_timestamp_local,dropoff_lat,dropoff_lng,Trip UUID,Driver UUID,Driver first name,Driver surname,Vehicle UUID,Number plate,Service type,Trip request time,Trip drop-off time,Pick-up address,Drop-off address,Trip distance,Trip status,Hour,DayOfWeek
2022-11-18,215,69feba80-4137-4ef7-aa7b-b7071b159a90,7a842689-aace-4604-99b8-3af0c94bbcdf,b3b4662c-d58d-46a3-81c1-a0a56c2a957e,744aa80e-3789-4974-8374-28aea8915d75,2022-11-18 16:17:49,completed,True,2022-11-18 16:29:59,19.212784,72.981636,19.261726,72.981636,2022-11-18 16:53:10,19.261393,72.95999,744aa80e-3789-4974-8374-28aea8915d75,69feba80-4137-4ef7-aa7b-b7071b159a90,Danish,Khan,7a842689-aace-4604-99b8-3af0c94bbcdf,MH01DR9442,personal_transport,2022-11-18 16:17:49,2022-11-18 16:53:10,"201, Majiwada Village Rd, Rayon CHS, Tirumala Society, Sainath Nagar, Majiwada, Thane, Maharashtra 400601, India","BLOCK-1, हावरे सिटी, ठाणे वेस्ट, ठाणे, महाराष्ट्र 400615, India",7.18,completed,16,Friday
2022-11-18,215,69feba80-4137-4ef7-aa7b-b7071b159a90,7a842689-aace-4604-99b8-3af0c94bbcdf,b3b4662c-d58d-46a3-81c1-a0a56c2a957e,bc58a206-9192-434d-9d6b-295a4caf64a9,2022-11-18 16:33:04,completed,True,2022-11-18 16:56:20,19.261684,72.96326,19.285475,72.96326,2022-11-18 17:25:34,19.285229,72.87578,bc58a206-9192-434d-9d6b-295a4caf64a9,69feba80-4137-4ef7-aa7b-b7071b159a90,Danish,Khan,7a842689-aace-4604-99b8-3af0c94bbcdf,MH01DR9442,personal_transport,2022-11-18 16:33:04,2022-11-18 17:25:34,"Mumbai Cricket Club , near TMC reservation Ground ,Beside Kavya hill view , New dp road, 7X67+P93, Ghodbunder Rd, Sai Nagar, Anand Nagar, Thane West, Thane, Maharashtra 400615, India","7VMG+W8P, GCC Club Rd, Chandan Shanti, Mira Road, Mira Bhayandar, Maharashtra 401107, India",14.52,completed,16,Friday
2022-11-18,215,69feba80-4137-4ef7-aa7b-b7071b159a90,7a842689-aace-4604-99b8-3af0c94bbcdf,b3b4662c-d58d-46a3-81c1-a0a56c2a957e,43fa20c8-8cab-4400-8380-b842f7fb0b25,2022-11-18 17:25:53,completed,False,2022-11-18 17:34:55,19.285011,72.86772,19.099628,72.86772,2022-11-18 18:30:51,19.099773,72.8755,43fa20c8-8cab-4400-8380-b842f7fb0b25,69feba80-4137-4ef7-aa7b-b7071b159a90,Danish,Khan,7a842689-aace-4604-99b8-3af0c94bbcdf,MH01DR9442,personal_transport,2022-11-18 17:25:53,2022-11-18 18:30:51,"WING-A, Mira Bhayandar Rd, Bharti Nagar, Mira Road, Mira Bhayandar, Maharashtra 401107, India","Terminal 2, Navpada, Vile Parle East, Vile Parle, Mumbai, Maharashtra 400099, India",25.18,completed,17,Friday
2022-11-18,215,69feba80-4137-4ef7-aa7b-b7071b159a90,7a842689-aace-4604-99b8-3af0c94bbcdf,b3b4662c-d58d-46a3-81c1-a0a56c2a957e,d2d3d32b-5c17-4dba-be4a-53914fe1442c,2022-11-18 18:24:52,rider_canceled,False,,19.10318,72.87215,19.119465,72.87215,,19.09978926,72.87550688,d2d3d32b-5c17-4dba-be4a-53914fe1442c,69feba80-4137-4ef7-aa7b-b7071b159a90,Danish,Khan,7a842689-aace-4604-99b8-3af0c94bbcdf,MH01DR9442,personal_transport,2022-11-18 18:24:52,0,"LAKESIDE CO-OPERATIVE HOUSING SOCIETY LAKESIDE, Raheja Vihar, Chandivali, Powai, Mumbai, Maharashtra 400072, India","LAKESIDE CO-OPERATIVE HOUSING SOCIETY LAKESIDE, Raheja Vihar, Chandivali, Powai, Mumbai, Maharashtra 400072, India",0.0,rider_cancelled,18,Friday
2022-11-18,215,69feba80-4137-4ef7-aa7b-b7071b159a90,7a842689-aace-4604-99b8-3af0c94bbcdf,b3b4662c-d58d-46a3-81c1-a0a56c2a957e,c701a1eb-5cab-4251-a47f-b3826f09ff99,2022-11-18 18:31:49,completed,True,2022-11-18 18:47:37,19.100441,72.87318,19.122715,72.87318,2022-11-18 19:36:39,19.122845,72.831276,c701a1eb-5cab-4251-a47f-b3826f09ff99,69feba80-4137-4ef7-aa7b-b7071b159a90,Danish,Khan,7a842689-aace-4604-99b8-3af0c94bbcdf,MH01DR9442,personal_transport,2022-11-18 18:31:49,2022-11-18 19:36:39,International,"29, Kashibai Mahadev Marg, Shakti Nagar, Shanti Nagar, D.N.Nagar, Andheri West, Mumbai, Maharashtra 400058, India",7.67,completed,18,Friday
2022-11-18,215,69feba80-4137-4ef7-aa7b-b7071b159a90,7a842689-aace-4604-99b8-3af0c94bbcdf,b3b4662c-d58d-46a3-81c1-a0a56c2a957e,a596c131-9457-4b7d-b0e7-7a67f1f0e39e,2022-11-18 19:25:00,completed,False,2022-11-18 19:43:49,19.122696,72.83132,19.103094,72.83132,2022-11-18 21:06:29,19.103071,72.88698,a596c131-9457-4b7d-b0e7-7a67f1f0e39e,69feba80-4137-4ef7-aa7b-b7071b159a90,Danish,Khan,7a842689-aace-4604-99b8-3af0c94bbcdf,MH01DR9442,personal_transport,2022-11-18 19:25:00,2022-11-18 21:06:29,"29, Kashibai Mahadev Marg, Shakti Nagar, Shanti Nagar, D.N.Nagar, Andheri West, Mumbai, Maharashtra 400058, India","Sakinaka, Junction, Andheri - Kurla Rd, Safed Pul, Andheri East, Mumbai, Maharashtra 400072, India",10.4,completed,19,Friday
2022-11-18,215,69feba80-4137-4ef7-aa7b-b7071b159a90,7a842689-aace-4604-99b8-3af0c94bbcdf,b3b4662c-d58d-46a3-81c1-a0a56c2a957e,ea2db1da-b6e5-48a6-890c-31b4645b9c28,2022-11-18 22:16:10,rider_canceled,True,,19.103228,72.8887,19.039572,72.8887,,19.10561323,72.88767207,ea2db1da-b6e5-48a6-890c-31b4645b9c28,69feba80-4137-4ef7-aa7b-b7071b159a90,Danish,Khan,7a842689-aace-4604-99b8-3af0c94bbcdf,MH01DR9442,personal_transport,2022-11-18 22:16:10,0,"60 Feet Road, near chotta sion hospital, Kunchikorve Nagar, RP Nagar, Dharavi, Mumbai, Maharashtra 400017, India","60 Feet Road, near chotta sion hospital, Kunchikorve Nagar, RP Nagar, Dharavi, Mumbai, Maharashtra 400017, India",0.0,rider_cancelled,22,Friday
2022-11-18,215,69feba80-4137-4ef7-aa7b-b7071b159a90,7a842689-aace-4604-99b8-3af0c94bbcdf,b3b4662c-d58d-46a3-81c1-a0a56c2a957e,a3ca8e88-5407-4164-8f75-24817aaadb43,2022-11-18 22:39:11,completed,True,2022-11-18 22:49:15,19.107534,72.88317,19.199713,72.88317,2022-11-18 23:54:22,19.199936,72.965775,a3ca8e88-5407-4164-8f75-24817aaadb43,69feba80-4137-4ef7-aa7b-b7071b159a90,Danish,Khan,7a842689-aace-4604-99b8-3af0c94bbcdf,MH01DR9442,personal_transport,2022-11-18 22:39:11,2022-11-18 23:54:22,Times Square Building,"Ganeshwadi, behind Nitin Company, Ramabai Ambedkar Nagar, Panch Pakhdi, Thane West, Thane, Maharashtra 400601, India",22.09,completed,22,Friday
