day_b,city_id,driver_uuid,vehicle_uuid,partner_uuid,uuid,request_timestamp_local,status,is_cash_trip,begintrip_timestamp_local,begintrip_lat,begintrip_lng,destination_lat,destination_lng,dropoff_timestamp_local,dropoff_lat,dropoff_lng,Trip UUID,Driver UUID,Driver first name,Driver surname,Vehicle UUID,Number plate,Service type,Trip request time,Trip drop-off time,Pick-up address,Drop-off address,Trip distance,Trip status,Hour,DayOfWeek
2022-11-18,215,6c96898e-57af-46bf-8851-953d2f6ea66e,94694d2c-d286-4290-85cf-ae538a5c9b15,83c6150e-fbd6-4ffa-affd-527eddddb0a0,2634a2b0-2c6c-4d29-af61-f74cef67302f,2022-11-18 14:29:42,completed,True,2022-11-18 14:40:14,19.076792,72.902054,18.993437,72.902054,2022-11-18 15:17:29,18.99395,72.84866,2634a2b0-2c6c-4d29-af61-f74cef67302f,6c96898e-57af-46bf-8851-953d2f6ea66e,RAJJAQ,SHAIKH,94694d2c-d286-4290-85cf-ae538a5c9b15,MH01CV5895,personal_transport,2022-11-18 14:29:42,2022-11-18 15:17:29,"Road Number 7, Rajawadi Colony, Ghatkopar East, Neelkhanth Valley, Vidyavihar, Mumbai, Maharashtra 400077, India","Celestia Spaces Sewri, Cotton Green Zakaria B, Abhyudaya Nagar, Parel, Mumbai, Maharashtra 400033",12.84,completed,14,Friday
2022-11-18,215,6c96898e-57af-46bf-8851-953d2f6ea66e,94694d2c-d286-4290-85cf-ae538a5c9b15,83c6150e-fbd6-4ffa-affd-527eddddb0a0,d98994e0-112c-4eee-8b8c-0edb5dc456a1,2022-11-18 15:14:31,completed,True,2022-11-18 15:30:07,18.996643,72.84929,19.0654,72.84929,2022-11-18 16:17:13,19.068901,72.99761,d98994e0-112c-4eee-8b8c-0edb5dc456a1,6c96898e-57af-46bf-8851-953d2f6ea66e,RAJJAQ,SHAIKH,94694d2c-d286-4290-85cf-ae538a5c9b15,MH01CV5895,personal_transport,2022-11-18 15:14:31,2022-11-18 16:17:13,"4, Tokershi Jivraj Rd, Tilak Nagar, Parel, Mumbai, Maharashtra 400015, India","Sector 30, Vashi, Navi Mumbai, Maharashtra 400703, India",20.44,completed,15,Friday
2022-11-18,215,6c96898e-57af-46bf-8851-953d2f6ea66e,94694d2c-d286-4290-85cf-ae538a5c9b15,83c6150e-fbd6-4ffa-affd-527eddddb0a0,69302ecd-5a63-4002-b03d-708fb23396ab,2022-11-18 17:45:09,completed,True,2022-11-18 17:56:56,19.09076,72.83775,19.029663,72.83775,2022-11-18 18:28:33,19.030281,72.83991,69302ecd-5a63-4002-b03d-708fb23396ab,6c96898e-57af-46bf-8851-953d2f6ea66e,RAJJAQ,SHAIKH,94694d2c-d286-4290-85cf-ae538a5c9b15,MH01CV5895,personal_transport,2022-11-18 17:45:09,2022-11-18 18:28:33,"Vikas Center, Swami Vivekananda Rd, BEST Colony, Juhu, Mumbai, Maharashtra 400054, India","Lieutenant Dilip Gupte Marg, Kataria Colony, Shivaji Park, Mumbai, Maharashtra 400016, India",11.07,completed,17,Friday
2022-11-18,215,6c96898e-57af-46bf-8851-953d2f6ea66e,94694d2c-d286-4290-85cf-ae538a5c9b15,83c6150e-fbd6-4ffa-affd-527eddddb0a0,276d05ad-1a81-4dbb-8fb3-d58f5584e42c,2022-11-18 19:54:17,completed,False,2022-11-18 20:03:54,19.168175,72.94235,19.07686,72.94235,2022-11-18 20:46:08,19.075861,72.90117,276d05ad-1a81-4dbb-8fb3-d58f5584e42c,6c96898e-57af-46bf-8851-953d2f6ea66e,RAJJAQ,SHAIKH,94694d2c-d286-4290-85cf-ae538a5c9b15,MH01CV5895,personal_transport,2022-11-18 19:54:17,2022-11-18 20:46:08,"Asha Nagar, Mulund West, Mumbai, Maharashtra 400080, India","Road Number 7, Rajawadi Colony, Ghatkopar East, Neelkhanth Valley, Vidyavihar, Mumbai, Maharashtra 400077, India",16.46,completed,19,Friday
2022-11-18,215,6c96898e-57af-46bf-8851-953d2f6ea66e,94694d2c-d286-4290-85cf-ae538a5c9b15,83c6150e-fbd6-4ffa-affd-527eddddb0a0,bb2073e9-794c-4148-860f-32ebc0ec4eaf,2022-11-18 20:47:57,completed,False,2022-11-18 20:57:00,19.07994,72.90405,19.12046,72.90405,2022-11-18 21:20:33,19.120512,72.90961,bb2073e9-794c-4148-860f-32ebc0ec4eaf,6c96898e-57af-46bf-8851-953d2f6ea66e,RAJJAQ,SHAIKH,94694d2c-d286-4290-85cf-ae538a5c9b15,MH01CV5895,personal_transport,2022-11-18 20:47:57,2022-11-18 21:20:33,"Kailash Regency, Behind Gandhi Market, 3WJ3+84H, Mahatma Gandhi Rd, Rajawadi Colony, Ghatkopar East, Mumbai, Maharashtra 400077, India","6 Orchard Ave Delphi B Wing, Hiranandani Gardens, Panchkutir Ganesh Nagar, Powai, Mumbai, Maharashtra 400076, India",11.92,completed,20,Friday
2022-11-18,215,6c96898e-57af-46bf-8851-953d2f6ea66e,94694d2c-d286-4290-85cf-ae538a5c9b15,83c6150e-fbd6-4ffa-affd-527eddddb0a0,d9807c54-a78d-43e8-b332-a24aee75893a,2022-11-18 21:22:47,rider_canceled,False,,19.119217,72.90895,19.057417,72.90895,,19.11921799,72.90894544,d9807c54-a78d-43e8-b332-a24aee75893a,6c96898e-57af-46bf-8851-953d2f6ea66e,RAJJAQ,SHAIKH,94694d2c-d286-4290-85cf-ae538a5c9b15,MH01CV5895,personal_transport,2022-11-18 21:22:47,0,"Shop No 2, Gayatri Niwas, Post Office, DK Sandhu Marg, Chembur Gaothan, Chembur, Mumbai, Maharashtra 400071, India","Shop No 2, Gayatri Niwas, Post Office, DK Sandhu Marg, Chembur Gaothan, Chembur, Mumbai, Maharashtra 400071, India",0.0,rider_cancelled,21,Friday
2022-11-18,215,6c96898e-57af-46bf-8851-953d2f6ea66e,94694d2c-d286-4290-85cf-ae538a5c9b15,83c6150e-fbd6-4ffa-affd-527eddddb0a0,b81740ed-8e03-45dd-9535-139578502a30,2022-11-18 21:29:04,completed,False,2022-11-18 21:35:59,19.12576,72.916985,19.057417,72.916985,2022-11-18 21:56:13,19.057316,72.89828,b81740ed-8e03-45dd-9535-139578502a30,6c96898e-57af-46bf-8851-953d2f6ea66e,RAJJAQ,SHAIKH,94694d2c-d286-4290-85cf-ae538a5c9b15,MH01CV5895,personal_transport,2022-11-18 21:29:04,2022-11-18 21:56:13,"IIT Area, Powai, Mumbai, Maharashtra 400076, India","Shop No 2, Gayatri Niwas, Post Office, DK Sandhu Marg, Chembur Gaothan, Chembur, Mumbai, Maharashtra 400071, India",11.63,completed,21,Friday
