day_b,city_id,driver_uuid,vehicle_uuid,partner_uuid,uuid,request_timestamp_local,status,is_cash_trip,begintrip_timestamp_local,begintrip_lat,begintrip_lng,destination_lat,destination_lng,dropoff_timestamp_local,dropoff_lat,dropoff_lng,Trip UUID,Driver UUID,Driver first name,Driver surname,Vehicle UUID,Number plate,Service type,Trip request time,Trip drop-off time,Pick-up address,Drop-off address,Trip distance,Trip status,Hour,DayOfWeek
2022-11-18,215,716c6914-f90a-4c45-b000-14067ccf6950,ff7dfda5-b20d-46c1-af10-755223fd0425,8b20931b-0c97-4b92-88a5-ddb8bb08bd0e,2c91a231-a27f-48e6-997f-2a6da09021b2,2022-11-18 05:39:02,rider_canceled,True,,19.068232,72.89192,19.056547,72.89192,,19.06741893,72.89316964,2c91a231-a27f-48e6-997f-2a6da09021b2,716c6914-f90a-4c45-b000-14067ccf6950,JAVED,SIDDIQUI,ff7dfda5-b20d-46c1-af10-755223fd0425,MH01DR7522,personal_transport,2022-11-18 05:39:02,0,"Khardev Nagar, Sambhaji Nagar, Chembur, Mumbai, Maharashtra 400071, India","Khardev Nagar, Sambhaji Nagar, Chembur, Mumbai, Maharashtra 400071, India",0.0,rider_cancelled,5,Friday
2022-11-18,215,716c6914-f90a-4c45-b000-14067ccf6950,ff7dfda5-b20d-46c1-af10-755223fd0425,8b20931b-0c97-4b92-88a5-ddb8bb08bd0e,94c953c6-d6a1-432c-9d2e-19a72b9203b9,2022-11-18 09:41:02,driver_canceled,True,,19.074652,72.87973,19.062681,72.87973,,19.07103062,72.88584328,94c953c6-d6a1-432c-9d2e-19a72b9203b9,716c6914-f90a-4c45-b000-14067ccf6950,JAVED,SIDDIQUI,ff7dfda5-b20d-46c1-af10-755223fd0425,MH01DR7522,personal_transport,2022-11-18 09:41:02,0,"Jio World Centre, G Block, Bandra Kurla Complex, Bandra East, Mumbai, Maharashtra 400098, India","Jio World Centre, G Block, Bandra Kurla Complex, Bandra East, Mumbai, Maharashtra 400098, India",0.0,driver_cancelled,9,Friday
2022-11-18,215,716c6914-f90a-4c45-b000-14067ccf6950,ff7dfda5-b20d-46c1-af10-755223fd0425,8b20931b-0c97-4b92-88a5-ddb8bb08bd0e,1030ba0a-63c7-4aeb-9377-b045ada4f24e,2022-11-18 09:55:06,completed,True,2022-11-18 10:05:46,19.07031,72.896,19.001698,72.896,2022-11-18 11:00:00,19.001656,72.82924,1030ba0a-63c7-4aeb-9377-b045ada4f24e,716c6914-f90a-4c45-b000-14067ccf6950,JAVED,SIDDIQUI,ff7dfda5-b20d-46c1-af10-755223fd0425,MH01DR7522,personal_transport,2022-11-18 09:55:06,2022-11-18 11:00:00,"Shop.6, Building No.77, near Noble Chemist, Chembur West, Tilak Nagar, Chembur, Mumbai, Maharashtra 400089, India","LODHA SUPREMUS, लोअर परेल, मुंबई, महाराष्ट्र 400013, India",12.35,completed,9,Friday
2022-11-18,215,716c6914-f90a-4c45-b000-14067ccf6950,ff7dfda5-b20d-46c1-af10-755223fd0425,8b20931b-0c97-4b92-88a5-ddb8bb08bd0e,86416ff4-d30d-411c-8720-8ac85cb09c9d,2022-11-18 16:50:33,completed,True,2022-11-18 16:55:52,19.071186,72.87614,19.06337,72.87614,2022-11-18 17:09:58,19.063253,72.86122,86416ff4-d30d-411c-8720-8ac85cb09c9d,716c6914-f90a-4c45-b000-14067ccf6950,JAVED,SIDDIQUI,ff7dfda5-b20d-46c1-af10-755223fd0425,MH01DR7522,personal_transport,2022-11-18 16:50:33,2022-11-18 17:09:58,Equinox Business Park,"Ground Floor, The Capital, G Block Rd, G Block BKC, Bandra Kurla Complex, Bandra East, Mumbai, Maharashtra 400051, India",1.82,completed,16,Friday
2022-11-18,215,716c6914-f90a-4c45-b000-14067ccf6950,ff7dfda5-b20d-46c1-af10-755223fd0425,8b20931b-0c97-4b92-88a5-ddb8bb08bd0e,38ed816d-020f-4f0d-8e6a-39c306a15dd4,2022-11-18 17:40:39,completed,True,2022-11-18 17:47:12,19.062044,72.863655,19.151823,72.863655,2022-11-18 18:44:51,19.151844,72.93819,38ed816d-020f-4f0d-8e6a-39c306a15dd4,716c6914-f90a-4c45-b000-14067ccf6950,JAVED,SIDDIQUI,ff7dfda5-b20d-46c1-af10-755223fd0425,MH01DR7522,personal_transport,2022-11-18 17:40:39,2022-11-18 18:44:51,Kotak Wealth Management,"Rolex Metal Industries Compound, Village Road, Lal Bahadur Shastri Rd, Bhandup, Subhash Nagar, Bhandup West, Mumbai, Maharashtra 400078, India",20.41,completed,17,Friday
2022-11-18,215,716c6914-f90a-4c45-b000-14067ccf6950,ff7dfda5-b20d-46c1-af10-755223fd0425,8b20931b-0c97-4b92-88a5-ddb8bb08bd0e,cd91277e-6e2d-4139-ba42-b3e56acf0b3a,2022-11-18 18:35:11,rider_canceled,True,,19.157173,72.943504,19.08176,72.943504,,19.15171325,72.9389497,cd91277e-6e2d-4139-ba42-b3e56acf0b3a,716c6914-f90a-4c45-b000-14067ccf6950,JAVED,SIDDIQUI,ff7dfda5-b20d-46c1-af10-755223fd0425,MH01DR7522,personal_transport,2022-11-18 18:35:11,0,"Off LBS Road, 3VJH+PQ4, Magan Nathuram Rd, Kurla West, Kurla, Mumbai, Maharashtra 400070, India","Off LBS Road, 3VJH+PQ4, Magan Nathuram Rd, Kurla West, Kurla, Mumbai, Maharashtra 400070, India",0.0,rider_cancelled,18,Friday
2022-11-18,215,716c6914-f90a-4c45-b000-14067ccf6950,ff7dfda5-b20d-46c1-af10-755223fd0425,8b20931b-0c97-4b92-88a5-ddb8bb08bd0e,a5ee9c92-1566-4e27-b4be-c19063a93f9d,2022-11-18 20:11:30,completed,True,2022-11-18 20:39:21,19.13725,72.92403,19.156992,72.92403,2022-11-18 21:44:03,19.158035,72.83889,a5ee9c92-1566-4e27-b4be-c19063a93f9d,716c6914-f90a-4c45-b000-14067ccf6950,JAVED,SIDDIQUI,ff7dfda5-b20d-46c1-af10-755223fd0425,MH01DR7522,personal_transport,2022-11-18 20:11:30,2022-11-18 21:44:03,"268, Lalbahadur Shastri Rd, Naval Civilian Housing Colony, New Colony, Kanjurmarg West, Bhandup West, Mumbai, Maharashtra 400078, India","Motilal Nagar I, Goregaon West, Mumbai, Maharashtra 400062",15.58,completed,20,Friday
2022-11-18,215,716c6914-f90a-4c45-b000-14067ccf6950,ff7dfda5-b20d-46c1-af10-755223fd0425,8b20931b-0c97-4b92-88a5-ddb8bb08bd0e,3aead40c-16b8-4f0e-81cb-2e5a7c4d5ffe,2022-11-18 21:49:53,rider_canceled,True,,19.159203,72.837776,19.04384,72.837776,,19.15931022,72.83541667,3aead40c-16b8-4f0e-81cb-2e5a7c4d5ffe,716c6914-f90a-4c45-b000-14067ccf6950,JAVED,SIDDIQUI,ff7dfda5-b20d-46c1-af10-755223fd0425,MH01DR7522,personal_transport,2022-11-18 21:49:53,0,"Plot, 53, TV Chidambaran Marg, Air Force Quarters, Sion East, Sion, Mumbai, Maharashtra 400022, India","Plot, 53, TV Chidambaran Marg, Air Force Quarters, Sion East, Sion, Mumbai, Maharashtra 400022, India",0.0,rider_cancelled,21,Friday
2022-11-18,215,716c6914-f90a-4c45-b000-14067ccf6950,ff7dfda5-b20d-46c1-af10-755223fd0425,8b20931b-0c97-4b92-88a5-ddb8bb08bd0e,51d6bb6b-79d7-479f-80d6-8d2619da749a,2022-11-18 21:51:08,completed,True,2022-11-18 22:04:58,19.175726,72.83739,19.069698,72.83739,2022-11-18 22:55:28,19.07025,72.896126,51d6bb6b-79d7-479f-80d6-8d2619da749a,716c6914-f90a-4c45-b000-14067ccf6950,JAVED,SIDDIQUI,ff7dfda5-b20d-46c1-af10-755223fd0425,MH01DR7522,personal_transport,2022-11-18 21:51:08,2022-11-18 22:55:28,"Siddhachal Arcade CTS Nos. 1084C & 1186A, New Link Rd, Malad, Sunder Nagar, Malad West, Mumbai, Maharashtra 400064, India","3VCW+2G6, Near Vidyavihar Station East, Chembur West, Tilak Nagar, Chembur, Mumbai, Maharashtra 400089, India",20.74,completed,21,Friday
