day_b,city_id,driver_uuid,vehicle_uuid,partner_uuid,uuid,request_timestamp_local,status,is_cash_trip,begintrip_timestamp_local,begintrip_lat,begintrip_lng,destination_lat,destination_lng,dropoff_timestamp_local,dropoff_lat,dropoff_lng,Trip UUID,Driver UUID,Driver first name,Driver surname,Vehicle UUID,Number plate,Service type,Trip request time,Trip drop-off time,Pick-up address,Drop-off address,Trip distance,Trip status,Hour,DayOfWeek
2022-11-18,215,71867592-f98f-4611-ae3d-adfa0704189b,492e692e-fc12-41f1-955f-ef653d65b3b8,517e1bbb-df7d-4280-a71c-d26ebfe12173,e7a6d7cc-5e8a-4c73-95ea-d782515dc05e,2022-11-18 07:45:07,rider_canceled,True,,19.102669,72.84483,18.78832,72.84483,,19.10266829,72.84483004,e7a6d7cc-5e8a-4c73-95ea-d782515dc05e,71867592-f98f-4611-ae3d-adfa0704189b,Dinesh,Patel,492e692e-fc12-41f1-955f-ef653d65b3b8,MH01EE0330,personal_transport,2022-11-18 07:45:07,0,"Shop No. 06, Arihant Tower, B Wing, Near Hotel, Utsav, Railway Station Rd, Laxminagar, Khopoli, Maharashtra 410203, India","Shop No. 06, Arihant Tower, B Wing, Near Hotel, Utsav, Railway Station Rd, Laxminagar, Khopoli, Maharashtra 410203, India",0.0,rider_cancelled,7,Friday
2022-11-18,215,71867592-f98f-4611-ae3d-adfa0704189b,492e692e-fc12-41f1-955f-ef653d65b3b8,517e1bbb-df7d-4280-a71c-d26ebfe12173,708eeab7-ef69-4777-8dae-4c5c14c3847c,2022-11-18 08:19:36,completed,True,2022-11-18 08:25:01,19.101398,72.849335,19.174017,72.849335,2022-11-18 08:52:02,19.173988,72.84169,708eeab7-ef69-4777-8dae-4c5c14c3847c,71867592-f98f-4611-ae3d-adfa0704189b,Dinesh,Patel,492e692e-fc12-41f1-955f-ef653d65b3b8,MH01EE0330,personal_transport,2022-11-18 08:19:36,2022-11-18 08:52:02,"Vaikunth Society, Prarthana Samaj Rd, Satsang CHSL, Navpada, Park Road, Vile Parle, Mumbai, Maharashtra 400057, India","Ez Zone Mall, Ez Zone Mall, Goregaon - Mulund Link Rd, Malad, Sunder Nagar, Malad West, Mumbai, Maharashtra 400064, India",11.69,completed,8,Friday
2022-11-18,215,71867592-f98f-4611-ae3d-adfa0704189b,492e692e-fc12-41f1-955f-ef653d65b3b8,517e1bbb-df7d-4280-a71c-d26ebfe12173,4e0ab1df-b061-42ad-82a1-6fd7cf95f62d,2022-11-18 09:08:21,completed,True,2022-11-18 09:18:32,19.192404,72.842606,18.998606,72.842606,2022-11-18 10:46:02,18.998594,72.84009,4e0ab1df-b061-42ad-82a1-6fd7cf95f62d,71867592-f98f-4611-ae3d-adfa0704189b,Dinesh,Patel,492e692e-fc12-41f1-955f-ef653d65b3b8,MH01EE0330,personal_transport,2022-11-18 09:08:21,2022-11-18 10:46:02,"Santbhuvan Building, Chunilal Giridharilal Marg, Malad, Adarsh Nagar, Malad West, Mumbai, Maharashtra 400064, India","36 B, Dr RK Shirodkar Marg, Parel, Mumbai, Maharashtra 400012, India",26.26,completed,9,Friday
2022-11-18,215,71867592-f98f-4611-ae3d-adfa0704189b,492e692e-fc12-41f1-955f-ef653d65b3b8,517e1bbb-df7d-4280-a71c-d26ebfe12173,61ab191f-ffae-4c83-9676-9e18712bda54,2022-11-18 10:43:59,completed,True,2022-11-18 10:51:26,18.995274,72.840355,19.111866,72.840355,2022-11-18 11:56:56,19.111124,72.833336,61ab191f-ffae-4c83-9676-9e18712bda54,71867592-f98f-4611-ae3d-adfa0704189b,Dinesh,Patel,492e692e-fc12-41f1-955f-ef653d65b3b8,MH01EE0330,personal_transport,2022-11-18 10:43:59,2022-11-18 11:56:56,"Dr SS Rao Marg, Parel East, Parel, Mumbai, Maharashtra 400012, India","GMC Cross Rd Number 5, Gulmohar Road, MHADA Colony, Juhu, Mumbai, Maharashtra 400047, India",17.94,completed,10,Friday
2022-11-18,215,71867592-f98f-4611-ae3d-adfa0704189b,492e692e-fc12-41f1-955f-ef653d65b3b8,517e1bbb-df7d-4280-a71c-d26ebfe12173,31dda6b7-7d20-4029-9a1e-16082433c093,2022-11-18 11:55:53,completed,True,2022-11-18 12:01:43,19.111256,72.8346,19.2472,72.8346,2022-11-18 12:56:02,19.247286,72.861305,31dda6b7-7d20-4029-9a1e-16082433c093,71867592-f98f-4611-ae3d-adfa0704189b,Dinesh,Patel,492e692e-fc12-41f1-955f-ef653d65b3b8,MH01EE0330,personal_transport,2022-11-18 11:55:53,2022-11-18 12:56:02,"Kalpataru Solitaire, Gulmohar Road, MHADA Colony, Vile Parle West, Mumbai, Maharashtra 400047","Maratha Colony, 6VW6+WC8, Swami Vivekananda Marg, Maratha Colony, Dahisar East, Mumbai, Maharashtra 400068, India",17.97,completed,11,Friday
2022-11-18,215,71867592-f98f-4611-ae3d-adfa0704189b,492e692e-fc12-41f1-955f-ef653d65b3b8,517e1bbb-df7d-4280-a71c-d26ebfe12173,66f20bc4-1c07-4c5f-a41b-3ffae52d2516,2022-11-18 12:53:05,rider_canceled,False,,19.244621,72.86324,19.232254,72.86324,,19.2473017,72.86131334,66f20bc4-1c07-4c5f-a41b-3ffae52d2516,71867592-f98f-4611-ae3d-adfa0704189b,Dinesh,Patel,492e692e-fc12-41f1-955f-ef653d65b3b8,MH01EE0330,personal_transport,2022-11-18 12:53:05,0,"Shop No 4-5, Ground Floor, Floor, Emerald, B-Wing Final Plot No 90, Roshan Nagar, Borivali West, Mumbai, Maharashtra 400092, India","Shop No 4-5, Ground Floor, Floor, Emerald, B-Wing Final Plot No 90, Roshan Nagar, Borivali West, Mumbai, Maharashtra 400092, India",0.0,rider_cancelled,12,Friday
