day_b,city_id,driver_uuid,vehicle_uuid,partner_uuid,uuid,request_timestamp_local,status,is_cash_trip,begintrip_timestamp_local,begintrip_lat,begintrip_lng,destination_lat,destination_lng,dropoff_timestamp_local,dropoff_lat,dropoff_lng,Trip UUID,Driver UUID,Driver first name,Driver surname,Vehicle UUID,Number plate,Service type,Trip request time,Trip drop-off time,Pick-up address,Drop-off address,Trip distance,Trip status,Hour,DayOfWeek
2022-11-18,215,72910a17-6d3d-4d82-a4c6-01de65c22cdb,9f7a373d-f884-4888-a425-6bf359e9e4b3,49968b23-3835-4e0b-a603-cd424355cbc3,fcf7eb9b-c032-48a2-a060-cfb39189b7f6,2022-11-18 07:40:20,completed,False,2022-11-18 07:46:37,19.169827,73.07337,19.16887,73.07337,2022-11-18 08:25:54,19.168911,73.00083,fcf7eb9b-c032-48a2-a060-cfb39189b7f6,72910a17-6d3d-4d82-a4c6-01de65c22cdb,MOHMMAD GULAFAM,-,9f7a373d-f884-4888-a425-6bf359e9e4b3,MH01EE1015,personal_transport,2022-11-18 07:40:20,2022-11-18 08:25:54,"701, Europa B Wing Casa Bella Gold, Palava City, Casa Bella Gold, Lodha, Dombivli, Maharashtra 421204, India","5292+H24, Gavate Wadi, MIDC, Airoli, Navi Mumbai, Maharashtra 400708, India",18.53,completed,7,Friday
2022-11-18,215,72910a17-6d3d-4d82-a4c6-01de65c22cdb,9f7a373d-f884-4888-a425-6bf359e9e4b3,49968b23-3835-4e0b-a603-cd424355cbc3,8ef2b34a-58fb-47f2-9143-bf4c5cf6e0c7,2022-11-18 08:17:35,completed,False,2022-11-18 08:35:12,19.183369,72.992935,19.021666,72.992935,2022-11-18 09:46:00,19.01716,72.84493,8ef2b34a-58fb-47f2-9143-bf4c5cf6e0c7,72910a17-6d3d-4d82-a4c6-01de65c22cdb,MOHMMAD GULAFAM,-,9f7a373d-f884-4888-a425-6bf359e9e4b3,MH01EE1015,personal_transport,2022-11-18 08:17:35,2022-11-18 09:46:00,"Green World, vitawa, Kalwa, Thane, Maharashtra 400605, India","Swaminarayan Chowk, Lakhamsi Napoo Rd, opp. Dadar Station, Dadar East, Dadar, Mumbai, Maharashtra 400014, India",28.42,completed,8,Friday
2022-11-18,215,72910a17-6d3d-4d82-a4c6-01de65c22cdb,9f7a373d-f884-4888-a425-6bf359e9e4b3,49968b23-3835-4e0b-a603-cd424355cbc3,4add171d-d96b-4ffb-b295-5f5207672081,2022-11-18 23:29:44,completed,True,2022-11-18 23:44:42,18.9219,72.833565,18.950819,72.833565,2022-11-18 23:56:45,18.950571,72.828926,4add171d-d96b-4ffb-b295-5f5207672081,72910a17-6d3d-4d82-a4c6-01de65c22cdb,MOHMMAD GULAFAM,-,9f7a373d-f884-4888-a425-6bf359e9e4b3,MH01EE1015,personal_transport,2022-11-18 23:29:44,2022-11-18 23:56:45,"Jetty No. 5, opposite Taj Hotel, near Gateway of India, Apollo Bandar, Colaba, Mumbai, Maharashtra 400001, India","Purshottamdas H. Purohit Marg, 262, 68, Kalbadevi Road, Marine Lines East, Ovalwadi, Gaiwadi, Kalbadevi, Mumbai, Maharashtra 400002, India",4.42,completed,23,Friday
2022-11-18,215,72910a17-6d3d-4d82-a4c6-01de65c22cdb,9f7a373d-f884-4888-a425-6bf359e9e4b3,49968b23-3835-4e0b-a603-cd424355cbc3,fc0b0b5b-1025-450d-91cc-7addc362dfce,2022-11-18 23:34:22,rider_canceled,False,,18.945614,72.83495,18.945751,72.83495,,18.94560838,72.8349787,fc0b0b5b-1025-450d-91cc-7addc362dfce,72910a17-6d3d-4d82-a4c6-01de65c22cdb,MOHMMAD GULAFAM,-,9f7a373d-f884-4888-a425-6bf359e9e4b3,MH01EE1015,personal_transport,2022-11-18 23:34:22,0,"Dr. D. N. Road B Block Sitaram Building, Crawford Market, Ramabai Ambedkar Marg, Dhobi Talao, Chhatrapati Shivaji Terminus Area, Fort, Mumbai, Maharashtra 400001, India","Dr. D. N. Road B Block Sitaram Building, Crawford Market, Ramabai Ambedkar Marg, Dhobi Talao, Chhatrapati Shivaji Terminus Area, Fort, Mumbai, Maharashtra 400001, India",0.0,rider_cancelled,23,Friday
2022-11-18,215,72910a17-6d3d-4d82-a4c6-01de65c22cdb,9f7a373d-f884-4888-a425-6bf359e9e4b3,49968b23-3835-4e0b-a603-cd424355cbc3,8432c25f-5260-4424-86f3-37792bce8cec,2022-11-18 23:56:33,completed,True,2022-11-19 00:00:00,18.94436,72.829315,19.183924,72.829315,2022-11-19 01:09:31,19.185162,73.04224,8432c25f-5260-4424-86f3-37792bce8cec,72910a17-6d3d-4d82-a4c6-01de65c22cdb,MOHMMAD GULAFAM,-,9f7a373d-f884-4888-a425-6bf359e9e4b3,MH01EE1015,personal_transport,2022-11-18 23:56:33,2022-11-19 01:09:31,"533, Kalbadevi Road, near Diana Sports, Dhobi Talao, Lohar Chawl, Kalbadevi, Mumbai, Maharashtra 400002, India","Sabe Gaon, Thane, Maharashtra 400612, India",49.81,completed,23,Friday
2022-11-19,215,72910a17-6d3d-4d82-a4c6-01de65c22cdb,9f7a373d-f884-4888-a425-6bf359e9e4b3,49968b23-3835-4e0b-a603-cd424355cbc3,31ba498d-2611-4620-9f33-7fad8c30225e,2022-11-19 01:41:53,completed,True,2022-11-19 01:47:59,19.152626,73.03315,19.247787,73.03315,2022-11-19 02:16:22,19.245556,73.11339,31ba498d-2611-4620-9f33-7fad8c30225e,72910a17-6d3d-4d82-a4c6-01de65c22cdb,MOHMMAD GULAFAM,-,9f7a373d-f884-4888-a425-6bf359e9e4b3,MH01EE1015,personal_transport,2022-11-19 01:41:53,2022-11-19 02:16:22,"Unnamed Road, 523M+337, Shibli Nagar, Kalsekar, Mumbra, Thane, Maharashtra 421204, India","beside, Sai Plush Apartment, Bhiwandi - Murbad Rd, Kon, Kongaon, Maharashtra 421311, India",17.85,completed,1,Saturday
2022-11-19,215,72910a17-6d3d-4d82-a4c6-01de65c22cdb,9f7a373d-f884-4888-a425-6bf359e9e4b3,49968b23-3835-4e0b-a603-cd424355cbc3,90880b2d-e9c1-4b97-a6ca-72664a79f5a6,2022-11-19 02:32:33,completed,True,2022-11-19 02:40:31,19.240524,73.12194,19.099743,73.12194,2022-11-19 03:32:40,19.099905,72.87476,90880b2d-e9c1-4b97-a6ca-72664a79f5a6,72910a17-6d3d-4d82-a4c6-01de65c22cdb,MOHMMAD GULAFAM,-,9f7a373d-f884-4888-a425-6bf359e9e4b3,MH01EE1015,personal_transport,2022-11-19 02:32:33,2022-11-19 03:32:40,"Najam Tower, Vallipeer Road, near Aslam Dairy Farm, Bhoiwada, Kalyan, Maharashtra 421301, India","Terminal 2, Navpada, Vile Parle East, Vile Parle, Mumbai, Maharashtra 400099, India",42.0,completed,2,Saturday
2022-11-19,215,72910a17-6d3d-4d82-a4c6-01de65c22cdb,9f7a373d-f884-4888-a425-6bf359e9e4b3,49968b23-3835-4e0b-a603-cd424355cbc3,0fa12340-100c-4965-99f0-66eb9d392736,2022-11-19 03:27:54,rider_canceled,False,,19.107738,72.87551,19.299232,72.87551,,19.09993637,72.87630975,0fa12340-100c-4965-99f0-66eb9d392736,72910a17-6d3d-4d82-a4c6-01de65c22cdb,MOHMMAD GULAFAM,-,9f7a373d-f884-4888-a425-6bf359e9e4b3,MH01EE1015,personal_transport,2022-11-19 03:27:54,0,"WING-B, Bhayandar, Chandmal Nagar, Bhayandar West, Mira Bhayandar, Maharashtra 401101, India","WING-B, Bhayandar, Chandmal Nagar, Bhayandar West, Mira Bhayandar, Maharashtra 401101, India",0.0,rider_cancelled,3,Saturday
2022-11-19,215,72910a17-6d3d-4d82-a4c6-01de65c22cdb,9f7a373d-f884-4888-a425-6bf359e9e4b3,49968b23-3835-4e0b-a603-cd424355cbc3,c1e9672d-ade8-4a1d-9064-4fdf7fb5e290,2022-11-19 03:36:18,completed,False,2022-11-19 03:54:35,19.100563,72.874374,18.954153,72.874374,2022-11-19 04:24:30,18.954208,72.79589,c1e9672d-ade8-4a1d-9064-4fdf7fb5e290,72910a17-6d3d-4d82-a4c6-01de65c22cdb,MOHMMAD GULAFAM,-,9f7a373d-f884-4888-a425-6bf359e9e4b3,MH01EE1015,personal_transport,2022-11-19 03:36:18,2022-11-19 04:24:30,International,"Dariya Mahal B, DAIRY MAHAL GARAGE, Navshanti Nagar, Malabar Hill, Mumbai, Maharashtra 400006, India",23.76,completed,3,Saturday
