day_b,city_id,driver_uuid,vehicle_uuid,partner_uuid,uuid,request_timestamp_local,status,is_cash_trip,begintrip_timestamp_local,begintrip_lat,begintrip_lng,destination_lat,destination_lng,dropoff_timestamp_local,dropoff_lat,dropoff_lng,Trip UUID,Driver UUID,Driver first name,Driver surname,Vehicle UUID,Number plate,Service type,Trip request time,Trip drop-off time,Pick-up address,Drop-off address,Trip distance,Trip status,Hour,DayOfWeek
2022-11-18,215,79fd49c6-a94f-4e8d-8503-bce38c412476,dde0a4d0-ae72-4abb-bc0a-97d239a237ab,517e1bbb-df7d-4280-a71c-d26ebfe12173,3cd41be7-5705-496e-961f-b22bdccca949,2022-11-18 05:33:02,completed,True,2022-11-18 05:43:10,19.100548,72.87372,19.262472,72.87372,2022-11-18 06:24:47,19.262686,72.97668,3cd41be7-5705-496e-961f-b22bdccca949,79fd49c6-a94f-4e8d-8503-bce38c412476,Satyam,Upadhyay,dde0a4d0-ae72-4abb-bc0a-97d239a237ab,MH01EE1327,personal_transport,2022-11-18 05:33:02,2022-11-18 06:24:47,International,"Swastik Regalia, 7X6G+XR6, Wagbil Rd, Kavesar, Thane West, Thane, Maharashtra 400615, India",28.36,completed,5,Friday
2022-11-18,215,79fd49c6-a94f-4e8d-8503-bce38c412476,dde0a4d0-ae72-4abb-bc0a-97d239a237ab,517e1bbb-df7d-4280-a71c-d26ebfe12173,1b403e21-d32c-431b-b9c6-4293e38b75f9,2022-11-18 06:26:25,completed,False,2022-11-18 07:01:08,19.25757,72.98136,19.071203,72.98136,2022-11-18 07:55:14,19.071396,72.863594,1b403e21-d32c-431b-b9c6-4293e38b75f9,79fd49c6-a94f-4e8d-8503-bce38c412476,Satyam,Upadhyay,dde0a4d0-ae72-4abb-bc0a-97d239a237ab,MH01EE1327,personal_transport,2022-11-18 06:26:25,2022-11-18 07:55:14,"Springhill, 7X4J+X9Q, Hiranandani Estate, Thane West, Thane, Maharashtra 400607, India","Centrum Broking Limited, Centrum House, CST Road, Kolivery Village, MMRDA Area, Kalina, Santacruz East, Mumbai, Maharashtra 400098, India",31.64,completed,6,Friday
2022-11-18,215,79fd49c6-a94f-4e8d-8503-bce38c412476,dde0a4d0-ae72-4abb-bc0a-97d239a237ab,517e1bbb-df7d-4280-a71c-d26ebfe12173,6fe549f1-aca7-4079-9919-1b9159fa617a,2022-11-18 08:04:19,completed,True,2022-11-18 08:08:17,19.073261,72.86779,19.05924,72.86779,2022-11-18 08:16:12,19.059153,72.86574,6fe549f1-aca7-4079-9919-1b9159fa617a,79fd49c6-a94f-4e8d-8503-bce38c412476,Satyam,Upadhyay,dde0a4d0-ae72-4abb-bc0a-97d239a237ab,MH01EE1327,personal_transport,2022-11-18 08:04:19,2022-11-18 08:16:12,"CST Road, Kolivery Village, Kunchi Kurve Nagar, Bandra Kurla Complex, Santacruz East, Mumbai, Maharashtra 400098, India","16th Godrej BKC Plot C, Bandra Kurla Complex, Bandra East, G Block BKC, Bandra Kurla Complex, Bandra East, Mumbai, Maharashtra 400051, India",2.54,completed,8,Friday
2022-11-18,215,79fd49c6-a94f-4e8d-8503-bce38c412476,dde0a4d0-ae72-4abb-bc0a-97d239a237ab,517e1bbb-df7d-4280-a71c-d26ebfe12173,9dc56aca-d36b-42f0-9248-69fd14b9ca8d,2022-11-18 08:12:30,completed,True,2022-11-18 08:26:08,19.051779,72.88609,18.9942,72.88609,2022-11-18 08:50:29,18.994226,72.83134,9dc56aca-d36b-42f0-9248-69fd14b9ca8d,79fd49c6-a94f-4e8d-8503-bce38c412476,Satyam,Upadhyay,dde0a4d0-ae72-4abb-bc0a-97d239a237ab,MH01EE1327,personal_transport,2022-11-18 08:12:30,2022-11-18 08:50:29,"VN Purav Marg, Sion - Trombay Rd, near Surana Sethia Hospital, Lal Dongar, Chembur, Mumbai, Maharashtra 400071, India","Mafatlal Mills Compound, NM Joshi Marg, BDD Chawl, Lower Parel, Mumbai, Maharashtra 400013, India",9.81,completed,8,Friday
2022-11-19,215,79fd49c6-a94f-4e8d-8503-bce38c412476,dde0a4d0-ae72-4abb-bc0a-97d239a237ab,517e1bbb-df7d-4280-a71c-d26ebfe12173,0087977b-2b4d-43b4-baaf-719b0e47edcd,2022-11-19 00:43:46,completed,True,2022-11-19 01:02:12,18.993982,72.820595,19.159046,72.820595,2022-11-19 02:18:51,19.153948,72.83306,0087977b-2b4d-43b4-baaf-719b0e47edcd,79fd49c6-a94f-4e8d-8503-bce38c412476,Satyam,Upadhyay,dde0a4d0-ae72-4abb-bc0a-97d239a237ab,MH01EE1327,personal_transport,2022-11-19 00:43:46,2022-11-19 02:18:51,"P-2, Bharat Bazar, Phoenix Mills Rd, Gandhi Nagar, Upper Worli, Worli, Mumbai, Maharashtra 400018, India","Oshiwara Industrial Center, Bhagat Singh II, Goregaon West, Mumbai, Maharashtra 400047",30.68,completed,0,Saturday
2022-11-19,215,79fd49c6-a94f-4e8d-8503-bce38c412476,dde0a4d0-ae72-4abb-bc0a-97d239a237ab,517e1bbb-df7d-4280-a71c-d26ebfe12173,d2bd60af-3c84-4f41-b0e6-b3f369d04f31,2022-11-19 02:19:38,completed,True,2022-11-19 02:28:54,19.146025,72.83239,19.062511,72.83239,2022-11-19 02:48:47,19.062563,72.83566,d2bd60af-3c84-4f41-b0e6-b3f369d04f31,79fd49c6-a94f-4e8d-8503-bce38c412476,Satyam,Upadhyay,dde0a4d0-ae72-4abb-bc0a-97d239a237ab,MH01EE1327,personal_transport,2022-11-19 02:19:38,2022-11-19 02:48:47,"4RWJ+FR5, Mhada Colony, Andheri West, Mumbai, Maharashtra 400047, India","269/D, Renuka Building, Vallabhbhai Patel Road, near National College, Khar, Bandra West, Mumbai, Maharashtra 400050, India",10.77,completed,2,Saturday
2022-11-19,215,79fd49c6-a94f-4e8d-8503-bce38c412476,dde0a4d0-ae72-4abb-bc0a-97d239a237ab,517e1bbb-df7d-4280-a71c-d26ebfe12173,38989d97-ea62-47cc-b743-c659d8721649,2022-11-19 02:43:09,completed,False,2022-11-19 02:51:08,19.062445,72.83719,18.966482,72.83719,2022-11-19 03:09:50,18.966314,72.82125,38989d97-ea62-47cc-b743-c659d8721649,79fd49c6-a94f-4e8d-8503-bce38c412476,Satyam,Upadhyay,dde0a4d0-ae72-4abb-bc0a-97d239a237ab,MH01EE1327,personal_transport,2022-11-19 02:43:09,2022-11-19 03:09:50,"288, Swami Vivekananda Rd, near Indian Bank, Pali Village, Khar West, Mumbai, Maharashtra 400050, India","BELLASIS GYM Post office, XR8C+QM9, behind BITbuilding No.9, near Mumbai Central, Navjeevan Society, Dalal Estate, Mumbai Central, Mumbai, Maharashtra 400008, India",14.87,completed,2,Saturday
2022-11-19,215,79fd49c6-a94f-4e8d-8503-bce38c412476,dde0a4d0-ae72-4abb-bc0a-97d239a237ab,517e1bbb-df7d-4280-a71c-d26ebfe12173,7837f4b5-ad0f-4a54-b380-767064511f71,2022-11-19 03:09:56,completed,True,2022-11-19 03:13:54,18.9673,72.82784,19.212137,72.82784,2022-11-19 03:55:20,19.212141,72.97765,7837f4b5-ad0f-4a54-b380-767064511f71,79fd49c6-a94f-4e8d-8503-bce38c412476,Satyam,Upadhyay,dde0a4d0-ae72-4abb-bc0a-97d239a237ab,MH01EE1327,personal_transport,2022-11-19 03:09:56,2022-11-19 03:55:20,"Shop No.3&4 kedy tower m nagpada bellasis rd, Madanpura, Mumbai, Maharashtra 400008, India","Near Lodha Paradise, Bhivandi Bypass road, Mumbai, Kapurbawdi Flyover, Sainath Nagar, Majiwada, Thane, Maharashtra 400601, India",33.73,completed,3,Saturday
