day_b,city_id,driver_uuid,vehicle_uuid,partner_uuid,uuid,request_timestamp_local,status,is_cash_trip,begintrip_timestamp_local,begintrip_lat,begintrip_lng,destination_lat,destination_lng,dropoff_timestamp_local,dropoff_lat,dropoff_lng,Trip UUID,Driver UUID,Driver first name,Driver surname,Vehicle UUID,Number plate,Service type,Trip request time,Trip drop-off time,Pick-up address,Drop-off address,Trip distance,Trip status,Hour,DayOfWeek
2022-11-18,215,7a825dde-1aa9-44fc-ad8a-1f2144661ab5,3ba099a3-8d11-415c-8823-4760974388ac,83c6150e-fbd6-4ffa-affd-527eddddb0a0,f16187a5-74a2-45dd-ba5f-acf0fea9df90,2022-11-18 17:39:25,completed,True,2022-11-18 17:59:14,19.11598,72.85483,19.105602,72.85483,2022-11-18 18:11:41,19.105646,72.86244,f16187a5-74a2-45dd-ba5f-acf0fea9df90,7a825dde-1aa9-44fc-ad8a-1f2144661ab5,shoaib,khan,3ba099a3-8d11-415c-8823-4760974388ac,MH01DR8596,personal_transport,2022-11-18 17:39:25,2022-11-18 18:11:41,"349, Western Express Hwy, Scindia Society, Bima Nagar, Andheri East, Mumbai, Maharashtra 400047, India","Karishma Chambers, Cambridge School, near Bombay, AAI Colony, J B Nagar, Andheri East, Mumbai, Maharashtra 400069, India",1.98,completed,17,Friday
2022-11-18,215,7a825dde-1aa9-44fc-ad8a-1f2144661ab5,3ba099a3-8d11-415c-8823-4760974388ac,83c6150e-fbd6-4ffa-affd-527eddddb0a0,e8750be1-d653-49b1-b7dc-00232f3df542,2022-11-18 18:35:38,rider_canceled,True,,19.103252,72.86968,19.096619,72.86968,,19.10324275,72.86968517,e8750be1-d653-49b1-b7dc-00232f3df542,7a825dde-1aa9-44fc-ad8a-1f2144661ab5,shoaib,khan,3ba099a3-8d11-415c-8823-4760974388ac,MH01DR8596,personal_transport,2022-11-18 18:35:38,0,"A-1, Golibar Rd, Bhim Nagar, Panchashil Nagar, Ghatkopar West, Mumbai, Maharashtra 400086, India","A-1, Golibar Rd, Bhim Nagar, Panchashil Nagar, Ghatkopar West, Mumbai, Maharashtra 400086, India",0.0,rider_cancelled,18,Friday
2022-11-18,215,7a825dde-1aa9-44fc-ad8a-1f2144661ab5,3ba099a3-8d11-415c-8823-4760974388ac,83c6150e-fbd6-4ffa-affd-527eddddb0a0,ddb4d234-a2eb-4dcf-863c-8ee1d848ac93,2022-11-18 18:37:03,rider_canceled,False,,19.103237,72.86971,19.057085,72.86971,,19.10323858,72.86971223,ddb4d234-a2eb-4dcf-863c-8ee1d848ac93,7a825dde-1aa9-44fc-ad8a-1f2144661ab5,shoaib,khan,3ba099a3-8d11-415c-8823-4760974388ac,MH01DR8596,personal_transport,2022-11-18 18:37:03,0,"Prof. Almeida Road, Plaviola Apartment, 96, Almeida Park Marg, Bandra West, Mumbai, Maharashtra 400050, India","Prof. Almeida Road, Plaviola Apartment, 96, Almeida Park Marg, Bandra West, Mumbai, Maharashtra 400050, India",0.0,rider_cancelled,18,Friday
2022-11-18,215,7a825dde-1aa9-44fc-ad8a-1f2144661ab5,3ba099a3-8d11-415c-8823-4760974388ac,83c6150e-fbd6-4ffa-affd-527eddddb0a0,7e8800eb-0c0f-4f6c-8d02-bbce9a7c2701,2022-11-18 18:41:44,completed,True,2022-11-18 19:00:39,19.113903,72.8641,19.278349,72.8641,2022-11-18 20:36:01,19.278353,72.879654,7e8800eb-0c0f-4f6c-8d02-bbce9a7c2701,7a825dde-1aa9-44fc-ad8a-1f2144661ab5,shoaib,khan,3ba099a3-8d11-415c-8823-4760974388ac,MH01DR8596,personal_transport,2022-11-18 18:41:44,2022-11-18 20:36:01,"Courtyard by Marriott, Andheri","B-101, Mira Bhayandar Rd, Pleasant Park, Mira Road, Mira Bhayandar, Maharashtra 401107, India",21.26,completed,18,Friday
2022-11-18,215,7a825dde-1aa9-44fc-ad8a-1f2144661ab5,3ba099a3-8d11-415c-8823-4760974388ac,83c6150e-fbd6-4ffa-affd-527eddddb0a0,3357d157-728d-4937-a0d7-146ffaa12f9f,2022-11-18 20:37:40,completed,True,2022-11-18 20:51:28,19.282812,72.88619,19.069384,72.88619,2022-11-18 22:07:11,19.069511,72.89248,3357d157-728d-4937-a0d7-146ffaa12f9f,7a825dde-1aa9-44fc-ad8a-1f2144661ab5,shoaib,khan,3ba099a3-8d11-415c-8823-4760974388ac,MH01DR8596,personal_transport,2022-11-18 20:37:40,2022-11-18 22:07:11,"Vinay Nagar Rd, Kashimira, Mira Road, Mira Bhayandar, Maharashtra 401107, India","Lokmanya Tilak Terminus Railway Station, Mumbai, Maharashtra 400089, India",32.13,completed,20,Friday
2022-11-18,215,7a825dde-1aa9-44fc-ad8a-1f2144661ab5,3ba099a3-8d11-415c-8823-4760974388ac,83c6150e-fbd6-4ffa-affd-527eddddb0a0,f33538ae-36fa-4e92-bba8-ab04fb009a41,2022-11-18 22:41:43,completed,True,2022-11-18 22:48:31,19.069736,72.89631,19.086353,72.89631,2022-11-18 23:19:29,19.086325,72.83639,f33538ae-36fa-4e92-bba8-ab04fb009a41,7a825dde-1aa9-44fc-ad8a-1f2144661ab5,shoaib,khan,3ba099a3-8d11-415c-8823-4760974388ac,MH01DR8596,personal_transport,2022-11-18 22:41:43,2022-11-18 23:19:29,"79-A, Pipeline Rd, near Noble Chemist, Chembur West, Tilak Nagar, Kurla, Mumbai, Maharashtra 400089, India","5-E, Tagore Rd, Hasmukh Nagar, Santacruz West, Mumbai, Maharashtra 400054, India",9.87,completed,22,Friday
2022-11-18,215,7a825dde-1aa9-44fc-ad8a-1f2144661ab5,3ba099a3-8d11-415c-8823-4760974388ac,83c6150e-fbd6-4ffa-affd-527eddddb0a0,9d9aee58-09f9-41fe-85ac-9dc215a6b6db,2022-11-18 23:17:49,completed,False,2022-11-18 23:30:42,19.098158,72.826775,19.096222,72.826775,2022-11-19 00:12:54,19.09623,72.918945,9d9aee58-09f9-41fe-85ac-9dc215a6b6db,7a825dde-1aa9-44fc-ad8a-1f2144661ab5,shoaib,khan,3ba099a3-8d11-415c-8823-4760974388ac,MH01DR8596,personal_transport,2022-11-18 23:17:49,2022-11-19 00:12:54,"70, Juhu Beach, Theosophical Housing Colony, Juhu, Mumbai, Maharashtra 400049, India","Opp R-City Mall Between Ghatkopar & Vikhroli, Lal Bahadur Shastri Rd, Nityanand Nagar, Ghatkopar West, Mumbai, Maharashtra 400086, India",15.75,completed,23,Friday
2022-11-19,215,7a825dde-1aa9-44fc-ad8a-1f2144661ab5,3ba099a3-8d11-415c-8823-4760974388ac,83c6150e-fbd6-4ffa-affd-527eddddb0a0,a3c4b097-dacc-44ba-9af6-8c977c1e62f9,2022-11-19 00:08:46,completed,True,2022-11-19 00:14:23,19.096216,72.91893,19.117985,72.91893,2022-11-19 00:40:29,19.117956,72.87178,a3c4b097-dacc-44ba-9af6-8c977c1e62f9,7a825dde-1aa9-44fc-ad8a-1f2144661ab5,shoaib,khan,3ba099a3-8d11-415c-8823-4760974388ac,MH01DR8596,personal_transport,2022-11-19 00:08:46,2022-11-19 00:40:29,"3WW9+MQM, Nityanand Nagar, Ghatkopar West, Mumbai, Maharashtra 400079, India","Akruti Annex Building, MIDC, Rd Number 7, next to Akruti trade centre, Kondivita, Andheri East, Mumbai, Maharashtra 400093, India",8.75,completed,0,Saturday
2022-11-19,215,7a825dde-1aa9-44fc-ad8a-1f2144661ab5,3ba099a3-8d11-415c-8823-4760974388ac,83c6150e-fbd6-4ffa-affd-527eddddb0a0,2313938c-0e33-4ff7-a250-27bcf9c3eedf,2022-11-19 00:40:50,completed,True,2022-11-19 00:48:02,19.117807,72.86483,19.110243,72.86483,2022-11-19 00:59:12,19.110195,72.87872,2313938c-0e33-4ff7-a250-27bcf9c3eedf,7a825dde-1aa9-44fc-ad8a-1f2144661ab5,shoaib,khan,3ba099a3-8d11-415c-8823-4760974388ac,MH01DR8596,personal_transport,2022-11-19 00:40:50,2022-11-19 00:59:12,"Shanti Nagar, Andheri East, Mumbai, Maharashtra 400047, India","Metro Station, Marol Maroshi Rd, near Marol, Bori Colony, Gamdevi, Marol, Andheri East, Mumbai, Maharashtra 400059, India",2.83,completed,0,Saturday
