day_b,city_id,driver_uuid,vehicle_uuid,partner_uuid,uuid,request_timestamp_local,status,is_cash_trip,begintrip_timestamp_local,begintrip_lat,begintrip_lng,destination_lat,destination_lng,dropoff_timestamp_local,dropoff_lat,dropoff_lng,Trip UUID,Driver UUID,Driver first name,Driver surname,Vehicle UUID,Number plate,Service type,Trip request time,Trip drop-off time,Pick-up address,Drop-off address,Trip distance,Trip status,Hour,DayOfWeek
2022-11-18,215,88f9d699-3018-42d7-b45b-a5bbcd9e88a9,9ab6ec80-adee-4957-a5a1-7ae7c5bb025c,517e1bbb-df7d-4280-a71c-d26ebfe12173,b967a239-fd9e-4d2c-8b43-7237c23ad08d,2022-11-18 07:37:53,completed,True,2022-11-18 07:52:28,19.093077,72.92057,19.009417,72.92057,2022-11-18 08:25:11,19.011345,72.83559,b967a239-fd9e-4d2c-8b43-7237c23ad08d,88f9d699-3018-42d7-b45b-a5bbcd9e88a9,Asif Khan,-,9ab6ec80-adee-4957-a5a1-7ae7c5bb025c,MH01DR4465,personal_transport,2022-11-18 07:37:53,2022-11-18 08:25:11,"Shop #4, Tower C, Retail Street, The Trees, GODREJ ONE, Pirojshanagar, Vikhroli, Mumbai, Maharashtra 400079, India","14th Floor, Tower1, Senapati Bapat Marg, Dadar West, Prabhadevi, Mumbai, Maharashtra 400013, India",15.21,completed,7,Friday
2022-11-18,215,88f9d699-3018-42d7-b45b-a5bbcd9e88a9,9ab6ec80-adee-4957-a5a1-7ae7c5bb025c,517e1bbb-df7d-4280-a71c-d26ebfe12173,211889aa-66d9-4481-a5c8-6a9a3b7c08c7,2022-11-18 08:25:32,rider_canceled,False,,19.011171,72.83545,18.926746,72.83545,,19.0111717,72.83545005,211889aa-66d9-4481-a5c8-6a9a3b7c08c7,88f9d699-3018-42d7-b45b-a5bbcd9e88a9,Asif Khan,-,9ab6ec80-adee-4957-a5a1-7ae7c5bb025c,MH01DR4465,personal_transport,2022-11-18 08:25:32,0,"118, Nariman Point, Mumbai, Maharashtra 400021, India","118, Nariman Point, Mumbai, Maharashtra 400021, India",0.0,rider_cancelled,8,Friday
2022-11-18,215,88f9d699-3018-42d7-b45b-a5bbcd9e88a9,9ab6ec80-adee-4957-a5a1-7ae7c5bb025c,517e1bbb-df7d-4280-a71c-d26ebfe12173,093eadb8-be97-4147-af69-1672bb027680,2022-11-18 08:26:10,completed,False,2022-11-18 08:32:36,19.012125,72.83351,19.063309,72.83351,2022-11-18 09:01:48,19.063284,72.86127,093eadb8-be97-4147-af69-1672bb027680,88f9d699-3018-42d7-b45b-a5bbcd9e88a9,Asif Khan,-,9ab6ec80-adee-4957-a5a1-7ae7c5bb025c,MH01DR4465,personal_transport,2022-11-18 08:26:10,2022-11-18 09:01:48,"579, Kakasaheb Gadgil Marg, near Inder Tower, B Wing, Lokmanya Nagar, Priyadarshini CHS, Mumbai, Maharashtra 400025, India","G Block Rd, G Block BKC, Bandra Kurla Complex, Bandra East, Mumbai, Maharashtra 400098, India",8.63,completed,8,Friday
2022-11-18,215,88f9d699-3018-42d7-b45b-a5bbcd9e88a9,9ab6ec80-adee-4957-a5a1-7ae7c5bb025c,517e1bbb-df7d-4280-a71c-d26ebfe12173,180a1c15-31bb-4052-b2e9-abf43e6c2d5e,2022-11-18 09:03:00,unfulfilled,True,,19.057253,72.86469,19.120966,72.86469,,19.05571389,72.86502314,180a1c15-31bb-4052-b2e9-abf43e6c2d5e,88f9d699-3018-42d7-b45b-a5bbcd9e88a9,Asif Khan,-,9ab6ec80-adee-4957-a5a1-7ae7c5bb025c,MH01DR4465,personal_transport,2022-11-18 09:03:00,0,"247, Lal Bahadur Shastri Rd, Gandhi Nagar, Vikhroli West, Mumbai, Maharashtra 400083, India","247, Lal Bahadur Shastri Rd, Gandhi Nagar, Vikhroli West, Mumbai, Maharashtra 400083, India",0.0,delivery_failed,9,Friday
2022-11-18,215,88f9d699-3018-42d7-b45b-a5bbcd9e88a9,9ab6ec80-adee-4957-a5a1-7ae7c5bb025c,517e1bbb-df7d-4280-a71c-d26ebfe12173,b53b3005-c0a0-4c88-8a96-f52089561bf8,2022-11-18 09:05:09,unfulfilled,False,,19.04976,72.872154,19.007856,72.872154,,19.05206633,72.8781004,b53b3005-c0a0-4c88-8a96-f52089561bf8,88f9d699-3018-42d7-b45b-a5bbcd9e88a9,Asif Khan,-,9ab6ec80-adee-4957-a5a1-7ae7c5bb025c,MH01DR4465,personal_transport,2022-11-18 09:05:09,0,"Near Bombay Dyeing, Wadia International Centre, C-2, Pandurang Budhkar Marg, Kamagar Nagar Number 1, Parel, Mumbai, Maharashtra 400025, India","Near Bombay Dyeing, Wadia International Centre, C-2, Pandurang Budhkar Marg, Kamagar Nagar Number 1, Parel, Mumbai, Maharashtra 400025, India",0.0,delivery_failed,9,Friday
