day_b,city_id,driver_uuid,vehicle_uuid,partner_uuid,uuid,request_timestamp_local,status,is_cash_trip,begintrip_timestamp_local,begintrip_lat,begintrip_lng,destination_lat,destination_lng,dropoff_timestamp_local,dropoff_lat,dropoff_lng,Trip UUID,Driver UUID,Driver first name,Driver surname,Vehicle UUID,Number plate,Service type,Trip request time,Trip drop-off time,Pick-up address,Drop-off address,Trip distance,Trip status,Hour,DayOfWeek
2022-11-18,215,8d069318-3129-48dd-ad14-1efbb4b61ec1,cd0eec52-07e7-4080-88ee-0d4e886579d7,83c6150e-fbd6-4ffa-affd-527eddddb0a0,9efcea43-4ef8-4bdf-9c68-559f287673b3,2022-11-18 05:35:18,completed,False,2022-11-18 05:48:59,19.384464,72.82241,19.187101,72.82241,2022-11-18 06:49:45,19.187243,72.97623,9efcea43-4ef8-4bdf-9c68-559f287673b3,8d069318-3129-48dd-ad14-1efbb4b61ec1,Gulfam,Mohd,cd0eec52-07e7-4080-88ee-0d4e886579d7,MH01DR4589,personal_transport,2022-11-18 05:35:18,2022-11-18 06:49:45,"Old Siddhant Apartment, 100 Feet Rd, Navghar, Vasai West, Vasai-Virar, Maharashtra 401202, India","5XPG+PV5, Jambli Naka, Thane West, Thane, Maharashtra 400601, India",40.69,completed,5,Friday
2022-11-18,215,8d069318-3129-48dd-ad14-1efbb4b61ec1,cd0eec52-07e7-4080-88ee-0d4e886579d7,83c6150e-fbd6-4ffa-affd-527eddddb0a0,e50815a0-8f9f-422a-95c7-8575a75fa08f,2022-11-18 06:50:47,completed,True,2022-11-18 07:07:57,19.188335,72.958664,19.108263,72.958664,2022-11-18 08:20:00,19.102991,72.83678,e50815a0-8f9f-422a-95c7-8575a75fa08f,8d069318-3129-48dd-ad14-1efbb4b61ec1,Gulfam,Mohd,cd0eec52-07e7-4080-88ee-0d4e886579d7,MH01DR4589,personal_transport,2022-11-18 06:50:47,2022-11-18 08:20:00,"ASTORIA APARTMENT, ASTORIA BUILDING-1, Raghunath Nagar, Raheja Gardens, Thane West, Thane, Maharashtra 400080, India","Irla, N. R. G Marg, 4R5Q+24W, opposite Cooper Hospital, Navpada, Suvarna Nagar, Vile Parle, Mumbai, Maharashtra 400056, India",24.23,completed,6,Friday
2022-11-18,215,8d069318-3129-48dd-ad14-1efbb4b61ec1,cd0eec52-07e7-4080-88ee-0d4e886579d7,83c6150e-fbd6-4ffa-affd-527eddddb0a0,0d607352-7d85-4c26-a19e-d5c281ecbebe,2022-11-18 08:20:44,completed,False,2022-11-18 08:25:55,19.114084,72.835846,19.024231,72.835846,2022-11-18 09:03:21,19.024323,72.84509,0d607352-7d85-4c26-a19e-d5c281ecbebe,8d069318-3129-48dd-ad14-1efbb4b61ec1,Gulfam,Mohd,cd0eec52-07e7-4080-88ee-0d4e886579d7,MH01DR4589,personal_transport,2022-11-18 08:20:44,2022-11-18 09:03:21,"Plot No. A8, Ground Floor, Gunjarav Bungalow, Gulmohar Cross Road 7, Model Town Society, JVPD Scheme, Juhu, Model Town Society, Gulmohar Road, Juhu Scheme, Vile Parle West, Mumbai, Maharashtra 400049, India","The Ruby, Kasaravadi, Dadar, Mumbai, Maharashtra 400028, India",14.7,completed,8,Friday
2022-11-18,215,8d069318-3129-48dd-ad14-1efbb4b61ec1,cd0eec52-07e7-4080-88ee-0d4e886579d7,83c6150e-fbd6-4ffa-affd-527eddddb0a0,94a1ea10-f83e-4f06-9045-108f4e065f89,2022-11-18 08:49:52,rider_canceled,False,,19.043545,72.83987,19.0546,72.83987,,19.0429635,72.84041667,94a1ea10-f83e-4f06-9045-108f4e065f89,8d069318-3129-48dd-ad14-1efbb4b61ec1,Gulfam,Mohd,cd0eec52-07e7-4080-88ee-0d4e886579d7,MH01DR4589,personal_transport,2022-11-18 08:49:52,0,"4, North Ave, Bandra Kurla Complex, Bandra East, Mumbai, Maharashtra 400051, India","4, North Ave, Bandra Kurla Complex, Bandra East, Mumbai, Maharashtra 400051, India",0.0,rider_cancelled,8,Friday
2022-11-18,215,8d069318-3129-48dd-ad14-1efbb4b61ec1,cd0eec52-07e7-4080-88ee-0d4e886579d7,83c6150e-fbd6-4ffa-affd-527eddddb0a0,e9babe1f-f5fa-40e6-b643-a4189d4d9ddc,2022-11-18 09:06:42,completed,True,2022-11-18 09:11:31,19.03402,72.84515,19.06453,72.84515,2022-11-18 09:33:52,19.064455,72.86121,e9babe1f-f5fa-40e6-b643-a4189d4d9ddc,8d069318-3129-48dd-ad14-1efbb4b61ec1,Gulfam,Mohd,cd0eec52-07e7-4080-88ee-0d4e886579d7,MH01DR4589,personal_transport,2022-11-18 09:06:42,2022-11-18 09:33:52,"Opp. Bherumal Bhavan, Chatrapati Shivaji Maharaj Marg, near Mutual Colony, Mutual Colony, VSNL Colony, Matunga, Mumbai, Maharashtra 400016, India","BKC Road, G Block BKC, Bandra Kurla Complex, Bandra East, G Block BKC, Bandra Kurla Complex, Bandra East, Mumbai, Maharashtra 400051, India",6.09,completed,9,Friday
2022-11-18,215,8d069318-3129-48dd-ad14-1efbb4b61ec1,cd0eec52-07e7-4080-88ee-0d4e886579d7,83c6150e-fbd6-4ffa-affd-527eddddb0a0,4c2f07c7-deaa-4744-af6f-acb3a5bfa6b0,2022-11-18 10:17:26,rider_canceled,False,,19.073973,72.8709,18.92269,72.8709,,19.07428968,72.88057935,4c2f07c7-deaa-4744-af6f-acb3a5bfa6b0,8d069318-3129-48dd-ad14-1efbb4b61ec1,Gulfam,Mohd,cd0eec52-07e7-4080-88ee-0d4e886579d7,MH01DR4589,personal_transport,2022-11-18 10:17:26,0,"15/17, Nawroji Furdunji St, Apollo Bandar, Colaba, Mumbai, Maharashtra 400001, India","15/17, Nawroji Furdunji St, Apollo Bandar, Colaba, Mumbai, Maharashtra 400001, India",0.0,rider_cancelled,10,Friday
