day_b,city_id,driver_uuid,vehicle_uuid,partner_uuid,uuid,request_timestamp_local,status,is_cash_trip,begintrip_timestamp_local,begintrip_lat,begintrip_lng,destination_lat,destination_lng,dropoff_timestamp_local,dropoff_lat,dropoff_lng,Trip UUID,Driver UUID,Driver first name,Driver surname,Vehicle UUID,Number plate,Service type,Trip request time,Trip drop-off time,Pick-up address,Drop-off address,Trip distance,Trip status,Hour,DayOfWeek
2022-11-18,215,8df0b99e-f7a2-4662-9304-ed93c7587416,f7ccbfb2-c9d5-4a44-a12e-e7e0d6b54bbf,41c9e90e-1d2c-4e4f-9f03-6e4bc89ac58c,ddbf4f5b-8843-415d-b4ed-5c652263ed0f,2022-11-18 13:06:26,completed,False,2022-11-18 13:20:53,19.071888,73.06989,19.05489,73.06989,2022-11-18 14:15:37,19.054962,72.88673,ddbf4f5b-8843-415d-b4ed-5c652263ed0f,8df0b99e-f7a2-4662-9304-ed93c7587416,deepak,mane,f7ccbfb2-c9d5-4a44-a12e-e7e0d6b54bbf,MH01DR4580,personal_transport,2022-11-18 13:06:26,2022-11-18 14:15:37,"Sector 35 H,, Plot No. 4 & 5, Raintree Marg Service Rd, Sector 35G, Kharghar, Navi Mumbai, Maharashtra 410210, India","Unit 6, Corporate Park, VN Purav Marg, Chembur, Swastik Park, Chembur, Mumbai, Maharashtra 400071, India",30.68,completed,13,Friday
2022-11-18,215,8df0b99e-f7a2-4662-9304-ed93c7587416,f7ccbfb2-c9d5-4a44-a12e-e7e0d6b54bbf,41c9e90e-1d2c-4e4f-9f03-6e4bc89ac58c,8d8a9dda-d8dc-4a5f-8ea8-c2d60cba0ece,2022-11-18 14:10:23,completed,True,2022-11-18 14:27:57,19.044172,72.89256,18.918503,72.89256,2022-11-18 15:02:27,18.918621,72.83093,8d8a9dda-d8dc-4a5f-8ea8-c2d60cba0ece,8df0b99e-f7a2-4662-9304-ed93c7587416,deepak,mane,f7ccbfb2-c9d5-4a44-a12e-e7e0d6b54bbf,MH01DR4580,personal_transport,2022-11-18 14:10:23,2022-11-18 15:02:27,"26/B, Collectors Colony Rd, कलेक्टर कॉलोनी, Chembur, Mumbai, Maharashtra 400074, India","3/23, Kamal Mansion, N.A, HNAA Rd, next to Radio Club, Apollo Bandar, Colaba, Mumbai, Maharashtra 400005, India",17.54,completed,14,Friday
2022-11-18,215,8df0b99e-f7a2-4662-9304-ed93c7587416,f7ccbfb2-c9d5-4a44-a12e-e7e0d6b54bbf,41c9e90e-1d2c-4e4f-9f03-6e4bc89ac58c,8c108c1b-2e16-4b0a-88cf-ae7b69501e6f,2022-11-18 15:03:51,completed,False,2022-11-18 15:09:30,18.916964,72.8299,18.957312,72.8299,2022-11-18 15:27:43,18.957478,72.808975,8c108c1b-2e16-4b0a-88cf-ae7b69501e6f,8df0b99e-f7a2-4662-9304-ed93c7587416,deepak,mane,f7ccbfb2-c9d5-4a44-a12e-e7e0d6b54bbf,MH01DR4580,personal_transport,2022-11-18 15:03:51,2022-11-18 15:27:43,"25, Arthur Bunder Rd, Apollo Bandar, Colaba, Mumbai, Maharashtra 400005, Indien","16, Babulnath Rd, Charni Road, Babulnath, Dadi Sheth Wadi, Malabar Hill, Mumbai, Maharashtra 400007, Indien",6.37,completed,15,Friday
2022-11-18,215,8df0b99e-f7a2-4662-9304-ed93c7587416,f7ccbfb2-c9d5-4a44-a12e-e7e0d6b54bbf,41c9e90e-1d2c-4e4f-9f03-6e4bc89ac58c,a3220b97-a3a7-4815-8d7a-e5ef8ef73d33,2022-11-18 15:25:36,completed,True,2022-11-18 15:33:08,18.952057,72.803665,18.992485,72.803665,2022-11-18 16:12:48,18.992645,72.851326,a3220b97-a3a7-4815-8d7a-e5ef8ef73d33,8df0b99e-f7a2-4662-9304-ed93c7587416,deepak,mane,f7ccbfb2-c9d5-4a44-a12e-e7e0d6b54bbf,MH01DR4580,personal_transport,2022-11-18 15:25:36,2022-11-18 16:12:48,"68, Walkeshwar Rd, Krishanaraj Society, Walkeshwar, Malabar Hill, Mumbai, Maharashtra 400006, India","Cotton Green Campus,,Ground Floor, Mumbai Port Trust Colony ABC Colony (Rajas Nagar, Zakaria Bunder Rd, Sewri, Mumbai, Maharashtra 400033, India",10.31,completed,15,Friday
2022-11-18,215,8df0b99e-f7a2-4662-9304-ed93c7587416,f7ccbfb2-c9d5-4a44-a12e-e7e0d6b54bbf,41c9e90e-1d2c-4e4f-9f03-6e4bc89ac58c,83377ac4-bc96-4d83-ac45-cc55405b717a,2022-11-18 16:14:46,completed,True,2022-11-18 16:27:53,18.995481,72.8521,19.193598,72.8521,2022-11-18 18:14:06,19.192171,72.82193,83377ac4-bc96-4d83-ac45-cc55405b717a,8df0b99e-f7a2-4662-9304-ed93c7587416,deepak,mane,f7ccbfb2-c9d5-4a44-a12e-e7e0d6b54bbf,MH01DR4580,personal_transport,2022-11-18 16:14:46,2022-11-18 18:14:06,"Navbharat Estates, Zakaria Bunder Rd, Sewri West, Azad Nagar, Sewri, Mumbai, Maharashtra 400015, India","Malad, BMC Colony, Rathodi, Malad West, Mumbai, Maharashtra 400095, India",29.04,completed,16,Friday
2022-11-18,215,8df0b99e-f7a2-4662-9304-ed93c7587416,f7ccbfb2-c9d5-4a44-a12e-e7e0d6b54bbf,41c9e90e-1d2c-4e4f-9f03-6e4bc89ac58c,87eaebf6-bdcd-438e-9b9a-f078f32e5a7b,2022-11-18 18:40:22,completed,False,2022-11-18 18:58:09,19.194304,72.83938,19.0759,72.83938,2022-11-18 20:28:22,19.07598,72.90984,87eaebf6-bdcd-438e-9b9a-f078f32e5a7b,8df0b99e-f7a2-4662-9304-ed93c7587416,deepak,mane,f7ccbfb2-c9d5-4a44-a12e-e7e0d6b54bbf,MH01DR4580,personal_transport,2022-11-18 18:40:22,2022-11-18 20:28:22,"Shop No. 4, Meenakshi Apartments down of Adarsh Hospital, Marve Road, Orlem, Malad West, Malad, Orlem, Malad West, Mumbai, Maharashtra 400064, India","Lions Community Garden, 80, Garodia Nagar, opposite, Mumbai, Maharashtra 400077, India",25.15,completed,18,Friday
2022-11-18,215,8df0b99e-f7a2-4662-9304-ed93c7587416,f7ccbfb2-c9d5-4a44-a12e-e7e0d6b54bbf,41c9e90e-1d2c-4e4f-9f03-6e4bc89ac58c,d36f594f-ba16-48a6-b74c-711734676844,2022-11-18 20:56:48,completed,True,2022-11-18 21:06:11,19.07882,72.90947,19.03476,72.90947,2022-11-18 22:01:07,19.034386,73.075806,d36f594f-ba16-48a6-b74c-711734676844,8df0b99e-f7a2-4662-9304-ed93c7587416,deepak,mane,f7ccbfb2-c9d5-4a44-a12e-e7e0d6b54bbf,MH01DR4580,personal_transport,2022-11-18 20:56:48,2022-11-18 22:01:07,"Shop no 18/A plot no 335 Kailash plaza vallabhug lane Near Odean market, MHADA Colony, Pant Nagar, Ghatkopar East, Mumbai, Maharashtra 400075, India","Plot 269, Sector 10, Kharghar, Navi Mumbai, Maharashtra 410210, India",24.89,completed,20,Friday
