day_b,city_id,driver_uuid,vehicle_uuid,partner_uuid,uuid,request_timestamp_local,status,is_cash_trip,begintrip_timestamp_local,begintrip_lat,begintrip_lng,destination_lat,destination_lng,dropoff_timestamp_local,dropoff_lat,dropoff_lng,Trip UUID,Driver UUID,Driver first name,Driver surname,Vehicle UUID,Number plate,Service type,Trip request time,Trip drop-off time,Pick-up address,Drop-off address,Trip distance,Trip status,Hour,DayOfWeek
2022-11-18,215,9e45209a-cf94-4072-862e-3e6fe017fe3a,fa9ac06b-cfa0-4193-9a04-cd0e9f05816f,3b4d8666-3ea1-45a1-b270-f879eed28df0,51b9b521-aa69-414b-bf46-6e22e9c12510,2022-11-18 11:37:58,rider_canceled,False,,19.03019,73.16611,18.949217,73.16611,,19.03019,73.16611,51b9b521-aa69-414b-bf46-6e22e9c12510,9e45209a-cf94-4072-862e-3e6fe017fe3a,Saleem   Niyamat,Khan,fa9ac06b-cfa0-4193-9a04-cd0e9f05816f,MH01DR8277,personal_transport,2022-11-18 11:37:58,0,"297, Sheikh Memon St, near Juma Masjid, Zaveri Bazaar, Kalbadevi, Mumbai, Maharashtra 400002, India","297, Sheikh Memon St, near Juma Masjid, Zaveri Bazaar, Kalbadevi, Mumbai, Maharashtra 400002, India",0.0,rider_cancelled,11,Friday
2022-11-18,215,9e45209a-cf94-4072-862e-3e6fe017fe3a,fa9ac06b-cfa0-4193-9a04-cd0e9f05816f,3b4d8666-3ea1-45a1-b270-f879eed28df0,6392157c-d7e5-453f-a475-d8484e2c4a74,2022-11-18 13:09:30,completed,False,2022-11-18 13:14:04,19.002094,73.12495,19.074137,73.12495,2022-11-18 13:48:40,19.074211,72.99355,6392157c-d7e5-453f-a475-d8484e2c4a74,9e45209a-cf94-4072-862e-3e6fe017fe3a,Saleem   Niyamat,Khan,fa9ac06b-cfa0-4193-9a04-cd0e9f05816f,MH01DR8277,personal_transport,2022-11-18 13:09:30,2022-11-18 13:48:40,"Ganesh Puja CHS, 221, Sector-10, New Panvel East, Panvel, Navi Mumbai, Maharashtra 410206, India","F-1/4 Gyandeep Apartments, Atmashanti Society, Sector 3, Vashi, Navi Mumbai, Maharashtra 400703, India",21.66,completed,13,Friday
2022-11-18,215,9e45209a-cf94-4072-862e-3e6fe017fe3a,fa9ac06b-cfa0-4193-9a04-cd0e9f05816f,3b4d8666-3ea1-45a1-b270-f879eed28df0,f5dfcfd1-6312-4c78-9a78-ea9325ad5eb5,2022-11-18 14:38:05,completed,False,2022-11-18 14:46:50,19.066896,72.99265,19.121227,72.99265,2022-11-18 15:08:53,19.121523,73.00938,f5dfcfd1-6312-4c78-9a78-ea9325ad5eb5,9e45209a-cf94-4072-862e-3e6fe017fe3a,Saleem   Niyamat,Khan,fa9ac06b-cfa0-4193-9a04-cd0e9f05816f,MH01DR8277,personal_transport,2022-11-18 14:38:05,2022-11-18 15:08:53,"Shop No-1, Odisha Bhawan, Sector 30, Vashi, Sector 30, Vashi, Navi Mumbai, Maharashtra 400703, India","Aurum House, Aurum Q Parć, IT, Building, Block No. 01, Q1, 6th Floor,, Level 1 Plot No. G-4/1, TTC Industrial Area, Thane Belapur Road, Ghansoli, Navi Mumbai, M/s. Loma Co Developers 1 Pvt. Ltd. SEZ, Thane - Belapur Rd, Reliance Corporate Park, MIDC Industrial Area, Ghansoli, Navi Mumbai, Maharashtra 400710, India",8.59,completed,14,Friday
2022-11-18,215,9e45209a-cf94-4072-862e-3e6fe017fe3a,fa9ac06b-cfa0-4193-9a04-cd0e9f05816f,3b4d8666-3ea1-45a1-b270-f879eed28df0,447f6ed1-7d8f-4ba1-b1f3-6d1dee81cb32,2022-11-18 16:55:13,completed,False,2022-11-18 16:59:31,19.124052,73.005356,19.074026,73.005356,2022-11-18 17:14:57,19.074024,73.031006,447f6ed1-7d8f-4ba1-b1f3-6d1dee81cb32,9e45209a-cf94-4072-862e-3e6fe017fe3a,Saleem   Niyamat,Khan,fa9ac06b-cfa0-4193-9a04-cd0e9f05816f,MH01DR8277,personal_transport,2022-11-18 16:55:13,2022-11-18 17:14:57,"Thane - Belapur Rd, Reliance Corporate Park, MIDC Industrial Area, Ghansoli, Navi Mumbai, Maharashtra 400701, India","Kia motors service center. Plot No D-67, TTC Industrial Area, Indira Nagar, MIDC Industrial Area, Turbhe, Navi Mumbai, Maharashtra 400705, India",7.46,completed,16,Friday
2022-11-18,215,9e45209a-cf94-4072-862e-3e6fe017fe3a,fa9ac06b-cfa0-4193-9a04-cd0e9f05816f,3b4d8666-3ea1-45a1-b270-f879eed28df0,e36d19f9-386f-4b70-ac99-f14ab81286eb,2022-11-18 17:20:57,completed,False,2022-11-18 17:28:15,19.081516,73.01918,19.088285,73.01918,2022-11-18 17:37:24,19.0883,73.01481,e36d19f9-386f-4b70-ac99-f14ab81286eb,9e45209a-cf94-4072-862e-3e6fe017fe3a,Saleem   Niyamat,Khan,fa9ac06b-cfa0-4193-9a04-cd0e9f05816f,MH01DR8277,personal_transport,2022-11-18 17:20:57,2022-11-18 17:37:24,"D-15, Thane - Belapur Rd, MIDC Industrial Area, Turbhe, Navi Mumbai, Maharashtra 400705, India","Saidham Apartment, CLUSTER_THANE-193, 35, MAFCO Rd, Kopripada, Sector 26, Vashi, Navi Mumbai, Maharashtra 400703, India",3.41,completed,17,Friday
2022-11-18,215,9e45209a-cf94-4072-862e-3e6fe017fe3a,fa9ac06b-cfa0-4193-9a04-cd0e9f05816f,3b4d8666-3ea1-45a1-b270-f879eed28df0,c200300e-c8c4-49fa-9014-92bd3d2313c0,2022-11-18 17:53:57,completed,False,2022-11-18 18:03:04,19.085764,73.00812,19.084833,73.00812,2022-11-18 18:10:08,19.085005,72.997475,c200300e-c8c4-49fa-9014-92bd3d2313c0,9e45209a-cf94-4072-862e-3e6fe017fe3a,Saleem   Niyamat,Khan,fa9ac06b-cfa0-4193-9a04-cd0e9f05816f,MH01DR8277,personal_transport,2022-11-18 17:53:57,2022-11-18 18:10:08,"16, Palm Beach Rd, APMC Market, Sector 19, Vashi, Navi Mumbai, Maharashtra 400705, India","Plot 200, Sector 10A-12, Mini Sea Shore Road, Juhu Nagar, Juhu Village, Sector 11, Vashi, Navi Mumbai, Maharashtra 400703, India",2.34,completed,17,Friday
2022-11-18,215,9e45209a-cf94-4072-862e-3e6fe017fe3a,fa9ac06b-cfa0-4193-9a04-cd0e9f05816f,3b4d8666-3ea1-45a1-b270-f879eed28df0,18200b13-2296-4db1-bd7c-231ef33a3158,2022-11-18 18:25:11,completed,False,2022-11-18 18:27:41,19.07193,72.99859,19.021053,72.99859,2022-11-18 18:44:44,19.021162,73.0177,18200b13-2296-4db1-bd7c-231ef33a3158,9e45209a-cf94-4072-862e-3e6fe017fe3a,Saleem   Niyamat,Khan,fa9ac06b-cfa0-4193-9a04-cd0e9f05816f,MH01DR8277,personal_transport,2022-11-18 18:25:11,2022-11-18 18:44:44,"Plot No 14, Mansarovar CHSL Vashi, Sector 17, Vashi, Mumbai, Maharashtra 400705, India","Seawoods Grand Central Mall, Railway Station, above Seawoods, Nerul East, Sector 28, Nerul, Navi Mumbai, Maharashtra 400706, India",7.1,completed,18,Friday
2022-11-18,215,9e45209a-cf94-4072-862e-3e6fe017fe3a,fa9ac06b-cfa0-4193-9a04-cd0e9f05816f,3b4d8666-3ea1-45a1-b270-f879eed28df0,190bf108-b264-4eaf-a83e-fd3d5c86ff9c,2022-11-18 18:40:49,completed,False,2022-11-18 18:48:58,19.02072,73.018364,19.071302,73.018364,2022-11-18 19:16:44,19.070341,73.06981,190bf108-b264-4eaf-a83e-fd3d5c86ff9c,9e45209a-cf94-4072-862e-3e6fe017fe3a,Saleem   Niyamat,Khan,fa9ac06b-cfa0-4193-9a04-cd0e9f05816f,MH01DR8277,personal_transport,2022-11-18 18:40:49,2022-11-18 19:16:44,Seawoods Grand Central Mall,"Hyde Park, Sector 35G, Kharghar, Navi Mumbai, Maharashtra 410210, India",10.75,completed,18,Friday
