day_b,city_id,driver_uuid,vehicle_uuid,partner_uuid,uuid,request_timestamp_local,status,is_cash_trip,begintrip_timestamp_local,begintrip_lat,begintrip_lng,destination_lat,destination_lng,dropoff_timestamp_local,dropoff_lat,dropoff_lng,Trip UUID,Driver UUID,Driver first name,Driver surname,Vehicle UUID,Number plate,Service type,Trip request time,Trip drop-off time,Pick-up address,Drop-off address,Trip distance,Trip status,Hour,DayOfWeek
2022-11-18,215,9f4f90e4-4837-4d9d-9da1-33ef591284ef,36b5ae07-c19a-4971-b46e-684659a10ced,ca90c852-163d-4543-8293-9e134e7b190d,c12a1b86-9d1b-476f-8e42-b1acf85de203,2022-11-18 08:53:17,completed,True,2022-11-18 08:59:58,19.19689,73.19859,19.08477,73.19859,2022-11-18 09:54:44,19.084051,73.02704,c12a1b86-9d1b-476f-8e42-b1acf85de203,9f4f90e4-4837-4d9d-9da1-33ef591284ef,Sagar,kamble,36b5ae07-c19a-4971-b46e-684659a10ced,MH01DR4372,personal_transport,2022-11-18 08:53:17,2022-11-18 09:54:44,"2, Green City Rd, East, Ambernath, Maharashtra 421501, India","Turbhe MIDC, C 48/3, S Central Rd, MIDC Industrial Area, Turbhe, Navi Mumbai, Maharashtra 400705, India",26.77,completed,8,Friday
2022-11-18,215,9f4f90e4-4837-4d9d-9da1-33ef591284ef,36b5ae07-c19a-4971-b46e-684659a10ced,ca90c852-163d-4543-8293-9e134e7b190d,9fb76ade-f61c-4446-8e38-f08e5ec48efa,2022-11-18 11:55:07,rider_canceled,True,,19.061974,73.031,19.266932,73.031,,19.06102765,73.03104341,9fb76ade-f61c-4446-8e38-f08e5ec48efa,9f4f90e4-4837-4d9d-9da1-33ef591284ef,Sagar,kamble,36b5ae07-c19a-4971-b46e-684659a10ced,MH01DR4372,personal_transport,2022-11-18 11:55:07,0,"Opposite Saraswati School, Kavesar, Off, Ghodbunder Rd, Bhawani Nagar, Kasarvadavali, Thane West, Thane, Maharashtra 400615, India","Opposite Saraswati School, Kavesar, Off, Ghodbunder Rd, Bhawani Nagar, Kasarvadavali, Thane West, Thane, Maharashtra 400615, India",0.0,rider_cancelled,11,Friday
2022-11-18,215,9f4f90e4-4837-4d9d-9da1-33ef591284ef,36b5ae07-c19a-4971-b46e-684659a10ced,ca90c852-163d-4543-8293-9e134e7b190d,592ba8c9-6252-4259-9712-72db2437f25d,2022-11-18 11:58:21,completed,True,2022-11-18 12:03:21,19.0626,73.03166,18.950806,73.03166,2022-11-18 13:41:27,18.950562,72.83276,592ba8c9-6252-4259-9712-72db2437f25d,9f4f90e4-4837-4d9d-9da1-33ef591284ef,Sagar,kamble,36b5ae07-c19a-4971-b46e-684659a10ced,MH01DR4372,personal_transport,2022-11-18 11:58:21,2022-11-18 13:41:27,"22/1, Turbhe Belapur Rd, TTC Industrial Area, MIDC Industrial Area, Sanpada, Navi Mumbai, Maharashtra 400706, India","158, Abdul Rehman St, Chippi Chawl, Kalbadevi, Mumbai, Maharashtra 400003, India",32.78,completed,11,Friday
2022-11-18,215,9f4f90e4-4837-4d9d-9da1-33ef591284ef,36b5ae07-c19a-4971-b46e-684659a10ced,ca90c852-163d-4543-8293-9e134e7b190d,406673b1-0292-4762-9fb1-0e3f682526e9,2022-11-18 13:58:15,completed,True,2022-11-18 14:36:44,18.96029,72.82777,19.157259,72.82777,2022-11-18 15:58:53,19.157175,73.03275,406673b1-0292-4762-9fb1-0e3f682526e9,9f4f90e4-4837-4d9d-9da1-33ef591284ef,Sagar,kamble,36b5ae07-c19a-4971-b46e-684659a10ced,MH01DR4372,personal_transport,2022-11-18 13:58:15,2022-11-18 15:58:53,"Door No. 113/ 117, Gulab Mansion, 3rd Kumbharwada, Dr. M. G Mahimtura Marg, Kumbharwada, Mumbai - 400004, Kumbharwada, Mumbai, Maharashtra 400004, India","Al Hudaibia Tower, Khardi Road, Madras Bombay Trunk Rd, Opp. Bharat Gears, Dawla Village, Kalsekar, Mumbra, Thane, Maharashtra 400612, India",39.95,completed,13,Friday
2022-11-18,215,9f4f90e4-4837-4d9d-9da1-33ef591284ef,36b5ae07-c19a-4971-b46e-684659a10ced,ca90c852-163d-4543-8293-9e134e7b190d,7d49e776-8a53-424c-9960-71ccaa38a798,2022-11-18 15:59:49,completed,True,2022-11-18 16:08:21,19.153013,73.034294,18.958296,73.034294,2022-11-18 17:34:52,18.958405,72.83679,7d49e776-8a53-424c-9960-71ccaa38a798,9f4f90e4-4837-4d9d-9da1-33ef591284ef,Sagar,kamble,36b5ae07-c19a-4971-b46e-684659a10ced,MH01DR4372,personal_transport,2022-11-18 15:59:49,2022-11-18 17:34:52,"BLOCK-G, DOSTI PLANET NORTH EMERALD, कौसा, मुंब्रा, ठाणे, महाराष्ट्र 421204, India","XR8H+RM5, Sofia Zubair Road, Chhota Sonapur, Siddharth Nagar, Kamathipura, Mumbai, Maharashtra 400008, India",50.86,completed,15,Friday
2022-11-18,215,9f4f90e4-4837-4d9d-9da1-33ef591284ef,36b5ae07-c19a-4971-b46e-684659a10ced,ca90c852-163d-4543-8293-9e134e7b190d,c7ffc657-6ec9-47ba-9d9d-27f08d605ac8,2022-11-18 17:26:01,unfulfilled,True,,18.958405,72.83679,18.9777,72.83679,,18.95840681,72.83665001,c7ffc657-6ec9-47ba-9d9d-27f08d605ac8,9f4f90e4-4837-4d9d-9da1-33ef591284ef,Sagar,kamble,36b5ae07-c19a-4971-b46e-684659a10ced,MH01DR4372,personal_transport,2022-11-18 17:26:01,0,"108, Heera Panna Shopping Centre, Haji Ali, Breach Candy, Tardeo, Mumbai, Maharashtra 400026, India","108, Heera Panna Shopping Centre, Haji Ali, Breach Candy, Tardeo, Mumbai, Maharashtra 400026, India",0.0,delivery_failed,17,Friday
2022-11-18,215,9f4f90e4-4837-4d9d-9da1-33ef591284ef,36b5ae07-c19a-4971-b46e-684659a10ced,ca90c852-163d-4543-8293-9e134e7b190d,88814e58-95d2-448f-a86a-a95d8d2678cb,2022-11-18 17:43:47,completed,True,2022-11-18 17:51:46,18.962172,72.83423,19.020582,72.83423,2022-11-18 19:08:05,19.020641,73.02228,88814e58-95d2-448f-a86a-a95d8d2678cb,9f4f90e4-4837-4d9d-9da1-33ef591284ef,Sagar,kamble,36b5ae07-c19a-4971-b46e-684659a10ced,MH01DR4372,personal_transport,2022-11-18 17:43:47,2022-11-18 19:08:05,"115,bandukwala compound,godown no 6, gate no 6, Opp, JJ Hospital Road, Noor Baug, Umerkhadi, Mumbai, Maharashtra 400009, India","22CC+7XV, Sector 25, Nerul, Navi Mumbai, Maharashtra 400706, India",33.51,completed,17,Friday
2022-11-18,215,9f4f90e4-4837-4d9d-9da1-33ef591284ef,36b5ae07-c19a-4971-b46e-684659a10ced,ca90c852-163d-4543-8293-9e134e7b190d,f8dc2148-589c-41fd-9153-eb1dca604766,2022-11-18 19:20:14,completed,False,2022-11-18 19:29:18,19.020895,73.028404,19.06732,73.028404,2022-11-18 19:45:49,19.066973,72.9886,f8dc2148-589c-41fd-9153-eb1dca604766,9f4f90e4-4837-4d9d-9da1-33ef591284ef,Sagar,kamble,36b5ae07-c19a-4971-b46e-684659a10ced,MH01DR4372,personal_transport,2022-11-18 19:20:14,2022-11-18 19:45:49,"Apollo Hospitals, Sector 23, CBD Belapur, Navi Mumbai, Maharashtra 400614, India","53, Vashi Village, Sector-31, Vashi, Navi Mumbai, Maharashtra 400703, India",9.12,completed,19,Friday
