day_b,city_id,driver_uuid,vehicle_uuid,partner_uuid,uuid,request_timestamp_local,status,is_cash_trip,begintrip_timestamp_local,begintrip_lat,begintrip_lng,destination_lat,destination_lng,dropoff_timestamp_local,dropoff_lat,dropoff_lng,Trip UUID,Driver UUID,Driver first name,Driver surname,Vehicle UUID,Number plate,Service type,Trip request time,Trip drop-off time,Pick-up address,Drop-off address,Trip distance,Trip status,Hour,DayOfWeek
2022-11-18,215,a4680a7a-5d23-48c7-a06f-55e801519878,a31cdd81-913e-48e8-bb2a-616198833c9b,8b20931b-0c97-4b92-88a5-ddb8bb08bd0e,4fd98d74-edcb-4d43-bdad-f640ceee02c8,2022-11-18 06:56:55,completed,True,2022-11-18 07:07:30,19.079884,72.905876,18.993952,72.905876,2022-11-18 07:40:42,18.993883,72.825096,4fd98d74-edcb-4d43-bdad-f640ceee02c8,a4680a7a-5d23-48c7-a06f-55e801519878,Mohammad Meraj,-,a31cdd81-913e-48e8-bb2a-616198833c9b,MH01CV9680,personal_transport,2022-11-18 06:56:55,2022-11-18 07:40:42,"Shop No.5, Happy Home, Tilak Road,, Vallabh Bhag Lane, Sindhu Wadi, Ghatkopar East, near Achija Hotel, Raja Wadi, Sindhu Wadi, Ghatkopar East, Mumbai, Maharashtra 400077, India","462, Senapati Bapat Marg, Lower Parel, Mumbai, Maharashtra 400013, India",16.61,completed,6,Friday
2022-11-18,215,a4680a7a-5d23-48c7-a06f-55e801519878,a31cdd81-913e-48e8-bb2a-616198833c9b,8b20931b-0c97-4b92-88a5-ddb8bb08bd0e,9c9431c7-1b06-41ba-b610-c76e50291837,2022-11-18 11:44:21,completed,True,2022-11-18 11:57:41,19.02615,72.87893,18.964611,72.87893,2022-11-18 12:24:38,18.96439,72.83342,9c9431c7-1b06-41ba-b610-c76e50291837,a4680a7a-5d23-48c7-a06f-55e801519878,Mohammad Meraj,-,a31cdd81-913e-48e8-bb2a-616198833c9b,MH01CV9680,personal_transport,2022-11-18 11:44:21,2022-11-18 12:24:38,"Bhakti Park, Mumbai, Maharashtra 400074, India","XR7M+RMX, Second St, Mazgaon, Mumbai, Maharashtra 400008, India",12.24,completed,11,Friday
2022-11-19,215,a4680a7a-5d23-48c7-a06f-55e801519878,a31cdd81-913e-48e8-bb2a-616198833c9b,8b20931b-0c97-4b92-88a5-ddb8bb08bd0e,9b7cf505-6a7a-45ae-9e04-9f0c3863ba7a,2022-11-19 01:07:17,completed,True,2022-11-19 01:10:26,19.057344,72.927055,19.069374,72.927055,2022-11-19 01:21:33,19.06872,72.89255,9b7cf505-6a7a-45ae-9e04-9f0c3863ba7a,a4680a7a-5d23-48c7-a06f-55e801519878,Mohammad Meraj,-,a31cdd81-913e-48e8-bb2a-616198833c9b,MH01CV9680,personal_transport,2022-11-19 01:07:17,2022-11-19 01:21:33,"Zakir Hussain Nagar, Govandi East, Mumbai, Maharashtra 400043, India","Tilak Nagar, Kurla, Mumbai, Maharashtra 400089, India",5.37,completed,1,Saturday
2022-11-19,215,a4680a7a-5d23-48c7-a06f-55e801519878,a31cdd81-913e-48e8-bb2a-616198833c9b,8b20931b-0c97-4b92-88a5-ddb8bb08bd0e,b75c3fec-e8e4-408a-b535-460ba6491775,2022-11-19 01:21:09,completed,True,2022-11-19 01:30:54,19.07918,72.885475,19.198828,72.885475,2022-11-19 02:06:29,19.198826,72.871635,b75c3fec-e8e4-408a-b535-460ba6491775,a4680a7a-5d23-48c7-a06f-55e801519878,Mohammad Meraj,-,a31cdd81-913e-48e8-bb2a-616198833c9b,MH01CV9680,personal_transport,2022-11-19 01:21:09,2022-11-19 02:06:29,"3VHP+P5G, Kohinoor City Phase 1 Rd, Christian Gaon, Kurla, Mumbai, Maharashtra 400070, India","3A/701, WHISPERING PALMS, Akurli Rd, Kandivali, Alika Nagar, Lokhandwala Twp, Kandivali East, Mumbai, Maharashtra 400101, India",21.96,completed,1,Saturday
2022-11-19,215,a4680a7a-5d23-48c7-a06f-55e801519878,a31cdd81-913e-48e8-bb2a-616198833c9b,8b20931b-0c97-4b92-88a5-ddb8bb08bd0e,b1d5793e-4d10-48ee-8e13-5b87f564a88f,2022-11-19 02:19:50,completed,False,2022-11-19 02:28:13,19.198627,72.877396,19.099628,72.877396,2022-11-19 02:49:43,19.098997,72.87409,b1d5793e-4d10-48ee-8e13-5b87f564a88f,a4680a7a-5d23-48c7-a06f-55e801519878,Mohammad Meraj,-,a31cdd81-913e-48e8-bb2a-616198833c9b,MH01CV9680,personal_transport,2022-11-19 02:19:50,2022-11-19 02:49:43,"7, Anita Nagar Rd, Kandivali, Anita Nagar, Lokhandwala Twp, Kandivali East, Mumbai, Maharashtra 400101, India","Terminal 2, Navpada, Vile Parle East, Vile Parle, Mumbai, Maharashtra 400099, India",15.94,completed,2,Saturday
