day_b,city_id,driver_uuid,vehicle_uuid,partner_uuid,uuid,request_timestamp_local,status,is_cash_trip,begintrip_timestamp_local,begintrip_lat,begintrip_lng,destination_lat,destination_lng,dropoff_timestamp_local,dropoff_lat,dropoff_lng,Trip UUID,Driver UUID,Driver first name,Driver surname,Vehicle UUID,Number plate,Service type,Trip request time,Trip drop-off time,Pick-up address,Drop-off address,Trip distance,Trip status,Hour,DayOfWeek
2022-11-18,215,a9968d19-d7fe-4182-8e0e-a6de37718a71,15d5a47a-da74-4cda-9201-d6240900e00c,f7a1c090-31f5-47cd-8fc8-832b6e06c2c4,f34b9f87-aca0-484c-ac9c-d57b2704516c,2022-11-18 10:01:37,rider_canceled,True,,19.182642,72.95388,19.024242,72.95388,,19.182642,72.95388,f34b9f87-aca0-484c-ac9c-d57b2704516c,a9968d19-d7fe-4182-8e0e-a6de37718a71,Kuldeep,Chhari,15d5a47a-da74-4cda-9201-d6240900e00c,MH01DR6787,personal_transport,2022-11-18 10:01:37,0,"29, Senapati Bapat Marg, Dadar West, Dadar, Mumbai, Maharashtra 400028, India","29, Senapati Bapat Marg, Dadar West, Dadar, Mumbai, Maharashtra 400028, India",0.0,rider_cancelled,10,Friday
2022-11-18,215,a9968d19-d7fe-4182-8e0e-a6de37718a71,15d5a47a-da74-4cda-9201-d6240900e00c,f7a1c090-31f5-47cd-8fc8-832b6e06c2c4,a6cb3f2e-b00a-4b13-8f7b-ccacafff6bda,2022-11-18 10:03:26,completed,True,2022-11-18 10:15:51,19.172085,72.949425,19.033627,72.949425,2022-11-18 11:01:08,19.02901,72.85745,a6cb3f2e-b00a-4b13-8f7b-ccacafff6bda,a9968d19-d7fe-4182-8e0e-a6de37718a71,Kuldeep,Chhari,15d5a47a-da74-4cda-9201-d6240900e00c,MH01DR6787,personal_transport,2022-11-18 10:03:26,2022-11-18 11:01:08,"183, Valji Ladha Rd, Mulund, Mulund West, Mumbai, Maharashtra 400080, India","255, 257, Sion Main Rd, Sion East, Sion, Mumbai, Maharashtra 400022, India",21.71,completed,10,Friday
2022-11-18,215,a9968d19-d7fe-4182-8e0e-a6de37718a71,15d5a47a-da74-4cda-9201-d6240900e00c,f7a1c090-31f5-47cd-8fc8-832b6e06c2c4,300bce2a-e778-4fbd-9d9f-71e218e89cc8,2022-11-18 11:38:29,completed,True,2022-11-18 11:44:39,19.030712,72.854515,19.10558,72.854515,2022-11-18 12:17:52,19.105486,72.92227,300bce2a-e778-4fbd-9d9f-71e218e89cc8,a9968d19-d7fe-4182-8e0e-a6de37718a71,Kuldeep,Chhari,15d5a47a-da74-4cda-9201-d6240900e00c,MH01DR6787,personal_transport,2022-11-18 11:38:29,2022-11-18 12:17:52,"Matunga, Mumbai, Maharashtra 400019, India","4W3G+J2R, Godrej & Boyce Industry Estate, Vikhroli West, Mumbai, Maharashtra 400079, India",13.44,completed,11,Friday
2022-11-18,215,a9968d19-d7fe-4182-8e0e-a6de37718a71,15d5a47a-da74-4cda-9201-d6240900e00c,f7a1c090-31f5-47cd-8fc8-832b6e06c2c4,8e0ee5ac-7d48-44bb-a9eb-c91b7fc723f5,2022-11-18 12:26:03,completed,True,2022-11-18 12:30:29,19.111172,72.92664,19.061558,72.92664,2022-11-18 13:07:38,19.06149,72.8511,8e0ee5ac-7d48-44bb-a9eb-c91b7fc723f5,a9968d19-d7fe-4182-8e0e-a6de37718a71,Kuldeep,Chhari,15d5a47a-da74-4cda-9201-d6240900e00c,MH01DR6787,personal_transport,2022-11-18 12:26:03,2022-11-18 13:07:38,"Saroj Bhavan, Lal Bahadur Shastri Rd, near CANARA BANK - GENERAL BRANCH, Lokamanya Nagar, Gandhi Nagar, Vikhroli, Mumbai, Maharashtra 400083, India","B-203, Md Abasaheb Shinde Marg, Government Colony, Bandra East, Mumbai, Maharashtra 400051, India",15.53,completed,12,Friday
2022-11-18,215,a9968d19-d7fe-4182-8e0e-a6de37718a71,15d5a47a-da74-4cda-9201-d6240900e00c,f7a1c090-31f5-47cd-8fc8-832b6e06c2c4,c7b6b6ab-ab54-422b-94c3-498b1ca8e027,2022-11-18 13:07:29,completed,False,2022-11-18 13:21:52,19.05947,72.85352,18.933775,72.85352,2022-11-18 14:08:10,18.933683,72.83587,c7b6b6ab-ab54-422b-94c3-498b1ca8e027,a9968d19-d7fe-4182-8e0e-a6de37718a71,Kuldeep,Chhari,15d5a47a-da74-4cda-9201-d6240900e00c,MH01DR6787,personal_transport,2022-11-18 13:07:29,2022-11-18 14:08:10,"Siddhant CHS, Kala Nagar, Bandra East, Mumbai, Maharashtra 400051, India","WRMP+5CR, Perin Nariman St, opp. RBI, RBI Monetary Museum, Kala Ghoda, Fort, Mumbai, Maharashtra 400001, India",16.91,completed,13,Friday
2022-11-18,215,a9968d19-d7fe-4182-8e0e-a6de37718a71,3390fd54-a354-47a9-94a0-1b3e09d639f8,f7a1c090-31f5-47cd-8fc8-832b6e06c2c4,142aab64-e172-4922-bb0b-1ab324a7b1b0,2022-11-18 16:34:58,rider_canceled,True,,18.934166,72.839,18.93807,72.839,,18.93409288,72.83879268,142aab64-e172-4922-bb0b-1ab324a7b1b0,a9968d19-d7fe-4182-8e0e-a6de37718a71,Kuldeep,Chhari,3390fd54-a354-47a9-94a0-1b3e09d639f8,MH01DR5495,personal_transport,2022-11-18 16:34:58,0,"65, Walchand Hirachand Marg, Ballard Estate, Fort, Mumbai, Maharashtra 400001, India","65, Walchand Hirachand Marg, Ballard Estate, Fort, Mumbai, Maharashtra 400001, India",0.0,rider_cancelled,16,Friday
2022-11-18,215,a9968d19-d7fe-4182-8e0e-a6de37718a71,3390fd54-a354-47a9-94a0-1b3e09d639f8,f7a1c090-31f5-47cd-8fc8-832b6e06c2c4,5c207e1f-e833-4c23-b843-e72498c9b1da,2022-11-18 16:48:06,completed,True,2022-11-18 16:54:31,18.933796,72.834625,19.164547,72.834625,2022-11-18 18:03:00,19.164577,72.96206,5c207e1f-e833-4c23-b843-e72498c9b1da,a9968d19-d7fe-4182-8e0e-a6de37718a71,Kuldeep,Chhari,3390fd54-a354-47a9-94a0-1b3e09d639f8,MH01DR5495,personal_transport,2022-11-18 16:48:06,2022-11-18 18:03:00,"Jeevan Prakash Building, Sir Phirozshah Mehta Rd, Kala Ghoda, Fort, Mumbai, Maharashtra 400001, India","NEEL SAGAR, Veer Savarkar Rd, Navghar, Mulund East, Mumbai, Maharashtra 400081, India",32.5,completed,16,Friday
2022-11-18,215,a9968d19-d7fe-4182-8e0e-a6de37718a71,3390fd54-a354-47a9-94a0-1b3e09d639f8,f7a1c090-31f5-47cd-8fc8-832b6e06c2c4,b784768a-eccc-45ca-a3b6-12557231cc29,2022-11-18 18:36:40,rider_canceled,False,,19.166409,72.96395,19.169638,72.96395,,19.17446995,72.96297002,b784768a-eccc-45ca-a3b6-12557231cc29,a9968d19-d7fe-4182-8e0e-a6de37718a71,Kuldeep,Chhari,3390fd54-a354-47a9-94a0-1b3e09d639f8,MH01DR5495,personal_transport,2022-11-18 18:36:40,0,"Shop no.4, Shamika Building Chinatmani, Shree Ganesh CHS, Gopal Krishna Gokhale Rd, Hanuman Chowk, Mulund East, Mumbai, Maharashtra 400081, India","Shop no.4, Shamika Building Chinatmani, Shree Ganesh CHS, Gopal Krishna Gokhale Rd, Hanuman Chowk, Mulund East, Mumbai, Maharashtra 400081, India",0.0,rider_cancelled,18,Friday
