day_b,city_id,driver_uuid,vehicle_uuid,partner_uuid,uuid,request_timestamp_local,status,is_cash_trip,begintrip_timestamp_local,begintrip_lat,begintrip_lng,destination_lat,destination_lng,dropoff_timestamp_local,dropoff_lat,dropoff_lng,Trip UUID,Driver UUID,Driver first name,Driver surname,Vehicle UUID,Number plate,Service type,Trip request time,Trip drop-off time,Pick-up address,Drop-off address,Trip distance,Trip status,Hour,DayOfWeek
2022-11-18,215,aa07e0df-4c8e-490c-a735-63e99e2b45b5,b2a3fbc4-b9be-4fb8-ae18-98ec52b5046a,22fc8d0e-922e-43cc-aea1-791ac268a32a,9959ebbd-764b-49c4-a0c2-50a212414497,2022-11-18 10:16:59,completed,False,2022-11-18 10:27:14,19.417753,72.850555,19.382364,72.850555,2022-11-18 10:45:40,19.382471,72.8302,9959ebbd-764b-49c4-a0c2-50a212414497,aa07e0df-4c8e-490c-a735-63e99e2b45b5,KAMLESHKUMAR,PAL,b2a3fbc4-b9be-4fb8-ae18-98ec52b5046a,MH01DR4334,personal_transport,2022-11-18 10:16:59,2022-11-18 10:45:40,"Plot No, 50, Sector 2, Golani Naka, Vasai East, Bilalpada, Maharashtra 401208, India","Vasai Station Rd, Anand Nagar, Vasai West, Vasai-Virar, Maharashtra 401202, India",5.85,completed,10,Friday
2022-11-18,215,aa07e0df-4c8e-490c-a735-63e99e2b45b5,b2a3fbc4-b9be-4fb8-ae18-98ec52b5046a,22fc8d0e-922e-43cc-aea1-791ac268a32a,4c41fa1d-5994-4221-ba45-c1e4ba9397a6,2022-11-18 17:11:29,completed,True,2022-11-18 17:27:11,19.3828,72.81578,19.214252,72.81578,2022-11-18 19:00:32,19.21442,72.9587,4c41fa1d-5994-4221-ba45-c1e4ba9397a6,aa07e0df-4c8e-490c-a735-63e99e2b45b5,KAMLESHKUMAR,PAL,b2a3fbc4-b9be-4fb8-ae18-98ec52b5046a,MH01DR4334,personal_transport,2022-11-18 17:11:29,2022-11-18 19:00:32,"A-18, SHREEJI SADAN DHURI CAMPUS, नवघर, वसई वेस्ट, तारखाड, महाराष्ट्र 401202, India","Unnathi Gardens, Thane West, Thane, Maharashtra 400606, India",41.28,completed,17,Friday
2022-11-18,215,aa07e0df-4c8e-490c-a735-63e99e2b45b5,b2a3fbc4-b9be-4fb8-ae18-98ec52b5046a,22fc8d0e-922e-43cc-aea1-791ac268a32a,83948e2c-9191-47b8-8679-f065f47777dc,2022-11-18 18:56:02,completed,False,2022-11-18 19:08:29,19.211533,72.96086,19.209915,72.96086,2022-11-18 19:26:00,19.20858,72.98449,83948e2c-9191-47b8-8679-f065f47777dc,aa07e0df-4c8e-490c-a735-63e99e2b45b5,KAMLESHKUMAR,PAL,b2a3fbc4-b9be-4fb8-ae18-98ec52b5046a,MH01DR4334,personal_transport,2022-11-18 18:56:02,2022-11-18 19:26:00,"Shop No: Building No: 38, Pokharan Rd Number 1, opp. Asiatic Gas Company, Vartak Nagar, Thane West, Thane, Maharashtra 400606, India","6X5P+W53, Phase II, Vrindavan Society, Thane West, Thane, Maharashtra 400601, India",3.53,completed,18,Friday
2022-11-18,215,aa07e0df-4c8e-490c-a735-63e99e2b45b5,b2a3fbc4-b9be-4fb8-ae18-98ec52b5046a,22fc8d0e-922e-43cc-aea1-791ac268a32a,48c9beb5-111a-4fcb-a4a9-942596fdec52,2022-11-18 19:57:16,rider_canceled,True,,19.208775,72.98295,19.1871,72.98295,,19.20877039,72.98294806,48c9beb5-111a-4fcb-a4a9-942596fdec52,aa07e0df-4c8e-490c-a735-63e99e2b45b5,KAMLESHKUMAR,PAL,b2a3fbc4-b9be-4fb8-ae18-98ec52b5046a,MH01DR4334,personal_transport,2022-11-18 19:57:16,0,"TMT Reserved Flyover SATIS, Jambli Naka, Thane West, Thane, Maharashtra 400601, India","TMT Reserved Flyover SATIS, Jambli Naka, Thane West, Thane, Maharashtra 400601, India",0.0,rider_cancelled,19,Friday
2022-11-18,215,aa07e0df-4c8e-490c-a735-63e99e2b45b5,b2a3fbc4-b9be-4fb8-ae18-98ec52b5046a,22fc8d0e-922e-43cc-aea1-791ac268a32a,cf08caf3-6eb1-4a83-b431-e9a8ae3d6bb5,2022-11-18 20:05:57,completed,True,2022-11-18 20:21:19,19.213041,72.97722,19.2078,72.97722,2022-11-18 21:40:18,19.207718,72.85038,cf08caf3-6eb1-4a83-b431-e9a8ae3d6bb5,aa07e0df-4c8e-490c-a735-63e99e2b45b5,KAMLESHKUMAR,PAL,b2a3fbc4-b9be-4fb8-ae18-98ec52b5046a,MH01DR4334,personal_transport,2022-11-18 20:05:57,2022-11-18 21:40:18,"2 AVM, near Jaipur golden Transport Office, Sainath Nagar, Majiwada, Thane, Maharashtra 400601, India","65, Swami Vivekananda Rd, opp. Fire Brigade, Balasinor Society, Parekh Nagar, Kandivali West, Mumbai, Maharashtra 400067, India",28.28,completed,20,Friday
2022-11-18,215,aa07e0df-4c8e-490c-a735-63e99e2b45b5,b2a3fbc4-b9be-4fb8-ae18-98ec52b5046a,22fc8d0e-922e-43cc-aea1-791ac268a32a,58c534af-4d11-4f2e-a411-af62da4b9174,2022-11-18 21:46:13,completed,True,2022-11-18 21:54:16,19.201988,72.851105,19.234182,72.851105,2022-11-18 22:14:03,19.23395,72.8582,58c534af-4d11-4f2e-a411-af62da4b9174,aa07e0df-4c8e-490c-a735-63e99e2b45b5,KAMLESHKUMAR,PAL,b2a3fbc4-b9be-4fb8-ae18-98ec52b5046a,MH01DR4334,personal_transport,2022-11-18 21:46:13,2022-11-18 22:14:03,"12, Akansha Arcade, Trikamdas Road, Kandivali (West), Mumbai - 400067, near Cinemax, Kandivali, Jethava Nagar, Kandivali West, Mumbai, Maharashtra 400067, India","Daulat Nagar, Borivali, Mumbai, Maharashtra, India",5.72,completed,21,Friday
2022-11-18,215,aa07e0df-4c8e-490c-a735-63e99e2b45b5,b2a3fbc4-b9be-4fb8-ae18-98ec52b5046a,22fc8d0e-922e-43cc-aea1-791ac268a32a,fed38744-f40e-42cf-a918-fc0d810f0202,2022-11-18 22:14:24,completed,True,2022-11-18 22:21:12,19.242876,72.86071,19.406122,72.86071,2022-11-18 23:10:48,19.405935,72.835014,fed38744-f40e-42cf-a918-fc0d810f0202,aa07e0df-4c8e-490c-a735-63e99e2b45b5,KAMLESHKUMAR,PAL,b2a3fbc4-b9be-4fb8-ae18-98ec52b5046a,MH01DR4334,personal_transport,2022-11-18 22:14:24,2022-11-18 23:10:48,"Chandak Nishchay, next to Parbat Nagar, Ambawadi, Swami Vivekananda Rd, Ambawadi, Dahisar East, Mumbai, Maharashtra 400068, India","Neminath Tower, Opp. Star Residency, Neminath Tower, Vasant Nagari, Vasai East, Vasai-Virar, Maharashtra 401208, India",28.4,completed,22,Friday
