day_b,city_id,driver_uuid,vehicle_uuid,partner_uuid,uuid,request_timestamp_local,status,is_cash_trip,begintrip_timestamp_local,begintrip_lat,begintrip_lng,destination_lat,destination_lng,dropoff_timestamp_local,dropoff_lat,dropoff_lng,Trip UUID,Driver UUID,Driver first name,Driver surname,Vehicle UUID,Number plate,Service type,Trip request time,Trip drop-off time,Pick-up address,Drop-off address,Trip distance,Trip status,Hour,DayOfWeek
2022-11-18,215,c4d31c4e-38bb-4bd0-bd4e-84a8e1b74407,b850c208-00bc-4fe2-ba1f-e5cd975d2971,ca90c852-163d-4543-8293-9e134e7b190d,39ff6d81-83b6-4c57-a954-f987546423b4,2022-11-18 09:55:10,completed,True,2022-11-18 10:09:28,19.16401,73.03113,19.05097,73.03113,2022-11-18 11:38:34,19.05087,72.82928,39ff6d81-83b6-4c57-a954-f987546423b4,c4d31c4e-38bb-4bd0-bd4e-84a8e1b74407,MAQSUD,JUNAGADHWALA,b850c208-00bc-4fe2-ba1f-e5cd975d2971,MH01DR9848,personal_transport,2022-11-18 09:55:10,2022-11-18 11:38:34,"Kausa, Mumbra, 527J+J6F, Shimla Park, Kausa, Mumbra, Thane, Maharashtra 400612, India","A-791, A-791, Bandra Reclamation Rd, General Arunkumar Vaidya Nagar, Bandra West, Mumbai, Maharashtra 400050, India",40.7,completed,9,Friday
2022-11-18,215,c4d31c4e-38bb-4bd0-bd4e-84a8e1b74407,b850c208-00bc-4fe2-ba1f-e5cd975d2971,ca90c852-163d-4543-8293-9e134e7b190d,3df8b746-5b2b-47a6-8543-b22f230df065,2022-11-18 11:34:05,completed,True,2022-11-18 11:44:17,19.052326,72.82405,19.06793,72.82405,2022-11-18 12:53:11,19.067898,73.01232,3df8b746-5b2b-47a6-8543-b22f230df065,c4d31c4e-38bb-4bd0-bd4e-84a8e1b74407,MAQSUD,JUNAGADHWALA,b850c208-00bc-4fe2-ba1f-e5cd975d2971,MH01DR9848,personal_transport,2022-11-18 11:34:05,2022-11-18 12:53:11,"Shop No. 241, Building No. 7, Hill View, Hill Rd, opposite Mehboob Studio, Ranwar, Bandra West, Mumbai, Maharashtra 400050, India","Hotel Devi's Residency, Plot no 8, Off, Mumbai - Pune Hwy, next to BlueDart, Sector 24, Turbhe, Navi Mumbai, Maharashtra 400703, India",23.46,completed,11,Friday
2022-11-18,215,c4d31c4e-38bb-4bd0-bd4e-84a8e1b74407,b850c208-00bc-4fe2-ba1f-e5cd975d2971,ca90c852-163d-4543-8293-9e134e7b190d,1852c656-6c15-41c7-86cc-9e54f900f85b,2022-11-18 12:44:44,completed,True,2022-11-18 13:04:06,19.062803,73.01951,18.925877,73.01951,2022-11-18 14:05:31,18.925896,72.82578,1852c656-6c15-41c7-86cc-9e54f900f85b,c4d31c4e-38bb-4bd0-bd4e-84a8e1b74407,MAQSUD,JUNAGADHWALA,b850c208-00bc-4fe2-ba1f-e5cd975d2971,MH01DR9848,personal_transport,2022-11-18 12:44:44,2022-11-18 14:05:31,"B-19, MIDC Industrial Area, Sanpada, Navi Mumbai, Maharashtra 400705, India","स्टेट बैंक भवन, Vidhan Bhavan Marg, नरिमन पॉइंट, मुंबई, महाराष्ट्र 400021, India",31.7,completed,12,Friday
2022-11-18,215,c4d31c4e-38bb-4bd0-bd4e-84a8e1b74407,b850c208-00bc-4fe2-ba1f-e5cd975d2971,ca90c852-163d-4543-8293-9e134e7b190d,37ad5d5d-d8bd-425b-a042-70952c25d26b,2022-11-18 15:20:58,completed,True,2022-11-18 15:24:44,18.961096,72.81734,19.065569,72.81734,2022-11-18 16:05:35,19.063232,72.916855,37ad5d5d-d8bd-425b-a042-70952c25d26b,c4d31c4e-38bb-4bd0-bd4e-84a8e1b74407,MAQSUD,JUNAGADHWALA,b850c208-00bc-4fe2-ba1f-e5cd975d2971,MH01DR9848,personal_transport,2022-11-18 15:20:58,2022-11-18 16:05:35,"Shop No. 2, 312, Dhun Building, Lamington Road, Near By Lamington Road, Police Station, Krishna Kunj, Grant Road East, Shapur Baug, Girgaon, Mumbai, Maharashtra 400007, India","10/11, Building No. 34/A, Natwar Parekh Compound, GM, Link Rd, Govandi West, Natvar Parekh Compound, Mumbai - 43, Mumbai, Maharashtra 400043, India",19.57,completed,15,Friday
2022-11-18,215,c4d31c4e-38bb-4bd0-bd4e-84a8e1b74407,b850c208-00bc-4fe2-ba1f-e5cd975d2971,ca90c852-163d-4543-8293-9e134e7b190d,1cb980ee-9a46-468a-87e3-dbe07183e5fb,2022-11-18 16:09:15,completed,False,2022-11-18 16:13:45,19.055777,72.92324,19.10535,72.92324,2022-11-18 17:10:53,19.105396,72.88219,1cb980ee-9a46-468a-87e3-dbe07183e5fb,c4d31c4e-38bb-4bd0-bd4e-84a8e1b74407,MAQSUD,JUNAGADHWALA,b850c208-00bc-4fe2-ba1f-e5cd975d2971,MH01DR9848,personal_transport,2022-11-18 16:09:15,2022-11-18 17:10:53,"Vrushali Apartment, 2, Jeejabai Bhosale Marg, Municipal Colony, Sector 2, Govandi East, Mumbai, Maharashtra 400043, India","Unit No.134, Bldg No.6, 1st Floor, Mittal Industrial Estate Rd, Mittal Industrial Estate, Marol, Andheri East, Mumbai, Maharashtra 400059, India",10.49,completed,16,Friday
2022-11-18,215,c4d31c4e-38bb-4bd0-bd4e-84a8e1b74407,b850c208-00bc-4fe2-ba1f-e5cd975d2971,ca90c852-163d-4543-8293-9e134e7b190d,9cd7c2fd-0bb3-49c9-9b74-4e24ef579b99,2022-11-18 17:48:50,completed,False,2022-11-18 18:05:13,19.120634,72.87572,19.227695,72.87572,2022-11-18 19:36:44,19.227966,72.96961,9cd7c2fd-0bb3-49c9-9b74-4e24ef579b99,c4d31c4e-38bb-4bd0-bd4e-84a8e1b74407,MAQSUD,JUNAGADHWALA,b850c208-00bc-4fe2-ba1f-e5cd975d2971,MH01DR9848,personal_transport,2022-11-18 17:48:50,2022-11-18 19:36:44,"Akruti Softech Park, 2nd Floor, Road No. 21, MIDC,, Andheri East, Shree Krishna Nagar, Marol MIDC Industry Estate, Andheri East, Mumbai, Maharashtra 400093, India","6XH8+3Q2, S.R. Pawar Nagar, Vasant Vihar, Thane West, Thane, Maharashtra 400610, India",22.84,completed,17,Friday
2022-11-18,215,c4d31c4e-38bb-4bd0-bd4e-84a8e1b74407,b850c208-00bc-4fe2-ba1f-e5cd975d2971,ca90c852-163d-4543-8293-9e134e7b190d,d41354e3-5d6b-4e3c-b3eb-cfefb3545289,2022-11-18 20:03:41,completed,True,2022-11-18 20:13:14,19.217745,72.98075,19.04494,72.98075,2022-11-18 21:14:29,19.044985,73.01317,d41354e3-5d6b-4e3c-b3eb-cfefb3545289,c4d31c4e-38bb-4bd0-bd4e-84a8e1b74407,MAQSUD,JUNAGADHWALA,b850c208-00bc-4fe2-ba1f-e5cd975d2971,MH01DR9848,personal_transport,2022-11-18 20:03:41,2022-11-18 21:14:29,"Old Agra Rd, Samata Nagar, Sainath Nagar, Majiwada, Thane, Maharashtra 400601, India","New Saptarshi CHS, 400706, Sector 4, Sarsole, Navi Mumbai, Maharashtra 400706, India",24.24,completed,20,Friday
