day_b,city_id,driver_uuid,vehicle_uuid,partner_uuid,uuid,request_timestamp_local,status,is_cash_trip,begintrip_timestamp_local,begintrip_lat,begintrip_lng,destination_lat,destination_lng,dropoff_timestamp_local,dropoff_lat,dropoff_lng,Trip UUID,Driver UUID,Driver first name,Driver surname,Vehicle UUID,Number plate,Service type,Trip request time,Trip drop-off time,Pick-up address,Drop-off address,Trip distance,Trip status,Hour,DayOfWeek
2022-11-18,215,ca84dad5-2a34-4afa-9497-4bea665b91e2,09ee60bc-1746-4a2f-8970-9579f9017f75,8b20931b-0c97-4b92-88a5-ddb8bb08bd0e,1ee601e8-0d79-4da8-8df6-beedbe2dee95,2022-11-18 09:37:53,completed,True,2022-11-18 09:54:08,19.158955,73.11644,19.051342,73.11644,2022-11-18 10:45:39,19.051315,73.02199,1ee601e8-0d79-4da8-8df6-beedbe2dee95,ca84dad5-2a34-4afa-9497-4bea665b91e2,karanvir,singh,09ee60bc-1746-4a2f-8970-9579f9017f75,MH01CV8524,personal_transport,2022-11-18 09:37:53,2022-11-18 10:45:39,"D1-1002, Casa Clara CHS Palava 2, Dombivli East, Antarli, Maharashtra 421204, India","Raheja District, opp. Juinagar Station Road, MIDC Industrial Area, Juinagar, Navi Mumbai, Maharashtra 400705, India",24.49,completed,9,Friday
2022-11-18,215,ca84dad5-2a34-4afa-9497-4bea665b91e2,09ee60bc-1746-4a2f-8970-9579f9017f75,8b20931b-0c97-4b92-88a5-ddb8bb08bd0e,965c3eee-d3a3-40ee-9d2e-8d5748c3d8fc,2022-11-18 10:46:39,completed,False,2022-11-18 10:52:38,19.04609,73.02983,19.128325,73.02983,2022-11-18 12:40:30,19.127502,72.83301,965c3eee-d3a3-40ee-9d2e-8d5748c3d8fc,ca84dad5-2a34-4afa-9497-4bea665b91e2,karanvir,singh,09ee60bc-1746-4a2f-8970-9579f9017f75,MH01CV8524,personal_transport,2022-11-18 10:46:39,2022-11-18 12:40:30,"Plot No.D/154, T.T.C Industrial area,, Shirvane, Nerul,, Behind London Pilsner beer company., MIDC Industrial Area, Shiravane, Nerul, Navi Mumbai, Maharashtra 400706, India","Dhake Colony, Azad Nagar, Andheri West, Mumbai, Maharashtra 400053, India",35.41,completed,10,Friday
2022-11-18,215,ca84dad5-2a34-4afa-9497-4bea665b91e2,09ee60bc-1746-4a2f-8970-9579f9017f75,8b20931b-0c97-4b92-88a5-ddb8bb08bd0e,72d987cf-7e37-499e-a3b9-a4c36b3ebde3,2022-11-18 12:29:54,completed,False,2022-11-18 12:53:43,19.126463,72.83925,19.072418,72.83925,2022-11-18 13:48:40,19.072428,72.82912,72d987cf-7e37-499e-a3b9-a4c36b3ebde3,ca84dad5-2a34-4afa-9497-4bea665b91e2,karanvir,singh,09ee60bc-1746-4a2f-8970-9579f9017f75,MH01CV8524,personal_transport,2022-11-18 12:29:54,2022-11-18 13:48:40,"1, Dadabhai Cross Rd, Tepgaon, Andheri West, Mumbai, Maharashtra 400058, India","3rd Floor, Plot A-20, S H Ram, 18th A Rd, next to Beacon High School, Khar, Khar West, Mumbai, Maharashtra 400052, India",9.27,completed,12,Friday
2022-11-18,215,ca84dad5-2a34-4afa-9497-4bea665b91e2,09ee60bc-1746-4a2f-8970-9579f9017f75,8b20931b-0c97-4b92-88a5-ddb8bb08bd0e,6dd74027-96d4-4f84-994f-a9092d657a7f,2022-11-18 13:35:58,completed,False,2022-11-18 13:53:37,19.071781,72.82961,19.028097,72.82961,2022-11-18 14:26:39,19.028605,72.855095,6dd74027-96d4-4f84-994f-a9092d657a7f,ca84dad5-2a34-4afa-9497-4bea665b91e2,karanvir,singh,09ee60bc-1746-4a2f-8970-9579f9017f75,MH01CV8524,personal_transport,2022-11-18 13:35:58,2022-11-18 14:26:39,"Krishna, 18th Rd, Khar, Khar West, Mumbai, Maharashtra 400052, India","452/453, Bhaudaji Road, Behind Parshwanath Jain Mandir, Dr Babasaheb Ambedkar Marg, Maheshwari Udyan, Kings Circle, Matunga, Mumbai, Maharashtra 400019, India",7.18,completed,13,Friday
2022-11-18,215,ca84dad5-2a34-4afa-9497-4bea665b91e2,09ee60bc-1746-4a2f-8970-9579f9017f75,8b20931b-0c97-4b92-88a5-ddb8bb08bd0e,cdf8c2c7-7037-46f2-8909-36475162b99f,2022-11-18 14:21:20,driver_canceled,True,,19.033657,72.85475,19.215885,72.85475,,19.03655171,72.86040676,cdf8c2c7-7037-46f2-8909-36475162b99f,ca84dad5-2a34-4afa-9497-4bea665b91e2,karanvir,singh,09ee60bc-1746-4a2f-8970-9579f9017f75,MH01CV8524,personal_transport,2022-11-18 14:21:20,0,Icon Plaza,Icon Plaza,0.0,driver_cancelled,14,Friday
