day_b,city_id,driver_uuid,vehicle_uuid,partner_uuid,uuid,request_timestamp_local,status,is_cash_trip,begintrip_timestamp_local,begintrip_lat,begintrip_lng,destination_lat,destination_lng,dropoff_timestamp_local,dropoff_lat,dropoff_lng,Trip UUID,Driver UUID,Driver first name,Driver surname,Vehicle UUID,Number plate,Service type,Trip request time,Trip drop-off time,Pick-up address,Drop-off address,Trip distance,Trip status,Hour,DayOfWeek
2022-11-18,215,cbf5694c-54c0-4e99-9dd3-a91d8d393e6b,ef516f42-cf8b-45a5-b1da-2ef860699bd7,517e1bbb-df7d-4280-a71c-d26ebfe12173,8f951513-af0b-4f15-8e4f-29c37db33446,2022-11-18 08:33:28,completed,False,2022-11-18 08:52:36,19.193651,72.83785,19.285652,72.83785,2022-11-18 09:28:22,19.285572,72.87632,8f951513-af0b-4f15-8e4f-29c37db33446,cbf5694c-54c0-4e99-9dd3-a91d8d393e6b,Naresh,Vanputi,ef516f42-cf8b-45a5-b1da-2ef860699bd7,MH01EE0717,personal_transport,2022-11-18 08:33:28,2022-11-18 09:28:22,"Golden Croft, 155, D'Monte Ln, Malad, Orlem, Kanchpada, Malad West, Mumbai, Maharashtra 400064, India","Morning Glory, Building, 1, Hubtown Gardenia Rd, behind GCC Club Road, Chandan Shanti, Mira Road, Mira Bhayandar, Maharashtra 401107, India",15.2,completed,8,Friday
2022-11-18,215,cbf5694c-54c0-4e99-9dd3-a91d8d393e6b,ef516f42-cf8b-45a5-b1da-2ef860699bd7,517e1bbb-df7d-4280-a71c-d26ebfe12173,97fb00a6-d585-437e-839b-784e80f2a471,2022-11-18 09:42:50,completed,True,2022-11-18 09:51:15,19.286333,72.875275,19.01499,72.875275,2022-11-18 11:13:03,19.015043,72.825455,97fb00a6-d585-437e-839b-784e80f2a471,cbf5694c-54c0-4e99-9dd3-a91d8d393e6b,Naresh,Vanputi,ef516f42-cf8b-45a5-b1da-2ef860699bd7,MH01EE0717,personal_transport,2022-11-18 09:42:50,2022-11-18 11:13:03,"7VPG+C48, Gaurav Enclave Rd, Chandan Shanti, Mira Road, Mira Bhayandar, Maharashtra 401107, India","VIP Industries Limited, 88C, Dr NB Parulekar Marg, Prabhadevi, Mumbai, Maharashtra 400025, India",34.81,completed,9,Friday
2022-11-18,215,cbf5694c-54c0-4e99-9dd3-a91d8d393e6b,ef516f42-cf8b-45a5-b1da-2ef860699bd7,517e1bbb-df7d-4280-a71c-d26ebfe12173,a8b68f0a-b43d-4029-a076-348dd8cc01e2,2022-11-18 11:16:31,completed,False,2022-11-18 11:21:38,19.016594,72.82926,18.930372,72.82926,2022-11-18 12:11:58,18.930298,72.83538,a8b68f0a-b43d-4029-a076-348dd8cc01e2,cbf5694c-54c0-4e99-9dd3-a91d8d393e6b,Naresh,Vanputi,ef516f42-cf8b-45a5-b1da-2ef860699bd7,MH01EE0717,personal_transport,2022-11-18 11:16:31,2022-11-18 12:11:58,"V, SVS Rd, opposite Siddhivinayak Mandir, Prabhadevi, Mumbai, Maharashtra 400025, India","L,, 66/68, Colaba Causeway, Kala Ghoda, Fort, Mumbai, Maharashtra 400001, India",11.17,completed,11,Friday
2022-11-18,215,cbf5694c-54c0-4e99-9dd3-a91d8d393e6b,ef516f42-cf8b-45a5-b1da-2ef860699bd7,517e1bbb-df7d-4280-a71c-d26ebfe12173,ab11c986-42eb-400b-922f-eb878251bec9,2022-11-18 12:34:16,completed,True,2022-11-18 12:35:20,18.918394,72.82874,19.083363,72.82874,2022-11-18 13:38:41,19.083715,72.8381,ab11c986-42eb-400b-922f-eb878251bec9,cbf5694c-54c0-4e99-9dd3-a91d8d393e6b,Naresh,Vanputi,ef516f42-cf8b-45a5-b1da-2ef860699bd7,MH01EE0717,personal_transport,2022-11-18 12:34:16,2022-11-18 13:38:41,"Sheila Mahal Society Shop no 5, 1st Pasta Ln , Colaba Mumbai 40005, Railway Colony, Apollo Bandar, Colaba, Mumbai, Maharashtra 400005, India","Prime Plaza, 101, Swami Vivekananda Rd, Navyug Colony, Santacruz West, Mumbai, Maharashtra 400054, India",25.16,completed,12,Friday
2022-11-18,215,cbf5694c-54c0-4e99-9dd3-a91d8d393e6b,ef516f42-cf8b-45a5-b1da-2ef860699bd7,517e1bbb-df7d-4280-a71c-d26ebfe12173,dfe25ff3-75b8-4601-9c2f-2f0aa7aaa272,2022-11-18 13:28:00,completed,True,2022-11-18 13:47:41,19.08937,72.83421,19.141365,72.83421,2022-11-18 14:15:35,19.141737,72.83134,dfe25ff3-75b8-4601-9c2f-2f0aa7aaa272,cbf5694c-54c0-4e99-9dd3-a91d8d393e6b,Naresh,Vanputi,ef516f42-cf8b-45a5-b1da-2ef860699bd7,MH01EE0717,personal_transport,2022-11-18 13:28:00,2022-11-18 14:15:35,"3RQM+VF5, Dadabhai Rd, Shastri Nagar, Santacruz West, Mumbai, Maharashtra 400054, India","New Link Rd, Phase D, Oshiwara, Andheri West, Mumbai, Maharashtra 400053, India",7.01,completed,13,Friday
2022-11-18,215,cbf5694c-54c0-4e99-9dd3-a91d8d393e6b,ef516f42-cf8b-45a5-b1da-2ef860699bd7,517e1bbb-df7d-4280-a71c-d26ebfe12173,6910f550-66de-4b3d-994b-42be693cef59,2022-11-18 14:09:33,completed,False,2022-11-18 14:22:09,19.13627,72.83078,19.074585,72.83078,2022-11-18 15:05:18,19.074606,72.827095,6910f550-66de-4b3d-994b-42be693cef59,cbf5694c-54c0-4e99-9dd3-a91d8d393e6b,Naresh,Vanputi,ef516f42-cf8b-45a5-b1da-2ef860699bd7,MH01EE0717,personal_transport,2022-11-18 14:09:33,2022-11-18 15:05:18,"317/318, Laxmi Plaza, New Link Rd, Laxmi Industrial Estate, Suresh Nagar, Andheri West, Mumbai, Maharashtra 400053, India","6, Garden Homes, Chitrakar Dhurandhar Rd, Khar, Chuim Village, Ambedkar Colony, Khar West, Mumbai, Maharashtra 400052, India",8.99,completed,14,Friday
2022-11-18,215,cbf5694c-54c0-4e99-9dd3-a91d8d393e6b,ef516f42-cf8b-45a5-b1da-2ef860699bd7,517e1bbb-df7d-4280-a71c-d26ebfe12173,178341fe-fb89-46b5-8c9b-0f788c3e024d,2022-11-18 15:04:47,completed,True,2022-11-18 15:18:19,19.07547,72.83288,19.110886,72.83288,2022-11-18 15:51:22,19.11106,72.87352,178341fe-fb89-46b5-8c9b-0f788c3e024d,cbf5694c-54c0-4e99-9dd3-a91d8d393e6b,Naresh,Vanputi,ef516f42-cf8b-45a5-b1da-2ef860699bd7,MH01EE0717,personal_transport,2022-11-18 15:04:47,2022-11-18 15:51:22,"Mangal Nevatia CHS, 10-B, Junction of Sarojini Rd, &, South Avenue, Vithaldas Nagar, Santacruz West, Mumbai, Maharashtra 400054, India","403, Leela Business Park, Andheri - Kurla Rd, Bori Colony, Vijay Nagar Colony West, Marol, Andheri East, Mumbai, Maharashtra 400059, India",9.66,completed,15,Friday
2022-11-18,215,cbf5694c-54c0-4e99-9dd3-a91d8d393e6b,ef516f42-cf8b-45a5-b1da-2ef860699bd7,517e1bbb-df7d-4280-a71c-d26ebfe12173,f96bbbb8-47b0-4e19-8b6d-9929ccec9d25,2022-11-18 15:48:53,completed,False,2022-11-18 15:56:56,19.110487,72.87939,19.200903,72.87939,2022-11-18 17:04:48,19.201262,72.81694,f96bbbb8-47b0-4e19-8b6d-9929ccec9d25,cbf5694c-54c0-4e99-9dd3-a91d8d393e6b,Naresh,Vanputi,ef516f42-cf8b-45a5-b1da-2ef860699bd7,MH01EE0717,personal_transport,2022-11-18 15:48:53,2022-11-18 17:04:48,"Marol Maroshi Rd, Gamdevi, Marol, Andheri East, Mumbai, Maharashtra 400059, India","Sonata Cooperative Group Housing Society, Malad, Jankalyan Nagar, Malad West, Mumbai, Maharashtra 400095, India",17.41,completed,15,Friday
