day_b,city_id,driver_uuid,vehicle_uuid,partner_uuid,uuid,request_timestamp_local,status,is_cash_trip,begintrip_timestamp_local,begintrip_lat,begintrip_lng,destination_lat,destination_lng,dropoff_timestamp_local,dropoff_lat,dropoff_lng,Trip UUID,Driver UUID,Driver first name,Driver surname,Vehicle UUID,Number plate,Service type,Trip request time,Trip drop-off time,Pick-up address,Drop-off address,Trip distance,Trip status,Hour,DayOfWeek
2022-11-18,215,d2f9bd66-97d9-49ab-bfa2-d0c8ec2c7e2a,bba91f10-deb3-45f2-bfad-043f989b87c8,a5a01951-8feb-4baf-b3f3-1883e4f62fe7,370a1710-6f36-485f-8fca-2592dfc91547,2022-11-18 21:04:36,completed,False,2022-11-18 21:10:59,19.115152,72.827675,19.2252,72.827675,2022-11-18 22:04:43,19.22524,72.86427,370a1710-6f36-485f-8fca-2592dfc91547,d2f9bd66-97d9-49ab-bfa2-d0c8ec2c7e2a,Sumit,Mandal,bba91f10-deb3-45f2-bfad-043f989b87c8,MH01DR6924,personal_transport,2022-11-18 21:04:36,2022-11-18 22:04:43,"Dynamix Mall, 5th floor, Parulekar Rd, above Shoppers stop, near Chandan Cinema, Sainath Nagar, MHADA Colony, Juhu, Mumbai, Maharashtra 400049, India","Devipada Ground, Devipada, Borivali East, Mumbai, Maharashtra 400066, India",18.28,completed,21,Friday
2022-11-18,215,d2f9bd66-97d9-49ab-bfa2-d0c8ec2c7e2a,bba91f10-deb3-45f2-bfad-043f989b87c8,a5a01951-8feb-4baf-b3f3-1883e4f62fe7,99086b44-b534-4594-825d-d1690140f85f,2022-11-18 22:02:03,unfulfilled,False,,19.22864,72.86354,19.207308,72.86354,,19.22523999,72.86427832,99086b44-b534-4594-825d-d1690140f85f,d2f9bd66-97d9-49ab-bfa2-d0c8ec2c7e2a,Sumit,Mandal,bba91f10-deb3-45f2-bfad-043f989b87c8,MH01DR6924,personal_transport,2022-11-18 22:02:03,0,"6445+V4C, Ganpati Visarjan Talao Rd, Sudama Nagar, Dombivli East, Dombivli, Maharashtra 421203, India","6445+V4C, Ganpati Visarjan Talao Rd, Sudama Nagar, Dombivli East, Dombivli, Maharashtra 421203, India",0.0,delivery_failed,22,Friday
2022-11-18,215,d2f9bd66-97d9-49ab-bfa2-d0c8ec2c7e2a,bba91f10-deb3-45f2-bfad-043f989b87c8,a5a01951-8feb-4baf-b3f3-1883e4f62fe7,78819f3e-4649-481e-851a-6670a43bf28b,2022-11-18 22:05:53,completed,False,2022-11-18 22:19:05,19.215948,72.86594,19.060226,72.86594,2022-11-18 22:54:14,19.06026,72.836494,78819f3e-4649-481e-851a-6670a43bf28b,d2f9bd66-97d9-49ab-bfa2-d0c8ec2c7e2a,Sumit,Mandal,bba91f10-deb3-45f2-bfad-043f989b87c8,MH01DR6924,personal_transport,2022-11-18 22:05:53,2022-11-18 22:54:14,"Western Express Hwy, Kandivali, Asha Nagar, Borivali (E, Mumbai, Maharashtra 400066, India","3rd Floor, VN Sphere Mall, Linking Rd, Bandra West, Mumbai, Maharashtra 400050, India",22.55,completed,22,Friday
2022-11-18,215,d2f9bd66-97d9-49ab-bfa2-d0c8ec2c7e2a,bba91f10-deb3-45f2-bfad-043f989b87c8,a5a01951-8feb-4baf-b3f3-1883e4f62fe7,f8a67128-7264-49d7-8006-bac16fe74478,2022-11-18 22:56:56,completed,False,2022-11-18 23:02:41,19.058964,72.837654,19.16054,72.837654,2022-11-18 23:48:36,19.16111,72.848366,f8a67128-7264-49d7-8006-bac16fe74478,d2f9bd66-97d9-49ab-bfa2-d0c8ec2c7e2a,Sumit,Mandal,bba91f10-deb3-45f2-bfad-043f989b87c8,MH01DR6924,personal_transport,2022-11-18 22:56:56,2022-11-18 23:48:36,"10th Floor, Notan Heights, Gurunanak Rd, Patkar Blocks, Bandra West, Mumbai, Maharashtra 400050, India","129, Road No. 8, Jawahar Nagar, Goregaon West, Mumbai, Maharashtra 400104, India",16.48,completed,22,Friday
2022-11-18,215,d2f9bd66-97d9-49ab-bfa2-d0c8ec2c7e2a,bba91f10-deb3-45f2-bfad-043f989b87c8,a5a01951-8feb-4baf-b3f3-1883e4f62fe7,0c3ec0ea-8328-4b85-9370-bf560736268c,2022-11-18 23:48:51,rider_canceled,False,,19.160477,72.84824,19.107695,72.84824,,19.16048014,72.8482579,0c3ec0ea-8328-4b85-9370-bf560736268c,d2f9bd66-97d9-49ab-bfa2-d0c8ec2c7e2a,Sumit,Mandal,bba91f10-deb3-45f2-bfad-043f989b87c8,MH01DR6924,personal_transport,2022-11-18 23:48:51,0,"Orchid Enclave Cooperative Housing Society, Kavivar Pandit Indra Marg, Bamanpuri, Kanti Nagar, J B Nagar, Andheri East, Mumbai, Maharashtra 400059, India","Orchid Enclave Cooperative Housing Society, Kavivar Pandit Indra Marg, Bamanpuri, Kanti Nagar, J B Nagar, Andheri East, Mumbai, Maharashtra 400059, India",0.0,rider_cancelled,23,Friday
2022-11-18,215,d2f9bd66-97d9-49ab-bfa2-d0c8ec2c7e2a,bba91f10-deb3-45f2-bfad-043f989b87c8,a5a01951-8feb-4baf-b3f3-1883e4f62fe7,7c36f26b-acce-4239-a487-f32602a5d86b,2022-11-18 23:58:32,completed,False,2022-11-19 00:09:22,19.17433,72.84468,19.158302,72.84468,2022-11-19 02:39:49,19.15835,73.24525,7c36f26b-acce-4239-a487-f32602a5d86b,d2f9bd66-97d9-49ab-bfa2-d0c8ec2c7e2a,Sumit,Mandal,bba91f10-deb3-45f2-bfad-043f989b87c8,MH01DR6924,personal_transport,2022-11-18 23:58:32,2022-11-19 02:39:49,"19th Floor, DLH Park, Malad, Sunder Nagar, Malad West, Mumbai, Maharashtra 400064, India","Gaodevi, Badlapur, Maharashtra 421503, India",74.0,completed,23,Friday
