day_b,city_id,driver_uuid,vehicle_uuid,partner_uuid,uuid,request_timestamp_local,status,is_cash_trip,begintrip_timestamp_local,begintrip_lat,begintrip_lng,destination_lat,destination_lng,dropoff_timestamp_local,dropoff_lat,dropoff_lng,Trip UUID,Driver UUID,Driver first name,Driver surname,Vehicle UUID,Number plate,Service type,Trip request time,Trip drop-off time,Pick-up address,Drop-off address,Trip distance,Trip status,Hour,DayOfWeek
2022-11-18,215,d425a85f-bbcc-4449-b053-e4b46471c875,dcc5260b-c2e8-4dc9-a609-0cc561fea575,b3b4662c-d58d-46a3-81c1-a0a56c2a957e,651b4e38-fc89-462d-adc0-23eaf40ebe1a,2022-11-18 18:06:13,driver_canceled,True,2022-11-18 18:14:20,19.27516,72.86056,19.261963,72.86056,,19.28117442,72.8577714,651b4e38-fc89-462d-adc0-23eaf40ebe1a,d425a85f-bbcc-4449-b053-e4b46471c875,Riyaz Sayed,-,dcc5260b-c2e8-4dc9-a609-0cc561fea575,MH01DR5159,personal_transport,2022-11-18 18:06:13,0,"7VJ4+FFX, Mira Rd Skywalk, Shanti Vihar, Mira Road, Mira Bhayandar, Maharashtra 401107, India","Raunak City, Khadakpada, Kalyan, Maharashtra 421301, India",0.05,driver_cancelled,18,Friday
2022-11-18,215,d425a85f-bbcc-4449-b053-e4b46471c875,dcc5260b-c2e8-4dc9-a609-0cc561fea575,b3b4662c-d58d-46a3-81c1-a0a56c2a957e,f07f369a-2518-45db-98ec-9f05920715c8,2022-11-18 18:18:15,completed,True,2022-11-18 18:23:08,19.280872,72.85763,18.980854,72.85763,2022-11-18 20:28:44,18.982075,72.82477,f07f369a-2518-45db-98ec-9f05920715c8,d425a85f-bbcc-4449-b053-e4b46471c875,Riyaz Sayed,-,dcc5260b-c2e8-4dc9-a609-0cc561fea575,MH01DR5159,personal_transport,2022-11-18 18:18:15,2022-11-18 20:28:44,"Mira Road A-67 Shanti shopping centre, Shanti Vihar, Mira Road, Mira Bhayandar, Maharashtra 401107, India","XRJF+8XV, Vaishali Nagar, RTO Colony, Mumbai Central, Mumbai, Maharashtra 400011, India",40.61,completed,18,Friday
2022-11-18,215,d425a85f-bbcc-4449-b053-e4b46471c875,dcc5260b-c2e8-4dc9-a609-0cc561fea575,b3b4662c-d58d-46a3-81c1-a0a56c2a957e,9a2aa1ef-b1a1-4165-8b2d-d42d81ebf326,2022-11-18 20:21:49,completed,True,2022-11-18 20:38:49,18.981827,72.824646,18.949495,72.824646,2022-11-18 21:05:20,18.94962,72.82025,9a2aa1ef-b1a1-4165-8b2d-d42d81ebf326,d425a85f-bbcc-4449-b053-e4b46471c875,Riyaz Sayed,-,dcc5260b-c2e8-4dc9-a609-0cc561fea575,MH01DR5159,personal_transport,2022-11-18 20:21:49,2022-11-18 21:05:20,"Plot No.51 K. K Marg Below Mahalaxmi Station Flyover Bridge Mahalaxmi East, RTO Colony, Mumbai Central, Mumbai, Maharashtra 400011, India","47-A Near Taraporalewala Aquarium, Netaji Subhash Chandra Bose Rd, Marine Drive, Mumbai, Maharashtra 400002, India",6.67,completed,20,Friday
2022-11-18,215,d425a85f-bbcc-4449-b053-e4b46471c875,dcc5260b-c2e8-4dc9-a609-0cc561fea575,b3b4662c-d58d-46a3-81c1-a0a56c2a957e,8fed2184-15bb-4bc8-bdf4-c2aa2bc4dbe2,2022-11-18 22:18:49,completed,True,2022-11-18 22:27:55,18.926212,72.81925,19.12726,72.81925,2022-11-18 23:30:55,19.126228,72.8384,8fed2184-15bb-4bc8-bdf4-c2aa2bc4dbe2,d425a85f-bbcc-4449-b053-e4b46471c875,Riyaz Sayed,-,dcc5260b-c2e8-4dc9-a609-0cc561fea575,MH01DR5159,personal_transport,2022-11-18 22:18:49,2022-11-18 23:30:55,"Nariman Point, Mumbai, Maharashtra 400021, India","4RGP+QX6, Versova Marg, Azad Nagar, Andheri West, Mumbai, Maharashtra 400058, India",28.6,completed,22,Friday
2022-11-18,215,d425a85f-bbcc-4449-b053-e4b46471c875,dcc5260b-c2e8-4dc9-a609-0cc561fea575,b3b4662c-d58d-46a3-81c1-a0a56c2a957e,0ac2dd8c-f864-4548-91d7-8d309546e8ee,2022-11-18 23:28:58,completed,True,2022-11-18 23:40:09,19.12587,72.84681,19.099628,72.84681,2022-11-18 23:56:08,19.100103,72.875114,0ac2dd8c-f864-4548-91d7-8d309546e8ee,d425a85f-bbcc-4449-b053-e4b46471c875,Riyaz Sayed,-,dcc5260b-c2e8-4dc9-a609-0cc561fea575,MH01DR5159,personal_transport,2022-11-18 23:28:58,2022-11-18 23:56:08,"Shabnam Apartments, Bhardawadi Rd, Fish Market Area, Navneeth Colony, Andheri West, Mumbai, Maharashtra 400058, India","Terminal 2, Navpada, Vile Parle East, Vile Parle, Mumbai, Maharashtra 400099, India",7.09,completed,23,Friday
2022-11-19,215,d425a85f-bbcc-4449-b053-e4b46471c875,dcc5260b-c2e8-4dc9-a609-0cc561fea575,b3b4662c-d58d-46a3-81c1-a0a56c2a957e,3a4073ce-680c-49c2-a903-a3481e0c9251,2022-11-19 00:28:30,completed,True,2022-11-19 00:37:16,19.119484,72.86366,19.27343,72.86366,2022-11-19 01:24:15,19.274353,72.87211,3a4073ce-680c-49c2-a903-a3481e0c9251,d425a85f-bbcc-4449-b053-e4b46471c875,Riyaz Sayed,-,dcc5260b-c2e8-4dc9-a609-0cc561fea575,MH01DR5159,personal_transport,2022-11-19 00:28:30,2022-11-19 01:24:15,"Mahakali Caves Rd, Shanti Nagar, Andheri East, Mumbai, Maharashtra 400093, India","Prem Nagar Complex,Prem Nagar road, Shanti Gardens Rd, near MHADA, Gaurav Galaxy, Mira Road, Mira Bhayandar, Maharashtra 401107, India",20.79,completed,0,Saturday
