day_b,city_id,driver_uuid,vehicle_uuid,partner_uuid,uuid,request_timestamp_local,status,is_cash_trip,begintrip_timestamp_local,begintrip_lat,begintrip_lng,destination_lat,destination_lng,dropoff_timestamp_local,dropoff_lat,dropoff_lng,Trip UUID,Driver UUID,Driver first name,Driver surname,Vehicle UUID,Number plate,Service type,Trip request time,Trip drop-off time,Pick-up address,Drop-off address,Trip distance,Trip status,Hour,DayOfWeek
2022-11-18,215,df8f63b6-903e-42df-9d00-6d0db861d585,ebfd1bfc-67cb-4230-929f-ef8d2360f8b9,41c9e90e-1d2c-4e4f-9f03-6e4bc89ac58c,ae9e099b-aff2-442a-9038-396cd03641e6,2022-11-18 06:38:32,completed,True,2022-11-18 06:48:46,19.033583,72.84494,19.017569,72.84494,2022-11-18 06:58:59,19.017805,72.8443,ae9e099b-aff2-442a-9038-396cd03641e6,df8f63b6-903e-42df-9d00-6d0db861d585,AMAR,KASHMIRI,ebfd1bfc-67cb-4230-929f-ef8d2360f8b9,MH01DR8571,personal_transport,2022-11-18 06:38:32,2022-11-18 06:58:59,"252, Chatrapati Shivaji Maharaj Marg, VSNL Colony, Mahim, Mumbai, Maharashtra 400016, India","railway station, Dadar East, Dadar, Mumbai, Maharashtra 400014, India",2.64,completed,6,Friday
2022-11-18,215,df8f63b6-903e-42df-9d00-6d0db861d585,ebfd1bfc-67cb-4230-929f-ef8d2360f8b9,41c9e90e-1d2c-4e4f-9f03-6e4bc89ac58c,035c9594-e97b-49de-9616-69173056b6d8,2022-11-18 06:58:41,completed,False,2022-11-18 07:08:53,19.004522,72.83893,18.959673,72.83893,2022-11-18 07:26:03,18.9597,72.8156,035c9594-e97b-49de-9616-69173056b6d8,df8f63b6-903e-42df-9d00-6d0db861d585,AMAR,KASHMIRI,ebfd1bfc-67cb-4230-929f-ef8d2360f8b9,MH01DR8571,personal_transport,2022-11-18 06:58:41,2022-11-18 07:26:03,"Rudra Heights, Dr Baba Saheb Ambedkar Rd, Krishna Nagar, Parel, Mumbai, Maharashtra 400012, India","Robert Money School Compound, Wadilal A, XR58+X5V, Vithalbhai Patel Rd, next to Queen Mary School, Grant Road East, Shapur Baug, Girgaon, Mumbai, Maharashtra 400007, India",7.0,completed,6,Friday
2022-11-18,215,df8f63b6-903e-42df-9d00-6d0db861d585,ebfd1bfc-67cb-4230-929f-ef8d2360f8b9,41c9e90e-1d2c-4e4f-9f03-6e4bc89ac58c,ccbc0689-a439-4e6d-b978-50b28680796b,2022-11-18 18:23:25,completed,True,2022-11-18 18:35:16,18.963137,72.82314,18.953928,72.82314,2022-11-18 19:03:56,18.953766,72.83349,ccbc0689-a439-4e6d-b978-50b28680796b,df8f63b6-903e-42df-9d00-6d0db861d585,AMAR,KASHMIRI,ebfd1bfc-67cb-4230-929f-ef8d2360f8b9,MH01DR8571,personal_transport,2022-11-18 18:23:25,2022-11-18 19:03:56,"Crystal Tower, Arab Lane, M T Ansari Rd, Navjeevan Society, Kamathipura, Mumbai, Maharashtra 400008, India","49, Mohammed Ali Road near Masjid Bunder, Nakhuda Mohalla, Pydhonie, Mandvi, Mumbai, Maharashtra 400003, India",1.85,completed,18,Friday
2022-11-18,215,df8f63b6-903e-42df-9d00-6d0db861d585,ebfd1bfc-67cb-4230-929f-ef8d2360f8b9,41c9e90e-1d2c-4e4f-9f03-6e4bc89ac58c,22d541fa-0e50-41a7-bcff-475839b71fb1,2022-11-18 18:36:51,rider_canceled,True,,18.958458,72.82594,18.993952,72.82594,,18.95839894,72.82599711,22d541fa-0e50-41a7-bcff-475839b71fb1,df8f63b6-903e-42df-9d00-6d0db861d585,AMAR,KASHMIRI,ebfd1bfc-67cb-4230-929f-ef8d2360f8b9,MH01DR8571,personal_transport,2022-11-18 18:36:51,0,"462, Senapati Bapat Marg, Lower Parel, Mumbai, Maharashtra 400013, India","462, Senapati Bapat Marg, Lower Parel, Mumbai, Maharashtra 400013, India",0.0,rider_cancelled,18,Friday
2022-11-18,215,df8f63b6-903e-42df-9d00-6d0db861d585,ebfd1bfc-67cb-4230-929f-ef8d2360f8b9,41c9e90e-1d2c-4e4f-9f03-6e4bc89ac58c,288fb46b-c6bd-4242-b81c-16242139277c,2022-11-18 18:46:58,completed,False,2022-11-18 19:07:31,18.953081,72.83443,18.975906,72.83443,2022-11-18 19:26:55,18.975994,72.83408,288fb46b-c6bd-4242-b81c-16242139277c,df8f63b6-903e-42df-9d00-6d0db861d585,AMAR,KASHMIRI,ebfd1bfc-67cb-4230-929f-ef8d2360f8b9,MH01DR8571,personal_transport,2022-11-18 18:46:58,2022-11-18 19:26:55,"Zakeria Masjid St, Pydhonie, Mandvi, Mumbai, Maharashtra 400009, India","Sant Savata Mali Marg, opp. Gloria Church, Byculla East, Byculla, Mumbai, Maharashtra 400027, India",4.53,completed,18,Friday
2022-11-18,215,df8f63b6-903e-42df-9d00-6d0db861d585,ebfd1bfc-67cb-4230-929f-ef8d2360f8b9,41c9e90e-1d2c-4e4f-9f03-6e4bc89ac58c,e8175d7a-da10-4c68-b081-6cd6e7022057,2022-11-18 19:13:54,completed,True,2022-11-18 19:33:36,18.975653,72.83451,19.18381,72.83451,2022-11-18 21:07:32,19.183771,73.02251,e8175d7a-da10-4c68-b081-6cd6e7022057,df8f63b6-903e-42df-9d00-6d0db861d585,AMAR,KASHMIRI,ebfd1bfc-67cb-4230-929f-ef8d2360f8b9,MH01DR8571,personal_transport,2022-11-18 19:13:54,2022-11-18 21:07:32,"130, Sant Savta Marg 3, near Gloria Church, Byculla East, Byculla, Mumbai, Maharashtra 400027, India","Mumbai - Pune Rd, 52PF+2G2, Dr Syedna Mohammed Burhanuddin Marg, Zainy Colony, Anand Koliwada, Mumbra, Thane, Maharashtra 400612, India",45.13,completed,19,Friday
2022-11-18,215,df8f63b6-903e-42df-9d00-6d0db861d585,ebfd1bfc-67cb-4230-929f-ef8d2360f8b9,41c9e90e-1d2c-4e4f-9f03-6e4bc89ac58c,e11917ae-c179-4898-b4e2-1e09e7a8a259,2022-11-18 21:58:24,completed,True,2022-11-18 22:16:06,19.18566,73.021286,19.340261,73.021286,2022-11-18 23:13:17,19.340324,73.11524,e11917ae-c179-4898-b4e2-1e09e7a8a259,df8f63b6-903e-42df-9d00-6d0db861d585,AMAR,KASHMIRI,ebfd1bfc-67cb-4230-929f-ef8d2360f8b9,MH01DR8571,personal_transport,2022-11-18 21:58:24,2022-11-18 23:13:17,"Thakurpada, Ilthan, Mumbra, Thane, Maharashtra 400612, India","Mumbai Nasik Hgih, National Highway No. 3, Near Police Station, Vadape, Bypass, Bhiwandi, Maharashtra 421302, India",24.35,completed,21,Friday
