day_b,city_id,driver_uuid,vehicle_uuid,partner_uuid,uuid,request_timestamp_local,status,is_cash_trip,begintrip_timestamp_local,begintrip_lat,begintrip_lng,destination_lat,destination_lng,dropoff_timestamp_local,dropoff_lat,dropoff_lng,Trip UUID,Driver UUID,Driver first name,Driver surname,Vehicle UUID,Number plate,Service type,Trip request time,Trip drop-off time,Pick-up address,Drop-off address,Trip distance,Trip status,Hour,DayOfWeek
2022-11-18,215,e969ae59-693e-4fa3-8fd6-13325edbe76a,f042a22a-ce50-4ee0-b229-f65bf7430c4e,8b20931b-0c97-4b92-88a5-ddb8bb08bd0e,8b8736f9-dc7c-4ce2-914d-d2f255ce1982,2022-11-18 08:34:24,completed,False,2022-11-18 08:44:08,19.020359,72.83015,19.155117,72.83015,2022-11-18 09:16:52,19.153955,72.85389,8b8736f9-dc7c-4ce2-914d-d2f255ce1982,e969ae59-693e-4fa3-8fd6-13325edbe76a,MOHD,ASIM,f042a22a-ce50-4ee0-b229-f65bf7430c4e,MH01CV2172,personal_transport,2022-11-18 08:34:24,2022-11-18 09:16:52,"27, Kashinath Dhuru Marg, Prabhadevi, Mumbai, Maharashtra 400025, India","Pahadi Village, Off. The Western Express Highway, Cama Industrial Estate, Goregaon(E), Mumbai, Maharashtra 400063, India",17.45,completed,8,Friday
2022-11-18,215,e969ae59-693e-4fa3-8fd6-13325edbe76a,f042a22a-ce50-4ee0-b229-f65bf7430c4e,8b20931b-0c97-4b92-88a5-ddb8bb08bd0e,ce7f78f2-2d8a-4bfe-a56b-97a65d67dd9c,2022-11-18 09:09:40,rider_canceled,False,,19.151482,72.856384,19.06705,72.856384,,19.15331757,72.85461295,ce7f78f2-2d8a-4bfe-a56b-97a65d67dd9c,e969ae59-693e-4fa3-8fd6-13325edbe76a,MOHD,ASIM,f042a22a-ce50-4ee0-b229-f65bf7430c4e,MH01CV2172,personal_transport,2022-11-18 09:09:40,0,"Vibgyor Towers, 4, Plot C, 62, Bandra Kurla Complex Rd, G Block, Bandra Kurla Complex, Bandra East, Mumbai, Maharashtra 400051, India","Vibgyor Towers, 4, Plot C, 62, Bandra Kurla Complex Rd, G Block, Bandra Kurla Complex, Bandra East, Mumbai, Maharashtra 400051, India",0.0,rider_cancelled,9,Friday
2022-11-18,215,e969ae59-693e-4fa3-8fd6-13325edbe76a,f042a22a-ce50-4ee0-b229-f65bf7430c4e,8b20931b-0c97-4b92-88a5-ddb8bb08bd0e,79585bb6-a781-42c3-bbf2-590d2b4e27ac,2022-11-18 09:20:04,rider_canceled,False,,19.152859,72.85106,19.069706,72.85106,,19.15312433,72.84346581,79585bb6-a781-42c3-bbf2-590d2b4e27ac,e969ae59-693e-4fa3-8fd6-13325edbe76a,MOHD,ASIM,f042a22a-ce50-4ee0-b229-f65bf7430c4e,MH01CV2172,personal_transport,2022-11-18 09:20:04,0,"J.P. Morgan Tower, Off, CST Road, Kolivery Village, MMRDA Area, Kalina, Santacruz East, Mumbai, Maharashtra 400098, India","J.P. Morgan Tower, Off, CST Road, Kolivery Village, MMRDA Area, Kalina, Santacruz East, Mumbai, Maharashtra 400098, India",0.0,rider_cancelled,9,Friday
2022-11-18,215,e969ae59-693e-4fa3-8fd6-13325edbe76a,f042a22a-ce50-4ee0-b229-f65bf7430c4e,8b20931b-0c97-4b92-88a5-ddb8bb08bd0e,a6cd4a75-3efc-4278-a80f-ad3323070e25,2022-11-18 09:33:02,completed,False,2022-11-18 09:41:41,19.150734,72.848526,19.177248,72.848526,2022-11-18 10:08:39,19.176975,72.88205,a6cd4a75-3efc-4278-a80f-ad3323070e25,e969ae59-693e-4fa3-8fd6-13325edbe76a,MOHD,ASIM,f042a22a-ce50-4ee0-b229-f65bf7430c4e,MH01CV2172,personal_transport,2022-11-18 09:33:02,2022-11-18 10:08:39,"Apartment, Sejal Kajal Apartments, Ram Mandir Rd, Somani Gram, Goregaon West, Mumbai, Maharashtra 400104, India","Infinity IT Park Rd, Malad, Raheja Housing and Commercial Complex, Sankalp Colony, Malad East, Mumbai, Maharashtra 400065, India",6.28,completed,9,Friday
2022-11-18,215,e969ae59-693e-4fa3-8fd6-13325edbe76a,f042a22a-ce50-4ee0-b229-f65bf7430c4e,8b20931b-0c97-4b92-88a5-ddb8bb08bd0e,2d06b159-813e-41e5-a45a-f6c3d6cc3d7b,2022-11-18 09:53:22,rider_canceled,False,,19.17399,72.85923,19.050299,72.85923,,19.17399001,72.8592267,2d06b159-813e-41e5-a45a-f6c3d6cc3d7b,e969ae59-693e-4fa3-8fd6-13325edbe76a,MOHD,ASIM,f042a22a-ce50-4ee0-b229-f65bf7430c4e,MH01CV2172,personal_transport,2022-11-18 09:53:22,0,"301, C wing , Godrej Coliseum, GTB Nagar, Lalbaug, Everard Nagar, Sion, Mumbai, Maharashtra 400022, India","301, C wing , Godrej Coliseum, GTB Nagar, Lalbaug, Everard Nagar, Sion, Mumbai, Maharashtra 400022, India",0.0,rider_cancelled,9,Friday
2022-11-18,215,e969ae59-693e-4fa3-8fd6-13325edbe76a,f042a22a-ce50-4ee0-b229-f65bf7430c4e,8b20931b-0c97-4b92-88a5-ddb8bb08bd0e,e48c74e4-0818-44f5-a341-f029b996fbc7,2022-11-18 09:56:00,rider_canceled,False,,19.175306,72.86435,19.057974,72.86435,,19.17559004,72.86558831,e48c74e4-0818-44f5-a341-f029b996fbc7,e969ae59-693e-4fa3-8fd6-13325edbe76a,MOHD,ASIM,f042a22a-ce50-4ee0-b229-f65bf7430c4e,MH01CV2172,personal_transport,2022-11-18 09:56:00,0,"Store No. 1, CHS, Rizvi Mahal, Waterfield Road, near Bhabha Hospital, Bandra West, W, Maharashtra 400050, India","Store No. 1, CHS, Rizvi Mahal, Waterfield Road, near Bhabha Hospital, Bandra West, W, Maharashtra 400050, India",0.0,rider_cancelled,9,Friday
