day_b,city_id,driver_uuid,vehicle_uuid,partner_uuid,uuid,request_timestamp_local,status,is_cash_trip,begintrip_timestamp_local,begintrip_lat,begintrip_lng,destination_lat,destination_lng,dropoff_timestamp_local,dropoff_lat,dropoff_lng,Trip UUID,Driver UUID,Driver first name,Driver surname,Vehicle UUID,Number plate,Service type,Trip request time,Trip drop-off time,Pick-up address,Drop-off address,Trip distance,Trip status,Hour,DayOfWeek
2022-11-18,215,e975ae6e-6faa-419c-b1b0-6de08172dbbf,d50ce91c-452f-4c1d-bf83-37579fa3b4ff,517e1bbb-df7d-4280-a71c-d26ebfe12173,93c1ba3b-e3cd-4278-a7f0-65f43f8a4ce4,2022-11-18 06:03:08,completed,False,2022-11-18 06:14:34,19.042858,72.86688,19.099628,72.86688,2022-11-18 06:35:36,19.099627,72.8742,93c1ba3b-e3cd-4278-a7f0-65f43f8a4ce4,e975ae6e-6faa-419c-b1b0-6de08172dbbf,Kalendarkumar Jaiswal,-,d50ce91c-452f-4c1d-bf83-37579fa3b4ff,MH01EE0734,personal_transport,2022-11-18 06:03:08,2022-11-18 06:35:36,"Road No. 29, Opp, Air Force Quarters, Sion East, Sion, Mumbai, Maharashtra 400022, India","Terminal 2, Navpada, Vile Parle East, Vile Parle, Mumbai, Maharashtra 400099, India",12.27,completed,6,Friday
2022-11-18,215,e975ae6e-6faa-419c-b1b0-6de08172dbbf,d50ce91c-452f-4c1d-bf83-37579fa3b4ff,517e1bbb-df7d-4280-a71c-d26ebfe12173,50c6589e-96bf-4d68-ab37-bff7678f884c,2022-11-18 08:08:38,rider_canceled,False,,19.149837,72.854744,19.152573,72.854744,,19.1558789,72.85646713,50c6589e-96bf-4d68-ab37-bff7678f884c,e975ae6e-6faa-419c-b1b0-6de08172dbbf,Kalendarkumar Jaiswal,-,d50ce91c-452f-4c1d-bf83-37579fa3b4ff,MH01EE0734,personal_transport,2022-11-18 08:08:38,0,"NESCO IT Park, NH 8, NESCO, Goregaon, Mumbai, Maharashtra 400063, India","NESCO IT Park, NH 8, NESCO, Goregaon, Mumbai, Maharashtra 400063, India",0.0,rider_cancelled,8,Friday
2022-11-18,215,e975ae6e-6faa-419c-b1b0-6de08172dbbf,d50ce91c-452f-4c1d-bf83-37579fa3b4ff,517e1bbb-df7d-4280-a71c-d26ebfe12173,5c55a517-7d2f-48c1-8931-796e05dd0b62,2022-11-18 08:10:23,completed,True,2022-11-18 08:14:31,19.125664,72.84701,19.150578,72.84701,2022-11-18 08:30:20,19.149233,72.8546,5c55a517-7d2f-48c1-8931-796e05dd0b62,e975ae6e-6faa-419c-b1b0-6de08172dbbf,Kalendarkumar Jaiswal,-,d50ce91c-452f-4c1d-bf83-37579fa3b4ff,MH01EE0734,personal_transport,2022-11-18 08:10:23,2022-11-18 08:30:20,"332, Chunawala Plaza, 1st Floor, S.V. Road, Near, Andheri Subway, opp. Reliance Digital, Fish Market Area, Navneeth Colony, Andheri West, W, Maharashtra 400058, India","Bombay Exhibition Centre, NESCO, Goregaon, Mumbai, Maharashtra 400063, India",3.91,completed,8,Friday
2022-11-18,215,e975ae6e-6faa-419c-b1b0-6de08172dbbf,d50ce91c-452f-4c1d-bf83-37579fa3b4ff,517e1bbb-df7d-4280-a71c-d26ebfe12173,fccaf6ab-22d0-4ac9-9137-fad275eea15b,2022-11-18 08:51:20,rider_canceled,True,,19.158276,72.85663,19.19514,72.85663,,19.1582762,72.85663176,fccaf6ab-22d0-4ac9-9137-fad275eea15b,e975ae6e-6faa-419c-b1b0-6de08172dbbf,Kalendarkumar Jaiswal,-,d50ce91c-452f-4c1d-bf83-37579fa3b4ff,MH01EE0734,personal_transport,2022-11-18 08:51:20,0,"Akurli Road, after mahindra factory lokhandwala township next to centrium mall, 5VWC+4VF, Kandivali, Alika Nagar, Gokul Nagar, Kandivali East, Mumbai, Maharashtra 400101, India","Akurli Road, after mahindra factory lokhandwala township next to centrium mall, 5VWC+4VF, Kandivali, Alika Nagar, Gokul Nagar, Kandivali East, Mumbai, Maharashtra 400101, India",0.0,rider_cancelled,8,Friday
2022-11-18,215,e975ae6e-6faa-419c-b1b0-6de08172dbbf,d50ce91c-452f-4c1d-bf83-37579fa3b4ff,517e1bbb-df7d-4280-a71c-d26ebfe12173,d03e5030-4d08-4b1c-a2be-ef5ad1552790,2022-11-18 09:35:33,completed,True,2022-11-18 09:51:43,19.187586,72.84485,19.211227,72.84485,2022-11-18 10:09:53,19.211214,72.84736,d03e5030-4d08-4b1c-a2be-ef5ad1552790,e975ae6e-6faa-419c-b1b0-6de08172dbbf,Kalendarkumar Jaiswal,-,d50ce91c-452f-4c1d-bf83-37579fa3b4ff,MH01EE0734,personal_transport,2022-11-18 09:35:33,2022-11-18 10:09:53,"Mamletdar Wadi Rd No 2, Near Mahavir Clinic, near Utkarsh Mandir School, Malad, Navy Colony, Mamledarwadi, Malad West, Mumbai, Maharashtra 400064, India","MG road no. 1, school, near swami vivekanand, Kandivali, Parekh Nagar, Kandivali West, Mumbai, Maharashtra 400067, India",4.08,completed,9,Friday
2022-11-18,215,e975ae6e-6faa-419c-b1b0-6de08172dbbf,d50ce91c-452f-4c1d-bf83-37579fa3b4ff,517e1bbb-df7d-4280-a71c-d26ebfe12173,542a2513-28ed-496d-8989-09f7c6c440e2,2022-11-18 10:19:30,completed,False,2022-11-18 10:37:21,19.20654,72.83806,19.220173,72.83806,2022-11-18 10:45:57,19.219479,72.840034,542a2513-28ed-496d-8989-09f7c6c440e2,e975ae6e-6faa-419c-b1b0-6de08172dbbf,Kalendarkumar Jaiswal,-,d50ce91c-452f-4c1d-bf83-37579fa3b4ff,MH01EE0734,personal_transport,2022-11-18 10:19:30,2022-11-18 10:45:57,"601,Manek Apartment,Off M.G. Road,Dahanukar wadi,Kandivali west, Kandivali, Hemu Colony, Bhagat Colony, Kandivali West, Mumbai, Maharashtra 400067, India","Padma Nagar, Borivali West, Mumbai, Maharashtra 400092, India",2.07,completed,10,Friday
2022-11-18,215,e975ae6e-6faa-419c-b1b0-6de08172dbbf,d50ce91c-452f-4c1d-bf83-37579fa3b4ff,517e1bbb-df7d-4280-a71c-d26ebfe12173,2cf9e349-0c52-44a4-b84a-bbef7a21b1d5,2022-11-18 10:46:08,completed,True,2022-11-18 11:02:05,19.211142,72.82077,19.29548,72.82077,2022-11-18 11:47:56,19.29555,72.866486,2cf9e349-0c52-44a4-b84a-bbef7a21b1d5,e975ae6e-6faa-419c-b1b0-6de08172dbbf,Kalendarkumar Jaiswal,-,d50ce91c-452f-4c1d-bf83-37579fa3b4ff,MH01EE0734,personal_transport,2022-11-18 10:46:08,2022-11-18 11:47:56,"AARATHI CHS, Cluster_mumbai Suburban_273, RSC Rd Number 3, Anand Bhuvan Society, Charkop, Sector 2 Charkop, Kandivali West, Mumbai, Maharashtra 400067, India","MJM House, Mercy Nagar Off Ramdev Park Landmark:, behind Seven Square Academy, Medetiya Nagar, Queens Park, Mira Road, Thane, Maharashtra 401107, India",13.87,completed,10,Friday
