day_b,city_id,driver_uuid,vehicle_uuid,partner_uuid,uuid,request_timestamp_local,status,is_cash_trip,begintrip_timestamp_local,begintrip_lat,begintrip_lng,destination_lat,destination_lng,dropoff_timestamp_local,dropoff_lat,dropoff_lng,Trip UUID,Driver UUID,Driver first name,Driver surname,Vehicle UUID,Number plate,Service type,Trip request time,Trip drop-off time,Pick-up address,Drop-off address,Trip distance,Trip status,Hour,DayOfWeek
2022-11-18,215,f3cfb111-e636-4737-b7dd-9bb14fddbd8d,1a7762b9-a8e8-4b5c-a0c6-7c42eaff241a,a5a01951-8feb-4baf-b3f3-1883e4f62fe7,9d3199ee-7b10-4395-a161-c60696d1a777,2022-11-18 15:02:26,completed,False,2022-11-18 15:19:06,19.242111,72.969894,19.09913,72.969894,2022-11-18 16:26:41,19.099333,72.91684,9d3199ee-7b10-4395-a161-c60696d1a777,f3cfb111-e636-4737-b7dd-9bb14fddbd8d,Tukaram,Chavan,1a7762b9-a8e8-4b5c-a0c6-7c42eaff241a,MH01DR2544,personal_transport,2022-11-18 15:02:26,2022-11-18 16:26:41,"6XV9+3R9, Patlipada, Thane West, Thane, Maharashtra 400607, India","Lal Bahadur Shastri Rd, Amrut Nagar, Ghatkopar West, Mumbai, Maharashtra 400086, India",20.29,completed,15,Friday
2022-11-18,215,f3cfb111-e636-4737-b7dd-9bb14fddbd8d,1a7762b9-a8e8-4b5c-a0c6-7c42eaff241a,a5a01951-8feb-4baf-b3f3-1883e4f62fe7,4c3d0eb7-2849-4761-9d17-fcc39097bfef,2022-11-18 16:18:51,completed,False,2022-11-18 16:27:10,19.09929,72.91689,19.099628,72.91689,2022-11-18 17:02:45,19.099508,72.874985,4c3d0eb7-2849-4761-9d17-fcc39097bfef,f3cfb111-e636-4737-b7dd-9bb14fddbd8d,Tukaram,Chavan,1a7762b9-a8e8-4b5c-a0c6-7c42eaff241a,MH01DR2544,personal_transport,2022-11-18 16:18:51,2022-11-18 17:02:45,"R-City Mall, Ghatkopar","Terminal 2, Navpada, Vile Parle East, Vile Parle, Mumbai, Maharashtra 400099, India",7.46,completed,16,Friday
2022-11-18,215,f3cfb111-e636-4737-b7dd-9bb14fddbd8d,1a7762b9-a8e8-4b5c-a0c6-7c42eaff241a,a5a01951-8feb-4baf-b3f3-1883e4f62fe7,75c33c02-949c-483e-9207-a32a8f8f8287,2022-11-18 17:51:20,completed,False,2022-11-18 17:55:25,19.109842,72.87455,19.131512,72.87455,2022-11-18 18:51:28,19.131624,72.93325,75c33c02-949c-483e-9207-a32a8f8f8287,f3cfb111-e636-4737-b7dd-9bb14fddbd8d,Tukaram,Chavan,1a7762b9-a8e8-4b5c-a0c6-7c42eaff241a,MH01DR2544,personal_transport,2022-11-18 17:51:20,2022-11-18 18:51:28,"3rd Floor, The Leela Galleria, Opposite Airport Road Metro Station, Andheri - Kurla Rd, Mariyyman Nagar, Greater Indra Nagar, Andheri East, Mumbai, Maharashtra 400059, India","4, Junction of Seth Govind Ram Jolly Marg, &, Kanjur Village Rd, Saikrupa Society, Indira Nagar, Kanjurmarg East, Mumbai, Maharashtra 400042, India",10.94,completed,17,Friday
2022-11-18,215,f3cfb111-e636-4737-b7dd-9bb14fddbd8d,1a7762b9-a8e8-4b5c-a0c6-7c42eaff241a,a5a01951-8feb-4baf-b3f3-1883e4f62fe7,eb615446-72a2-42f5-a6ff-0a05055af4ca,2022-11-18 18:53:15,completed,False,2022-11-18 19:03:35,19.129389,72.93108,19.164503,72.93108,2022-11-18 19:41:47,19.164522,72.99136,eb615446-72a2-42f5-a6ff-0a05055af4ca,f3cfb111-e636-4737-b7dd-9bb14fddbd8d,Tukaram,Chavan,1a7762b9-a8e8-4b5c-a0c6-7c42eaff241a,MH01DR2544,personal_transport,2022-11-18 18:53:15,2022-11-18 19:41:47,"Kanjurmarg Station Rd, Nehru Nagar, Kanjurmarg East, Mumbai, Maharashtra 400042, India","Prasad Building, Gaothan Sector 20 Airoli Rd, Sector 20 B, Sector 20, Airoli, Navi Mumbai, Maharashtra 400708, India",11.03,completed,18,Friday
2022-11-18,215,f3cfb111-e636-4737-b7dd-9bb14fddbd8d,1a7762b9-a8e8-4b5c-a0c6-7c42eaff241a,a5a01951-8feb-4baf-b3f3-1883e4f62fe7,c8a9deb7-c2cf-4723-b3f6-a304fe0ebff2,2022-11-18 19:47:59,rider_canceled,False,,19.160015,72.99039,19.215622,72.99039,,19.16001105,72.99038303,c8a9deb7-c2cf-4723-b3f6-a304fe0ebff2,f3cfb111-e636-4737-b7dd-9bb14fddbd8d,Tukaram,Chavan,1a7762b9-a8e8-4b5c-a0c6-7c42eaff241a,MH01DR2544,personal_transport,2022-11-18 19:47:59,0,"Wing-F, SHIVSAI PARADISE, Samata Nagar, Sainath Nagar, Majiwada, Thane, Maharashtra 400601, India","Wing-F, SHIVSAI PARADISE, Samata Nagar, Sainath Nagar, Majiwada, Thane, Maharashtra 400601, India",0.0,rider_cancelled,19,Friday
2022-11-18,215,f3cfb111-e636-4737-b7dd-9bb14fddbd8d,1a7762b9-a8e8-4b5c-a0c6-7c42eaff241a,a5a01951-8feb-4baf-b3f3-1883e4f62fe7,a0f40831-1403-48eb-afca-16eba9860630,2022-11-18 19:49:10,completed,False,2022-11-18 20:03:06,19.168951,73.0012,19.225147,73.0012,2022-11-18 20:43:15,19.225157,72.963455,a0f40831-1403-48eb-afca-16eba9860630,f3cfb111-e636-4737-b7dd-9bb14fddbd8d,Tukaram,Chavan,1a7762b9-a8e8-4b5c-a0c6-7c42eaff241a,MH01DR2544,personal_transport,2022-11-18 19:49:10,2022-11-18 20:43:15,"RELIABLE TECH PARK, गवते वाडी, MIDC, दिघे, नवी मुंबई, महाराष्ट्र 400708, India","Siddhachal Housing Society, Pawar Nagar, Thane West, Thane, Maharashtra 400610, India",9.21,completed,19,Friday
