day_b,city_id,driver_uuid,vehicle_uuid,partner_uuid,uuid,request_timestamp_local,status,is_cash_trip,begintrip_timestamp_local,begintrip_lat,begintrip_lng,destination_lat,destination_lng,dropoff_timestamp_local,dropoff_lat,dropoff_lng,Trip UUID,Driver UUID,Driver first name,Driver surname,Vehicle UUID,Number plate,Service type,Trip request time,Trip drop-off time,Pick-up address,Drop-off address,Trip distance,Trip status,Hour,DayOfWeek
2022-11-18,215,f55e0e7f-9188-49bb-8f4e-22d231366a19,148999b7-b1e0-4348-a433-deb402216df3,517e1bbb-df7d-4280-a71c-d26ebfe12173,4d5907c9-0a15-471b-abb8-6bd701e5d973,2022-11-18 23:04:51,completed,True,2022-11-18 23:12:23,19.28781,72.86602,19.306255,72.86602,2022-11-18 23:21:56,19.306133,72.857155,4d5907c9-0a15-471b-abb8-6bd701e5d973,f55e0e7f-9188-49bb-8f4e-22d231366a19,PARESH N SUTAR,-,148999b7-b1e0-4348-a433-deb402216df3,MH01EE1815,personal_transport,2022-11-18 23:04:51,2022-11-18 23:21:56,"First Floor, Chandan Valley, Mira Bhayandar Road, Mira Road E, near Brahmdev Mandir, Bharti Nagar, Mira Road, Mira Bhayandar, Maharashtra 401107, India","Shiv, 1st Floor, Shraddha Complex, BP Rd, Bhayandar, Parshwanath Jain Colony, Shalibhadra Nagar, Bhayandar East, Mira Bhayandar, Maharashtra 401105, India",2.85,completed,23,Friday
2022-11-19,215,f55e0e7f-9188-49bb-8f4e-22d231366a19,148999b7-b1e0-4348-a433-deb402216df3,517e1bbb-df7d-4280-a71c-d26ebfe12173,79634451-a383-4032-94b2-c37cf2fec600,2022-11-19 00:18:56,completed,False,2022-11-19 00:22:52,19.29063,72.863144,19.283781,72.863144,2022-11-19 00:48:50,19.28372,72.785194,79634451-a383-4032-94b2-c37cf2fec600,f55e0e7f-9188-49bb-8f4e-22d231366a19,PARESH N SUTAR,-,148999b7-b1e0-4348-a433-deb402216df3,MH01EE1815,personal_transport,2022-11-19 00:18:56,2022-11-19 00:48:50,"C 43-44, 2nd floor, gandhi complex, shankar nagar, noida - 201301, Parshwa Nagar, Geeta Nagar, Mira Road, Mira Bhayandar, Maharashtra 401107, India","Uttan Beach, Pali Chowk Rd, Dongri, Uttan, Mira Bhayandar, Maharashtra 401106, India",11.13,completed,0,Saturday
2022-11-19,215,f55e0e7f-9188-49bb-8f4e-22d231366a19,148999b7-b1e0-4348-a433-deb402216df3,517e1bbb-df7d-4280-a71c-d26ebfe12173,5bba11ba-c5cd-49eb-9de3-039f01972c6a,2022-11-19 00:57:13,completed,False,2022-11-19 01:03:17,19.279228,72.796364,19.045965,72.796364,2022-11-19 03:04:46,18.961584,72.82777,5bba11ba-c5cd-49eb-9de3-039f01972c6a,f55e0e7f-9188-49bb-8f4e-22d231366a19,PARESH N SUTAR,-,148999b7-b1e0-4348-a433-deb402216df3,MH01EE1815,personal_transport,2022-11-19 00:57:13,2022-11-19 03:04:46,"Dongri, Uttan, Mira Bhayandar, Maharashtra 401106, India","SS Maharaj Marg, Kumbharwada, Mumbai, Maharashtra 400004, India",58.36,completed,0,Saturday
2022-11-19,215,f55e0e7f-9188-49bb-8f4e-22d231366a19,148999b7-b1e0-4348-a433-deb402216df3,517e1bbb-df7d-4280-a71c-d26ebfe12173,e9a24a33-2bc9-46bc-bd53-53907ab04434,2022-11-19 03:12:51,completed,True,2022-11-19 03:20:31,18.95974,72.8172,19.149292,72.8172,2022-11-19 03:57:23,19.14828,72.94631,e9a24a33-2bc9-46bc-bd53-53907ab04434,f55e0e7f-9188-49bb-8f4e-22d231366a19,PARESH N SUTAR,-,148999b7-b1e0-4348-a433-deb402216df3,MH01EE1815,personal_transport,2022-11-19 03:12:51,2022-11-19 03:57:23,"7, Shamrao Vittal Ln, Krishna Kunj, Grant Road East, Shapur Baug, Girgaon, Mumbai, Maharashtra 400007, India","Friends Colony, Bhandup East, Mumbai, Maharashtra, India",27.58,completed,3,Saturday
2022-11-19,215,f55e0e7f-9188-49bb-8f4e-22d231366a19,148999b7-b1e0-4348-a433-deb402216df3,517e1bbb-df7d-4280-a71c-d26ebfe12173,07940418-5c5a-45e8-98bc-7a2c6f2351af,2022-11-19 03:19:52,driver_canceled,False,,19.148258,72.94631,19.121655,72.94631,,19.13417745,72.93658888,07940418-5c5a-45e8-98bc-7a2c6f2351af,f55e0e7f-9188-49bb-8f4e-22d231366a19,PARESH N SUTAR,-,148999b7-b1e0-4348-a433-deb402216df3,MH01EE1815,personal_transport,2022-11-19 03:19:52,0,"Plot no 613, Near Andheri Metro station-Exit Gate No 1, Andheri, Sai Baba Wadi, Natwar Nagar, Jogeshwari East, Mumbai, Maharashtra 400069, India","Plot no 613, Near Andheri Metro station-Exit Gate No 1, Andheri, Sai Baba Wadi, Natwar Nagar, Jogeshwari East, Mumbai, Maharashtra 400069, India",0.0,driver_cancelled,3,Saturday
