day_b,city_id,driver_uuid,vehicle_uuid,partner_uuid,uuid,request_timestamp_local,status,is_cash_trip,begintrip_timestamp_local,begintrip_lat,begintrip_lng,destination_lat,destination_lng,dropoff_timestamp_local,dropoff_lat,dropoff_lng,Trip UUID,Driver UUID,Driver first name,Driver surname,Vehicle UUID,Number plate,Service type,Trip request time,Trip drop-off time,Pick-up address,Drop-off address,Trip distance,Trip status,Hour,DayOfWeek
2022-11-18,215,f801b179-c4ca-40ce-b957-fdfb8bce8313,045479d4-754b-4b68-b51b-50ff5d9202a3,8b20931b-0c97-4b92-88a5-ddb8bb08bd0e,8fa00633-8099-485b-a693-a1295a37247f,2022-11-18 05:58:11,rider_canceled,True,,19.085018,72.889336,19.101309,72.889336,,19.08536768,72.89327991,8fa00633-8099-485b-a693-a1295a37247f,f801b179-c4ca-40ce-b957-fdfb8bce8313,MOHD ANSAR,KHAN,045479d4-754b-4b68-b51b-50ff5d9202a3,MH01DR9649,personal_transport,2022-11-18 05:58:11,0,"Chhatrapati Shivaji Maharaj International Airport, Terminal 2, Sahar Airport Rd, Navpada, Vile Parle East, Vile Parle, Mumbai, Maharashtra, India","Chhatrapati Shivaji Maharaj International Airport, Terminal 2, Sahar Airport Rd, Navpada, Vile Parle East, Vile Parle, Mumbai, Maharashtra, India",0.0,rider_cancelled,5,Friday
2022-11-18,215,f801b179-c4ca-40ce-b957-fdfb8bce8313,045479d4-754b-4b68-b51b-50ff5d9202a3,8b20931b-0c97-4b92-88a5-ddb8bb08bd0e,ea8f433f-fc3d-4798-95c0-61b650a896aa,2022-11-18 06:00:14,rider_canceled,False,,19.085587,72.89329,19.124212,72.89329,,19.08550215,72.8935951,ea8f433f-fc3d-4798-95c0-61b650a896aa,f801b179-c4ca-40ce-b957-fdfb8bce8313,MOHD ANSAR,KHAN,045479d4-754b-4b68-b51b-50ff5d9202a3,MH01DR9649,personal_transport,2022-11-18 06:00:14,0,"Shop No 3, Tagore Nagar, Vikhroli, Mumbai, Maharashtra 400083, India","Shop No 3, Tagore Nagar, Vikhroli, Mumbai, Maharashtra 400083, India",0.0,rider_cancelled,6,Friday
2022-11-18,215,f801b179-c4ca-40ce-b957-fdfb8bce8313,045479d4-754b-4b68-b51b-50ff5d9202a3,8b20931b-0c97-4b92-88a5-ddb8bb08bd0e,f0d66e07-4a72-4099-aaf0-918a0414515f,2022-11-18 20:34:58,completed,True,2022-11-18 20:47:32,19.085398,72.91923,19.193043,72.91923,2022-11-18 22:33:43,19.19365,72.837776,f0d66e07-4a72-4099-aaf0-918a0414515f,f801b179-c4ca-40ce-b957-fdfb8bce8313,MOHD ANSAR,KHAN,045479d4-754b-4b68-b51b-50ff5d9202a3,MH01DR9649,personal_transport,2022-11-18 20:34:58,2022-11-18 22:33:43,"B-4, Best Colony, Ghatkopar East, Mumbai, Maharashtra 400075, India","Golden Croft, 155, D'Monte Ln, Malad, Orlem, Kanchpada, Malad West, Mumbai, Maharashtra 400064, India",35.05,completed,20,Friday
2022-11-18,215,f801b179-c4ca-40ce-b957-fdfb8bce8313,045479d4-754b-4b68-b51b-50ff5d9202a3,8b20931b-0c97-4b92-88a5-ddb8bb08bd0e,ac84d98b-e433-4876-b237-f7cc8ed06d32,2022-11-18 22:19:21,completed,True,2022-11-18 22:39:26,19.191753,72.83659,19.280127,72.83659,2022-11-18 23:19:19,19.28024,72.86569,ac84d98b-e433-4876-b237-f7cc8ed06d32,f801b179-c4ca-40ce-b957-fdfb8bce8313,MOHD ANSAR,KHAN,045479d4-754b-4b68-b51b-50ff5d9202a3,MH01DR9649,personal_transport,2022-11-18 22:19:21,2022-11-18 23:19:19,"1, New Link Rd, Malad, Kanchpada, Malad West, Mumbai, Maharashtra 400064, India","101/103, Tanaji Malusare Rd, Shanti Park, Mira Road, Mira Bhayandar, Maharashtra 401107, India",15.59,completed,22,Friday
2022-11-18,215,f801b179-c4ca-40ce-b957-fdfb8bce8313,045479d4-754b-4b68-b51b-50ff5d9202a3,8b20931b-0c97-4b92-88a5-ddb8bb08bd0e,87582db4-9e59-4d47-8a7e-f6e0240ca004,2022-11-18 23:14:31,rider_canceled,True,,19.27939,72.865875,19.056473,72.865875,,19.28024757,72.86568809,87582db4-9e59-4d47-8a7e-f6e0240ca004,f801b179-c4ca-40ce-b957-fdfb8bce8313,MOHD ANSAR,KHAN,045479d4-754b-4b68-b51b-50ff5d9202a3,MH01DR9649,personal_transport,2022-11-18 23:14:31,0,"Plot No. 441, 10th Rd, Chembur Gaothan, Chembur, Mumbai, Maharashtra 400071, India","Plot No. 441, 10th Rd, Chembur Gaothan, Chembur, Mumbai, Maharashtra 400071, India",0.0,rider_cancelled,23,Friday
2022-11-18,215,f801b179-c4ca-40ce-b957-fdfb8bce8313,045479d4-754b-4b68-b51b-50ff5d9202a3,8b20931b-0c97-4b92-88a5-ddb8bb08bd0e,83a739f4-9b04-468c-866d-1cde28534982,2022-11-18 23:18:27,rider_canceled,True,,19.281172,72.866745,19.273418,72.866745,,19.28169322,72.86735606,83a739f4-9b04-468c-866d-1cde28534982,f801b179-c4ca-40ce-b957-fdfb8bce8313,MOHD ANSAR,KHAN,045479d4-754b-4b68-b51b-50ff5d9202a3,MH01DR9649,personal_transport,2022-11-18 23:18:27,0,"7VFR+898, Kashigaon, Mira Road, Mira Bhayandar, Maharashtra 401107, India","7VFR+898, Kashigaon, Mira Road, Mira Bhayandar, Maharashtra 401107, India",0.0,rider_cancelled,23,Friday
2022-11-18,215,f801b179-c4ca-40ce-b957-fdfb8bce8313,045479d4-754b-4b68-b51b-50ff5d9202a3,8b20931b-0c97-4b92-88a5-ddb8bb08bd0e,863ab09f-b159-4f81-9dd5-cba42c219e73,2022-11-18 23:27:33,completed,True,2022-11-18 23:39:17,19.290144,72.85741,19.383373,72.85741,2022-11-19 00:21:47,19.382977,72.908806,863ab09f-b159-4f81-9dd5-cba42c219e73,f801b179-c4ca-40ce-b957-fdfb8bce8313,MOHD ANSAR,KHAN,045479d4-754b-4b68-b51b-50ff5d9202a3,MH01DR9649,personal_transport,2022-11-18 23:27:33,2022-11-19 00:21:47,"S9, Arzoo Apt, opp. SANA APT, Puja Nagar, Mira Road, Mira Bhayandar, Maharashtra 401107, India","Spanish Residency Garden Rd, Chinchoti, Maharashtra 401208, India",20.72,completed,23,Friday
2022-11-19,215,f801b179-c4ca-40ce-b957-fdfb8bce8313,045479d4-754b-4b68-b51b-50ff5d9202a3,8b20931b-0c97-4b92-88a5-ddb8bb08bd0e,40b891ab-4100-42cb-92ce-4b303005186e,2022-11-19 03:34:03,completed,True,2022-11-19 03:44:59,19.265331,72.89395,19.206495,72.89395,2022-11-19 04:42:02,19.206459,72.973145,40b891ab-4100-42cb-92ce-4b303005186e,f801b179-c4ca-40ce-b957-fdfb8bce8313,MOHD ANSAR,KHAN,045479d4-754b-4b68-b51b-50ff5d9202a3,MH01DR9649,personal_transport,2022-11-19 03:34:03,2022-11-19 04:42:02,"Western Express Highway, 1, Jari Mari Mandir Rd, Kashigaon, Mira Road, Mira Bhayandar, Maharashtra 401107, India","Flower Valley Complex, Building, No 7, Eastern Express Hwy, near Runwal Nagar, near Cadbury Junction, Runwal Nagar, Thane West, Thane, Maharashtra 400601, India",21.21,completed,3,Saturday
