day_b,city_id,driver_uuid,vehicle_uuid,partner_uuid,uuid,request_timestamp_local,status,is_cash_trip,begintrip_timestamp_local,begintrip_lat,begintrip_lng,destination_lat,destination_lng,dropoff_timestamp_local,dropoff_lat,dropoff_lng,Trip UUID,Driver UUID,Driver first name,Driver surname,Vehicle UUID,Number plate,Service type,Trip request time,Trip drop-off time,Pick-up address,Drop-off address,Trip distance,Trip status,Hour,DayOfWeek
2022-11-18,215,fd92f6bd-bda4-4dd4-8165-61194f2e007d,a80d3d88-074a-480a-94e8-2c784c55a0ad,ca90c852-163d-4543-8293-9e134e7b190d,0c13d35b-a776-4a40-90d1-f33125757e8c,2022-11-18 12:22:17,rider_canceled,False,,19.029165,73.10476,19.06939,73.10476,,19.02919137,73.10482216,0c13d35b-a776-4a40-90d1-f33125757e8c,fd92f6bd-bda4-4dd4-8165-61194f2e007d,manjoor,bawde,a80d3d88-074a-480a-94e8-2c784c55a0ad,MH01DR4376,personal_transport,2022-11-18 12:22:17,0,"Lokmanya Tilak Terminus Railway Yard, Kurla, Mumbai, Maharashtra, India","Lokmanya Tilak Terminus Railway Yard, Kurla, Mumbai, Maharashtra, India",0.0,rider_cancelled,12,Friday
2022-11-18,215,fd92f6bd-bda4-4dd4-8165-61194f2e007d,a80d3d88-074a-480a-94e8-2c784c55a0ad,ca90c852-163d-4543-8293-9e134e7b190d,98c7de06-b404-45ff-a8de-ed027a046415,2022-11-18 12:22:59,completed,False,2022-11-18 12:38:08,19.018963,73.09532,19.07327,73.09532,2022-11-18 13:02:11,19.073254,73.03019,98c7de06-b404-45ff-a8de-ed027a046415,fd92f6bd-bda4-4dd4-8165-61194f2e007d,manjoor,bawde,a80d3d88-074a-480a-94e8-2c784c55a0ad,MH01DR4376,personal_transport,2022-11-18 12:22:59,2022-11-18 13:02:11,"SHOP NO.1-4, TRIMURTI ENCLAVE, PLOT NO-6, Sector 9, Kamothe, KHANDESHWAR, Navi Mumbai, Maharashtra 410209, India","Plot No. D - 58, TTC Industrial Estate, Between Igloo & Amul Milk Dairy, Turbhe MIDC, Navi Mumbai, Maharashtra 400705, India",14.39,completed,12,Friday
2022-11-18,215,fd92f6bd-bda4-4dd4-8165-61194f2e007d,a80d3d88-074a-480a-94e8-2c784c55a0ad,ca90c852-163d-4543-8293-9e134e7b190d,6afe1a67-d31c-40a0-9121-99a463470615,2022-11-18 12:56:58,completed,False,2022-11-18 13:10:45,19.063032,73.02878,19.06836,73.02878,2022-11-18 14:51:55,19.0994,73.01814,6afe1a67-d31c-40a0-9121-99a463470615,fd92f6bd-bda4-4dd4-8165-61194f2e007d,manjoor,bawde,a80d3d88-074a-480a-94e8-2c784c55a0ad,MH01DR4376,personal_transport,2022-11-18 12:56:58,2022-11-18 14:51:55,"D-33, Turbhe Midc Rd, TTC Industrial Area, MIDC Industrial Area, Turbhe, Navi Mumbai, Maharashtra 400705, India","Prasol, house plot no a, 17/2/3, Thane - Belapur Rd, TTC Industrial Area, MIDC Industrial Area, Kopar Khairane, Navi Mumbai, Maharashtra 400710, India",46.76,completed,12,Friday
2022-11-18,215,fd92f6bd-bda4-4dd4-8165-61194f2e007d,a80d3d88-074a-480a-94e8-2c784c55a0ad,ca90c852-163d-4543-8293-9e134e7b190d,8017c3a1-96f1-48b9-9453-78abc36332ba,2022-11-18 15:21:28,completed,False,2022-11-18 15:38:52,19.09068,73.008965,19.064224,73.008965,2022-11-18 16:46:07,19.063873,72.841805,8017c3a1-96f1-48b9-9453-78abc36332ba,fd92f6bd-bda4-4dd4-8165-61194f2e007d,manjoor,bawde,a80d3d88-074a-480a-94e8-2c784c55a0ad,MH01DR4376,personal_transport,2022-11-18 15:21:28,2022-11-18 16:46:07,"158, Sector 29 Vashi Rd, Krushnakunj, Sector 28, Vashi, Navi Mumbai, Maharashtra 400703, India","Bandra Terminus, Naupada, Bandra East, Mumbai, Maharashtra 400051, India",24.07,completed,15,Friday
2022-11-18,215,fd92f6bd-bda4-4dd4-8165-61194f2e007d,a80d3d88-074a-480a-94e8-2c784c55a0ad,ca90c852-163d-4543-8293-9e134e7b190d,9f38ee66-ab83-4c32-954d-6d39e7ac8060,2022-11-18 21:08:35,rider_canceled,False,,19.21234,72.960175,19.198181,72.960175,,19.21171808,72.96068275,9f38ee66-ab83-4c32-954d-6d39e7ac8060,fd92f6bd-bda4-4dd4-8165-61194f2e007d,manjoor,bawde,a80d3d88-074a-480a-94e8-2c784c55a0ad,MH01DR4376,personal_transport,2022-11-18 21:08:35,0,"shree complex, sonar pada opp sai baba temple Kalyan shill rd,, Kalyan - Shilphata Rd, Sonar Pada, Dombivli East, Dombivli, Maharashtra 421201, India","shree complex, sonar pada opp sai baba temple Kalyan shill rd,, Kalyan - Shilphata Rd, Sonar Pada, Dombivli East, Dombivli, Maharashtra 421201, India",0.0,rider_cancelled,21,Friday
2022-11-18,215,fd92f6bd-bda4-4dd4-8165-61194f2e007d,a80d3d88-074a-480a-94e8-2c784c55a0ad,ca90c852-163d-4543-8293-9e134e7b190d,89ca776c-df7b-473b-bfa6-ffbeab972b84,2022-11-18 21:25:32,completed,False,2022-11-18 21:42:16,19.18965,72.948006,19.08168,72.948006,2022-11-18 23:26:35,19.081675,73.11228,89ca776c-df7b-473b-bfa6-ffbeab972b84,fd92f6bd-bda4-4dd4-8165-61194f2e007d,manjoor,bawde,a80d3d88-074a-480a-94e8-2c784c55a0ad,MH01DR4376,personal_transport,2022-11-18 21:25:32,2022-11-18 23:26:35,"Sai Sadan Building, Kisana Nagar Rd, Kisan Nagar, Thane West, Thane, Maharashtra 400604, India","Arihant Anaika Wing-B3, Ghotkamp Koyana Vele, Taloja, Koyana Velhe, Maharashtra 410208, India",43.6,completed,21,Friday
